歌名,歌手,曲风,推荐标签,语种,BPM,乐评
剑心,张杰、,原声带-电视剧原声、,热血、抒情、动感、爱情、KTV、,国语,77,张杰演唱的《剑心》深得人心，他本身高亢嘹亮的声线很适合这种曲风，饱含炽热情感的歌声虏获了所有观众的心，让这首歌成为了经典。
年轮说,杨丞琳、,流行-华语流行、,抒情、,国语,73,这首歌的歌词可以说是锦上添花的最佳案例了，数字意象递进层层勾勒出了我们爱而不得的那些甜蜜和苦涩，一首歌尽，脑海里像过电影一般放映...真所谓“开过心的开心，过不去的过去”。
一个人想著一个人,曾沛慈、,原声带-电视剧原声、流行-华语流行、,抒情、,国语,67,
听,张杰、,原声带-电视剧原声、流行-华语流行、,抒情、悲伤、爱情、孤独、,国语,65,
光棍,胡歌、,原声带-电视剧原声、流行-华语流行、,快乐、正能量、,国语,132,从这歌词里就可以感受这轻松欢快的感觉，让人不自觉的放弃一些杂念，沉浸在这其中享受这自由自在的感觉。
答应不爱你,郑中基、,原声带-电视剧原声、流行-华语流行、,抒情、悲伤、KTV、,国语,65,我很喜欢这首歌的前奏，曾经无数次地靠在墙上，一遍又一遍地听，像是离别的声音。在那个夏天，我淋过最大的一场雨，就是你在烈日下的不回头。
想你的365天,李玟、,原声带-电影原声、流行-华语流行、,抒情、悲伤、爱情、思念、婚礼、,国语,101,
我做我的王,兄弟联、,原声带-电视剧原声、,热血、动感、快乐、活力、KTV、,国语,121,
须尽欢(DJ弹鼓版),陈一泽、,慢摇DJ-慢摇、,动感、活力、,国语,123,
刀剑如梦,周华健、,原声带-电视剧原声、流行-华语流行、,热血、抒情、动感、洒脱、,国语,133,
永远永远,李翊君、,流行-华语流行、,热血、抒情、动感、悲伤、KTV、,国语,124,
狂风卷奔云飙,黄国俊、江得胜、,原声带-电视剧原声、,热血、动感、,国语,103,
黑色契约,杜德伟、,原声带-电视剧原声、流行-华语流行、,动感、爱情、浪漫、,国语,105,
对望,林志颖、,原声带-电视剧原声、流行-华语流行、,抒情、,国语,122,
千百年后谁还记得谁,韩磊、,流行、,KTV、,国语,113,
相思,毛阿敏、,原声带-电视剧原声、国风-国风流行、,抒情、,国语,100,这首歌的深意是人与人之间相思的痛苦与相聚的开心，两种极端的情绪所产生的的情愫。整首歌在歌名周围表达了“相思”，一种先进而细腻的情感。显出不屑一顾的样子词作者在歌词中用了两个“最多”的词来强调语气，但这实际上是一种讽刺，这只是表明相思是最难忘的感觉。
爱疯头,罗志祥、,流行-华语流行、,热血、动感、活力、,国语,101,
苦茶 (feat. 黑涩会美眉),棒棒堂、黑Girl、,原声带-电视剧原声、,甜蜜、抒情、爱情、思念、浪漫、放松、KTV、,国语,60,
北极星的眼泪,张栋梁、,原声带-电视剧原声、流行-华语流行、,抒情、悲伤、,国语,63,歌曲的创作口吻像是借助北极星这一“永恒”，来传递对“昨天”的怀念和“明天”的期待。“断了弦”意为决裂，“流星”意为希望，不可变的“昨天”和未来临的“明天”相对应，而引出“北极星”这一永恒的意象来表达“想念”。
小乌龟,张栋梁、,原声带-电视剧原声、流行-华语流行、,甜蜜、抒情、可爱、快乐、爱情、放松、KTV、,国语,83,
爱的勇气,赖雅妍、,原声带-电视剧原声、流行-华语流行、,热血、动感、可爱、快乐、放松、治愈、KTV、婚礼、,国语,127,
感动天感动地,宇桐非、,原声带-电视剧原声、流行-华语流行、,悲伤、爱情、KTV、,国语,120,一首歌拉回从前的感觉。以前并没有把这首歌放在心上。现在一个人在异乡生活学习，听到这首歌，想到故乡。但故乡，早就不复存在，只剩这些情怀。
黄种人,谢霆锋、,流行-华语流行、,热血、抒情、动感、,国语,70,
指纹,胡歌、,原声带-电视剧原声、流行-华语流行、,,国语,64,整首歌气氛温馨，高潮的地方又徐徐上升，很能鼓舞士气
这样爱了,张婧、,原声带-电视剧原声、流行-华语流行、,,国语,67,这首歌，最爱开头和结尾。喜欢前奏里玉儿望着大漠的天空，张烈望着玉儿的眼神，玉儿的笑容和张烈的眼神交融延伸，足以停止时光的流转。喜欢玉儿和靖仇在沙漠小丘上相拥，喜欢靖仇释怀和玉儿的不舍。喜欢那一句我会在下一世等你，看那温暖晨曦的誓言。
情非得已,庾澄庆、,原声带-电视剧原声、流行-华语流行、,抒情、KTV、婚礼、,国语,106,歌曲节奏轻快，节奏鲜明，副歌部分让人印象深刻，巧妙融合转音。
爱转角,罗志祥、,原声带-电视剧原声、流行-华语流行、,,国语,73,
一笑倾城,汪苏泷、,原声带-电视剧原声、流行-华语流行、,甜蜜、抒情、悲伤、快乐、爱情、思念、婚礼、轻快、正能量、,国语,117,"《一笑倾城》的伴奏像一股小溪源源不断地进入耳廓，然后涌入脑海，最后直入心间，尤其是刚开头的那一小段，好优美，整首歌曲在汪苏泷的演唱下仿佛塑造了那""一笑倾人城，在笑倾人国”的佳人形象，给人留下了美美的回忆。"
千古,阿兰、,原声带-电视剧原声、,抒情、悲伤、KTV、,国语,76,
心之火,F.I.R.、彭佳慧、,原声带-电视剧原声、流行-华语流行、,抒情、,国语,69,喜欢彭佳慧演绎这首歌的感觉，能高能低，高，但不冲破天际，不喊破大天。低，但不坠入谷底，却依然保有深情。是不吐不快，但有节制的呐喊，就好像人生中对感情的控制，这样的度才有安全感。
烟雨濛濛,古巨基、,原声带-电视剧原声、,抒情、,国语,88,
流星雨,F4、,原声带-电视剧原声、流行-华语流行、,甜蜜、抒情、幸福、快乐、爱情、思念、慵懒、浪漫、放松、婚礼、,国语,67,21世纪初，凭偶像剧《流星花园》爆红，F4成为炙手可热的亚洲宠儿。演而优则唱，成功举办多场大型世界巡回演唱会，横扫各大音乐颁奖礼重大奖项，影响力触及华人地区及亚洲各地，受到国际媒体的重点报导。十年来在日韩及东南亚的人气地位屹立不倒，昔日创下的无数华人纪录至今无人可破。
忘记时间（伴奏）,Chanlex、,,抒情、放松、,国语,131,
Impossible,Two Steps From Hell、,原声带-史诗音乐、,热血、动感、紧张、放松、神秘、正直、正能量、激烈、大气、,纯音乐,89,
Hey Kong (Live),KEY.L刘聪、,原声带-综艺原声、嘻哈说唱-中文嘻哈、,抒情、悲伤、思念、,国语,89,前奏的钢琴，有种夏天闷热的风带着这个季节特有的花露水味，迎面吹来的感觉。 ​
Melody (Original mix),Ash、,电子-深浩室舞曲、电子-中速节奏、,放松、,英语,103,前奏像是在深海中的教堂遗迹里一步步登上台阶，周围环绕着鲾鲼和鱼群，人声响起时仿佛看到了曾经在这里传教的神父，似乎听到了圣歌团的演奏，在这种氛围下向上看去，教堂的穹顶早已坍塌，透过圆形的漏洞可以看到海面上的白色光，接着被一种奇妙力量慢慢送到海面，然后飞向天空，飞向皎月
寒鸦少年,华晨宇、,流行-华语流行、,热血、抒情、动感、悲伤、爱情、思念、活力、孤独、黑暗、正能量、,国语,77,这首歌的设计延续了黑暗独立的风格，寒色中露出华晨宇的凌冽双眼 ，如火般灼烧着没有色彩的黑白画面，张力十足的曲调对情感和唱功的要求非常高。
Victory,Two Steps From Hell、,原声带-史诗音乐、,KTV、正直、正能量、激烈、大气、极限运动、举铁、,英语,120,歌曲的前奏较为平缓，而后逐渐开始走向高潮，女声吟唱烘托出一种宏伟的气氛。整首歌曲犹如一首恢弘的史诗，给人以力量。
Just Believe,顽童MJ116、,嘻哈说唱-中文嘻哈、,热血、动感、酒吧、正能量、,国语,91,
My Man,Jony J、,嘻哈说唱、,抒情、动感、快乐、爱情、思念、浪漫、学习、酒吧、正能量、,国语,114,听着歌词里特实际的人情世故，用来写歌的灵感也经常自给自足，那摔碎的酒杯和酒鬼闯的事故，都能联想到山上的树丛泥土
Future Funk,Varien、,电子、,热血、抒情、动感、梦幻、思念、活力、放松、篮球、正直、正能量、激烈、,纯音乐,100,好大气的旋律，感觉回到了梦里，穿着黑色大风衣，脚踏人字拖，头戴草帽，最叼着这世界上最…便宜的香烟，挪着世界上最优美有点浮夸的猫步，穿梭在那茫茫人海的街道…隔壁那条挤都挤不进去的小巷子里头，真是让人十分的享受
飘向北方 (Live),那吾克热-NW、尤长靖、,原声带-综艺原声、嘻哈说唱-流行说唱、嘻哈说唱-硬核说唱、,热血、抒情、动感、思念、活力、憧憬、洒脱、正能量、,国语,85,前奏的低音浅唱，仿佛是在诉说心酸与不易，结尾的炸裂高音，就像是与一路的不公与失败抵抗，力与美的结合，两人都唱出了真实情感，这样的歌才最真实，每次听脑子里有无数画面，戳中内心了。
攀登 (Live),潘玮柏、G.E.M.邓紫棋、艾热 AIR、,嘻哈说唱-硬核说唱、,热血、动感、悲伤、爱情、活力、孤独、正能量、,国语,90,
Icarus,Ivan Torrent、,新世纪、,正能量、正直、,纯音乐,69,
相信自己,零点乐队、,摇滚-流行摇滚、,热血、动感、活力、KTV、洒脱、正能量、大气、,国语,117,管弦与摇滚的战争，吉他与提琴的炫技，如飓风一般狂飙，宏伟，也只有蝎子的主唱那独特的声线能在这场飓风中稳住。 
我相信,杨培安、,流行-华语流行、,热血、动感、活力、放松、KTV、正能量、极限运动、,国语,111,
美丽世界的孤儿,汪峰、,摇滚、,热血、抒情、动感、悲伤、放松、孤独、KTV、旅游、正能量、,国语,119,
礼物,老狼、汪峰、周晓鸥、丁武、栾树、高旗、李延亮、马上又、陈劲、,摇滚、原声带-综艺原声、,热血、抒情、动感、悲伤、放松、治愈、正直、正能量、友情、遗憾、感人、,国语,125,
骄傲的少年,王俊凯、刘昊然、董子健、张一山、王大陆、,流行-华语流行、,学习、正能量、,国语,84,
蓝莲花,许巍、,摇滚-民谣摇滚、,KTV、旅游、正能量、,国语,90,
花火,汪峰、,摇滚、,热血、抒情、动感、放松、KTV、正能量、,国语,120,
我们不一样,大壮、,,KTV、热血、动感、正能量、抒情、悲伤、旅游、极限运动、爱情、,国语,69,
爱拼才会赢,叶启田、,流行-闽南语流行、,热血、抒情、动感、思念、正能量、,闽南语,84,不知为何，一听到这个旋律就仿佛自己漫步七八十年代的台北街头一样，流行和怀旧并存的感觉真好
从头再来 (Live),刘欢、,流行-华语流行、,热血、抒情、动感、悲伤、正能量、,国语,141,
高飞,张杰、,流行-华语流行、,热血、抒情、动感、爱情、思念、正能量、,国语,85,
水木道,宿涵、Swang多雷、,国风-国风嘻哈、嘻哈说唱、,动感、活力、正能量、,国语,98,
天下,张杰、,国风-国风流行、国风-国风嘻哈、,热血、抒情、动感、悲伤、爱情、思念、苦情、孤独、正能量、,国语,71,张杰用激昂而不失柔情的演绎将一段不爱江山爱美人的侠骨柔情表达得淋漓尽致，从壮志凌云到儿女情长，歌声中有压抑、柔情、暴烈和坚毅。歌曲的过渡段采用了一整段中国式的rap，体现了中国诗词般特有的节奏感和韵律感，也让这首歌在许多类似的作品中显得有些与众不同。
风雨彩虹铿锵玫瑰,田震、,流行-华语流行、,热血、抒情、动感、KTV、正能量、,国语,91,
野子 (Live),苏运莹、,原声带-综艺原声、流行-华语流行、,抒情、悲伤、爱情、孤独、KTV、酒吧、正能量、,国语,74,伴奏不软啊，前奏空灵，能感受到刮起大风的原野之旷阔，高潮激昂，可以感受到主人公任风吹无所畏惧的勇气，结尾轻盈，表现主人公激昂后渐渐趋于平静，陷入思索，把前面唱过的话记在心里，这首歌不错，希望你可以认真听听
没有到不了的地方,魏晨、,流行-华语流行、,爱情、正能量、,国语,90,
我的未来不是梦 (Live),张杰、,原声带-综艺原声、流行、,热血、动感、正能量、,国语,63,
漫步人生路,邓丽君、,流行-粤语流行、,抒情、悲伤、快乐、爱情、思念、苦情、放松、孤独、KTV、旅游、轻快、洒脱、正能量、遗憾、,粤语,89,这首歌真的是教科书级别的柔中带刚，无论是嗓音编曲还是歌词都是看似轻描淡写轻柔委婉，实则大气磅礴极有风骨
孙浩雨 - 生命之枪（YT_Official remix）,DJ小鱼儿(官方)、,慢摇DJ-中文DJ、,正能量、,国语,128,
平凡先生,贺一航、,流行-华语流行、,热血、动感、悲伤、放松、酒吧、正能量、,国语,123,
男儿当自强,林子祥、,原声带-电影原声、流行-粤语流行、,热血、动感、正能量、,粤语,119,细听后才发现配乐气势澎湃，极具中国千年历史底蕴。歌词让人既有报效国家的远赴，又给人奋发向上保卫家园的动力，激励人人要自强不息。鬼才沾叔的词，阿lam异于常人的爆发力，曲中的大鼓、杨琴、唢呐、笛子、琵琶等中国风乐器将主旋律透过感官直达心底，绝对是粤语歌坛空前绝后的经典之作。
扶摇,阿杰729、苏尚卿、,原声带-广播剧原声、国风-古风、,悲伤、抒情、孤独、,国语,105,
撒野,奇然、沈谧仁、,原声带-广播剧原声、流行-华语流行、,抒情、动感、幸福、悲伤、快乐、爱情、思念、放松、憧憬、治愈、孤独、洒脱、感人、,国语,110,感觉这版感情更激扬丰富，第一段像是在思考，有顾飞的温柔、期望和顾虑，有看到一点光亮的希望，低低的诉说。第二段情绪更高昂，像是努力冲破禁锢的挣扎，放肆撒野奔跑的力量，一脚踏空之后又踩实的爆发，仿佛能感受到他跟丞哥一起飞奔在草原冲着天空呐喊的洒脱。
【竹木狼马——记张夏】共余生,妖卿yoky、,流行、,悲伤、抒情、,国语,,
刻疤,明昭、,轻音乐、,平静、放松、学习、,华语,,
解药,余佳运、,原声带-广播剧原声、,甜蜜、抒情、悲伤、爱情、苦情、放松、孤独、,国语,68,
北行见溪——priest《七爷》原创曲,唯安、释念成空、,国风、中国音乐、,抒情、KTV、,华语,,
入戏（金刚圈《明日星程》原创同人曲）纯歌版,明宗越Artemis、冽冽、晏来兮Ayan、,二次元-同人作品、,抒情、KTV、悲伤、,国语,58,
万物朝生——记Priest《默读》,子无余、严书、,国风-古风、,抒情、悲伤、思念、KTV、,国语,63,
许我人间——记priest《默读》,严书、木延觉、尾杓、,二次元-同人作品、,抒情、悲伤、思念、,华语,70,
别来无恙,景向谁依、,流行、,抒情、动感、酒吧、,国语,99,
默读,任然、,原声带-广播剧原声、流行-华语流行、,抒情、悲伤、爱情、浪漫、KTV、,国语,84,
《以沫》——默读广播剧主题曲,奇然、小魂、,原声带-广播剧原声、流行-华语流行、,抒情、悲伤、爱情、思念、苦情、孤独、,国语,64,
我从冬天走来,江镜Lea、严书、,二次元-同人原创、,抒情、悲伤、,国语,92,
你与人间—priest《默读》舟渡同人曲,予珏、,流行-华语流行、,抒情、KTV、亲情、,国语,,
爱锋——记priest《默读》,花心Bryce、秦稚酒、,流行、,悲伤、抒情、思念、,国语,121,
星港剧情版——默读广播剧主题曲II,奇然、小魂、,原声带-广播剧原声、流行-华语流行、,抒情、爱情、,国语,119,
一念成痴,严书、木延觉、,流行、,KTV、悲伤、抒情、孤独、,华语,,
暗河,冯佳界、,摇滚-民谣摇滚、,热血、动感、悲伤、放松、孤独、旅游、,国语,105,
慰平生（记Priest《杀破狼》）,Smile_小千、江南诚、,国风-国风流行、,抒情、,国语,139,
《杀破狼》广播剧主题曲－月若流金,阿杰729、,原声带-广播剧原声、国风-古风、,抒情、悲伤、爱情、,国语,87,
扶摇——记priest《六爻》,萧清明、楚曌岚、,二次元-同人作品、国风-古风、,抒情、快乐、爱情、思念、,国语,60,
《逍遥游》——priest《六爻》如椿同人歌【纯歌版】（翻自 花千诚）,叶天宇、汤剑tj、阿城Yajima、谢江秋、唯安、,国风、,抒情、,华语,71,
【剧情版】扶摇千秋•记Priest《六爻》,尘韵清魂原创音乐团队、何以君默、苏少安、Boerhevan、,国风、,可爱、快乐、放松、治愈、KTV、,国语,,
破云,琴酒蜀黍、西街豆腐君、柳明卿、大彻、圈同学、云三、汉英词典典典、岚之调、,国风-古风、流行、中国音乐、,抒情、悲伤、思念、KTV、,国语,54,
破云,八三夭、,摇滚-独立摇滚、,热血、抒情、动感、爱情、正能量、,国语,87,
意外相遇——淮上家主团联动同人曲（纯歌版）,陆楠山_、O2O男团、,流行-华语流行、,动感、活力、,国语,139,
【破云·峫停】荆途遇你 {剧情版}（翻自 洪卓立）,晨栀、佑旻yomi、眠泱、,流行、,抒情、悲伤、,国语,65,
停云（剧情版）,晃儿、安澈、,国风-古风、流行、中国音乐、,KTV、抒情、悲伤、思念、,华语,84,
《逆风》——广播剧《破云》主题曲,Mario、,原声带-广播剧原声、流行-华语流行、,热血、抒情、动感、爱情、活力、放松、KTV、,国语,110,
我心上住着一座长安城（剧情版）,KBShinya、,国风、流行、,抒情、动感、悲伤、,国语,74,
参商【剧情版】（Cover 不才）,左杭、,流行、,抒情、,华语,,
折枝,坠啦啦、,国风、中国音乐、,抒情、悲伤、思念、KTV、,华语,120,
春秋不尽,五色石南叶、冬子、,国风、中国音乐、,悲伤、抒情、思念、,国语,113,
[剑三] 斩思,流浪的蛙蛙、,国风-古风、中国音乐、,热血、抒情、动感、悲伤、,华语,,
【HiDiix伦桑】寒衣不度（剧情版）——剑三虐心同人歌,嗨的HiDii国乐团、伦桑、,二次元、国风-古风、中国音乐、,抒情、悲伤、,国语,,
Drunk,刘兆伦、,二次元-同人作品、,抒情、动感、爱情、,国语,85,
千丈—《AWM》广播剧主题曲,裘德、,原声带-广播剧原声、流行-华语流行、,热血、动感、紧张、爱情、,国语,157,
无意之间,Mario、俺酱、,原声带-广播剧原声、流行-华语流行、,动感、快乐、爱情、活力、放松、治愈、酒吧、洒脱、正能量、,国语,120,
Semper.Fi（纯歌版）,慕思客MUSIC、羊仔、卡修Rui、,流行-华语流行、,抒情、放松、酒吧、,国语,79,
秦淮梦,钟祺源、,国风-古风、流行、中国音乐、,抒情、悲伤、思念、KTV、,国语,76,
不期而遇1930,钟祺源、,流行-华语流行、,抒情、悲伤、孤独、,国语,71,
情似如故（翻自 洪卓立）,鱼子御、,流行、,抒情、悲伤、孤独、KTV、,国语,65,
狂读 - 记Priest《坏道》,霜穗、,国风-古风、流行、中国音乐、,抒情、悲伤、孤独、KTV、,国语,,
此醉经年,胡帕帕、,,,,,
生路（剧情版）,T-Tone_小T、咕叽、,流行、,悲伤、抒情、,华语,,
针锋（翻自 金容镇）,漠轻寒、,国风-古风、流行、中国音乐、,热血、抒情、动感、KTV、,国语,99,
过门,卑鄙的菊、,流行-华语流行、,抒情、KTV、,国语,60,
他,舟奕博、,流行-华语流行、,抒情、悲伤、爱情、思念、孤独、,国语,75,
明日少年——记巫哲原著《轻狂》,灿鸩、景向谁依、,二次元-同人作品、流行-华语流行、,抒情、爱情、,国语,68,
【19天】我知道你会来（炸贱/贺顶红）,初见、易世樊花、远皓ZIL、烛火、,二次元-同人作品、流行、,抒情、悲伤、思念、KTV、,华语,94,
少年啊——《19天》原创同人歌,叹息、歌手：幽谷、醉雪、,二次元-同人作品、,抒情、悲伤、思念、,国语,80,
太阳黑子（广播剧《影帝》第二期ED）,-赖柳-、落炎Royin、,国风-古风、流行、中国音乐、,爱情、,国语,129,
一拜天地（剧情版）（翻自 不是Av的Ay君/畅畅酱）,笛呆子囚牛、黄麒Eros、,,抒情、动感、悲伤、,国语,96,
姑妄听之（翻自 刘钊宏）,紫羽、,流行、,,华语,,
喜欢你在身旁（广播剧《落池》ed）（翻自 落炎Royin）,故言小同学、,流行、,抒情、放松、动感、,国语,64,
[天涯客·温周]旧侣 剧情版（Cover 你我）,梨花酒、,国风、流行、中国音乐、,抒情、爱情、,国语,127,
与君归【《二哈和他的白猫师尊》同人曲（纯歌版）】,落炎Royin、月神、,国风-国风流行、,抒情、悲伤、思念、,华语,85,
落拓蓬山复经春——《二哈和他的白猫师尊》原创同人曲,就是那个、花千诚、见风kaze、,二次元-同人作品、,抒情、悲伤、,华语,69,
《共生》歌曲By倒霉死勒&羊仔——共生同名主题曲,羊仔、,流行、,抒情、悲伤、孤独、KTV、,国语,62,
寄人间（广播剧《二哈和他的白猫师尊》概念曲）,魏潇逸、,原声带-广播剧原声、国风-国风流行、,抒情、爱情、放松、KTV、,国语,120,
千里相从,根小八、柏凝、,国风-国风流行、,抒情、,国语,77,
烟火人间（翻自 Braska）,落炎Royin、,流行、,抒情、放松、KTV、,国语,,
奔向——记巫哲《嚣张》,萧清明、花千诚、,二次元-同人作品、流行-华语流行、,抒情、悲伤、爱情、思念、KTV、,国语,120,
《落拓声》——天宝伏妖录群像剧情歌,KenZong、醉雪、陌秋离、李蚊香、雨洛Huge、圈同学、落炎Royin、,国风、中国音乐、,热血、抒情、动感、,国语,84,
淤泥深处的星星,Mario、,流行-华语流行、,抒情、悲伤、KTV、正能量、,国语,65,
故人远归 | 漫漫何其多《当年万里觅封侯》郁赦,落炎Royin、惊弦、茭白、,流行、,抒情、悲伤、KTV、酒吧、,华语,,
良夜尽头——记一十四洲《小蘑菇》,MAD、白目、茭白、,二次元-同人作品、流行、,抒情、悲伤、KTV、,国语,57,
目不转睛,羊仔、景向谁依、,嘻哈说唱-流行说唱、,,国语,96,
【迪奥先生（绿野千鹤）】每一个你都是我最爱的样子（翻自 Yellow Paper）,3F团音乐社、陈樊珈Rika、,流行、,动感、放松、,华语,92,
小夜星悬悬——《碎玉投珠》同人曲,张可宛辰、,流行、,抒情、悲伤、放松、治愈、,国语,138,
玫瑰先生 ——广播剧《碎玉投珠》主题曲,Mario、,原声带-广播剧原声、流行-华语流行、,抒情、平静、爱情、放松、,国语,129,
夏日冰,景向谁依、羊仔、,原声带-广播剧原声、流行-华语流行、,抒情、爱情、思念、,国语,124,
玫瑰信札（剧情版）,7An、了睡安晚、林鹿森、,二次元-同人原创、,抒情、悲伤、,国语,60,
不相同(纯歌版) —— 致priest《过门》,镜予歌、喧笑、,二次元-同人作品、,抒情、KTV、悲伤、,国语,65,
赴火（剧情版）,韩河天、,流行、,KTV、抒情、悲伤、思念、,国语,,
原路风景【剧情版】——《原路看斜阳》同人曲,李蚊香、雨洛Huge、,二次元-同人作品、,抒情、悲伤、思念、KTV、,华语,60,
相逢恰如曾相识——记《穿堂惊掠琵琶声》同人曲,围巾、桃与星晞、,流行、,抒情、悲伤、放松、治愈、KTV、,华语,,
旧堂新檐【剧情版】,以兮、观澜、,国风-古风、,抒情、悲伤、孤独、,国语,183,
似光（广播剧《格格不入》主题曲）,魏潇逸、,原声带-广播剧原声、,抒情、悲伤、爱情、,国语,67,
岁岁照海棠——广播剧《穿堂惊掠琵琶声》主题曲（翻自 将离）,晏来兮Ayan、,流行、,抒情、悲伤、放松、,国语,,
《提灯数风华》———淮上部分作品集群像原创曲,易言、,国风-古风、流行、中国音乐、,爱情、,国语,95,
【原创】白云苍狗（剧情版）——巫哲小说人物群像,灿鸩、刘兆伦、妖扬、楚曌岚、九宫Jokong、狐妖、辞洛、樱花小狼、诺言Jason、,流行、,爱情、,国语,115,
幸逢盛世客-priest全作品群像,乾坤、池年、宁采臣丶在唱歌、南风ZJN、少年霜、管莫书、狐妖、正版Devil、醉雪、兰天力、,二次元-同人原创、,抒情、,国语,114,
【Priest群像】你名（剧情版）（翻自 洛天依）,笙寒、夏未年华、,流行、,爱情、,国语,115,
188男团同人原创《最后是你》人声本家,妙影轻音阁、楚歌同学、苏子凡、Mr.mo、凤冴Sae、大C、吾恩、流浪的蛙蛙、少恭、A路人、楚歌同学、凤冴Sae、,二次元-同人原创、流行-华语流行、,抒情、动感、爱情、活力、,国语,134,
