歌名,歌手,曲风,推荐标签,语种,BPM,乐评
飞逝的梦和时间，无法阻拦我们的爱,聆北夜落、TAVOS、,轻音乐、,梦幻、放松、学习、助眠、,纯音乐,80,
思念的尽头(Piano Ver.),明于此音乐、,流行、,平静、放松、,纯音乐,,
夏新晨,逆时针向、,,,纯音乐,62,
Old Memory,市川淳、,二次元-动漫歌曲、,抒情、幸福、悲伤、平静、快乐、思念、放松、憧憬、治愈、,纯音乐,84,
灯香花明,Stefano、,轻音乐-流行轻音乐、,悲伤、平静、放松、孤独、,纯音乐,59,
凭风念,月下散落出世、,轻音乐、,,纯音乐,142,
雨夏,smile丶轩、,轻音乐、,,纯音乐,73,
夜伤,小vie、,流行、,平静、放松、,纯音乐,80,
冉冬拂晓,紫竹笛韵、,轻音乐、,平静、放松、学习、助眠、,纯音乐,101,
ξ,α·Pav、,轻音乐、,,纯音乐,67,
我将死去,Revol、,流行-华语流行、,悲伤、放松、治愈、孤独、,纯音乐,64,
☾,沙皮、,轻音乐、,悲伤、平静、放松、孤独、助眠、冥想、,纯音乐,64,这个纯音乐太治愈了，好像一切都特别温柔，一切都特别缓慢和小心翼翼，戴上耳机仿佛有人陪在身边哄你入睡之后再小心翼翼的去做其他事情，害怕把你吵醒，就像是温柔的陪伴与爱着你。
簌雪夜,月下散落出世、,轻音乐、,平静、放松、助眠、冥想、,纯音乐,64,
花和你,CMJ、,轻音乐、,放松、,纯音乐,65,
生为冰山，就该淡淡地爱海流、爱风,迟遲、,轻音乐、,,纯音乐,100,
Loveless (Instrumental),山下智久、,轻音乐、,放松、,纯音乐,55,
デート2 (1n Cover),1n、,轻音乐-流行轻音乐、,,纯音乐,122,
夏·烟火,LIKPIA、,轻音乐、,平静、放松、,纯音乐,69,
Last Reincarnation,AniFace、,新世纪、,抒情、清新、动感、梦幻、快乐、活力、放松、,纯音乐,92,
Bloom of Youth,Key Sounds Label、,二次元-游戏音乐、轻音乐、,抒情、平静、快乐、放松、治愈、轻快、感人、,纯音乐,66,这首曲子，前奏仿佛置身于夏日的森林，让人如沐春风，又如潺潺的泉水，感到解脱，自在。
雨道,Otokaze、,电子-缓拍、,可爱、快乐、放松、愤怒、,纯音乐,95,
迷失,傅许、,轻音乐、,悲伤、放松、孤独、学习、助眠、,纯音乐,106,
Merry Christmas Mr. Lawrence,坂本龍一、Jaques Morelenbaum、Judy Kang、,轻音乐、古典、,,纯音乐,98,
Pisces,和弦、,轻音乐、,平静、放松、,纯音乐,60,
if (piano arrange),折倉俊則、,轻音乐、,悲伤、平静、放松、孤独、遗憾、,纯音乐,135,
if you said,A7t1Cus、,,梦幻、可爱、快乐、放松、,纯音乐,57,
雨,M.Graveyard、,新世纪-自然新世纪、,平静、放松、助眠、冥想、,纯音乐,129,
鶯之緒,饭碗的彼岸、,轻音乐、,清新、放松、学习、助眠、,纯音乐,80,
いのちの名前,広橋真紀子、,轻音乐、,,纯音乐,88,很纯粹的钢琴，按下琴键的一声一声敲在心头，温柔却不失力量。能感觉到演奏者弹奏钢琴的投入与动情，很美的一首曲子。前半部感觉到干净与治愈，后续是遗憾。
あの日の川,久石譲、,二次元、,,纯音乐,80,
γ,α·Pav、,轻音乐、,,纯音乐,111,
β,α·Pav、,新世纪-自然新世纪、,,纯音乐,88,这首感觉像是在夏天的一个繁星璀璨的夜晚，听着鸟鸣蝉鸣，小溪流动，闻着林间的新鲜空气，有缓缓地轻柔的风从耳边拂过…两个害羞的情侣牵着手一起缓缓散步的感觉……
City,羽肿、,流行-器乐流行、轻音乐-流行轻音乐、,抒情、清新、平静、放松、憧憬、治愈、,纯音乐,73,很是喜欢前奏，感觉像是躺在春天里，嗅着阳光的味道，轻轻地闭上双眼，转而变换了节奏，又像是进入了夏季，雷雨轰鸣，震彻心扉。听出来了四季的味道，尤以春天最为美丽。
花火が瞬く夜に,羽肿、,轻音乐-流行轻音乐、,抒情、悲伤、平静、梦幻、快乐、思念、放松、憧憬、孤独、轻快、感人、,纯音乐,70,"歌曲开头的烟花有繁华快乐的气氛,但随着音乐响起,它变得凄凉婉转,钢琴声更有悲伤的情调。绚丽的烟火在深沉的夜空中绽放,仿佛传递着某人对世界的祝福与愿望一般,灿烂的烟火持续在空中画出美丽的光景。"
代号鸢·傅融,羊曰、,国风-古风、,平静、放松、,纯音乐,142,
【伴奏】世有长歌-橙光《月色长歌》主题曲,橙光音乐、,,梦幻、放松、治愈、,纯音乐,85,
Hush,草娥、张贤胜、,流行、,动感、活力、,韩语,128,
争年少,镜予歌、喧笑、王师傅王黄豆、,流行、,热血、抒情、动感、悲伤、KTV、,国语,88,
Everytime,CHEN、Punch、,原声带、,抒情、清新、可爱、快乐、放松、婚礼、正能量、,韩语,90,
庭園にて。,acane_madder、,流行-日本流行、,悲伤、梦幻、可爱、快乐、放松、孤独、,日语,79,
不蓝海域,泽典、王贺Ares、,流行-华语流行、,抒情、动感、活力、KTV、,国语,71,
Day by Day (Ver. Heartbreak),BIGBANG、,流行-韩国流行、嘻哈说唱-韩语说唱、,抒情、动感、活力、舞蹈、,韩语,123,韩语的歌有一种极强的诉说感，听着听着就自然而然地被带到歌曲里面的故事里了，真的好爱韩文歌，尤其是bigbang，很励志，很激励人前进，权志龙真的好有才华，爱了爱了
心动轨迹Beat‘s Track,Takuau、,电子、嘻哈说唱、,抒情、可爱、快乐、思念、放松、,纯音乐,89,
どうして (feat. 野田愛実),高瀬統也、野田愛実、,电子、流行-日本流行、,放松、,日语,75,
苏眉,吴雨霏、,流行-粤语流行、,热血、动感、悲伤、苦情、孤独、KTV、,粤语,70,
爱人,莉莉周她说 Lily Chou-Chou Lied、,电子-Electronica、流行-华语流行、,抒情、悲伤、慵懒、放松、酒吧、洒脱、遗憾、,国语,63,
不知深浅,陈恒媛、,流行-华语流行、,抒情、,国语,120,
三文小説,King Gnu、,原声带-电视剧原声、另类/独立、流行-日本流行、,抒情、放松、治愈、,日语,88,
Achilles Come Down,Gang Of Youths、,另类/独立、,抒情、悲伤、放松、,英语,90,
Ticking Away,VALORANT、Grabbitz、bbno$、,原声带-游戏原声、流行-流行舞曲、,热血、抒情、动感、快乐、活力、放松、轻快、激烈、,英语,95,
Running Up That Hill (A Deal With God),Kate Bush、,原声带-电影原声、电子-合成器流行、,热血、抒情、动感、活力、放松、治愈、洒脱、正能量、亲情、友情、感人、,英语,109,《Running Up That Hill (A Deal With God)》是由凯特·布什创作并演唱的一首歌曲，作为单曲于1985年8月5日发行，后收录在凯特·布什的第五张录音室专辑《Hounds of Love》中。该曲的重新混音版本于2012年8月10日发行，后收录在2012年伦敦奥运会闭幕式的原声音乐专辑
Call of Silence x YouSeeBIGGIRL,EYAir、,,,,,
Stay With Me (도깨비 OST Part. 1),V.A.、,原声带-电视剧原声、流行-韩国流行、,平静、放松、,纯音乐,120,
너를 위해 (Live),EXO-CBX、,,,韩语,75,
Into The New World,少女时代、,流行、,动感、可爱、快乐、,韩语,107,
消失的黎明,Babystop_山竹、糯米Nomi、万垒、,流行、,抒情、悲伤、,国语,68,
尘曦,陈洁丽、李培斌l、,原声带-动画片原声、流行、,抒情、思念、,国语,79,
Universe,EXO、,流行-韩国流行、,抒情、悲伤、爱情、,韩语,69,
顺其自然 (Been Through),EXO、,流行-韩国流行、,抒情、动感、快乐、爱情、思念、慵懒、浪漫、活力、放松、憧憬、治愈、,韩语,136,第一次听这首歌的时候，脑子里总是有一个画面，在一个有夕阳波光粼粼的湖边，一个人孤单的走着，无欲无求，没有什么特别的心情，什么都能释怀的感觉。
告白,羽岡佳、,原声带、,可爱、快乐、爱情、浪漫、,纯音乐,117,
鸳鸯债,Uri、喵☆酱、,原声带-游戏原声、国风-国风流行、,抒情、动感、悲伤、思念、苦情、KTV、遗憾、,国语,80,这首歌曲男女合唱，中间电吉他作背景音，有热烈刚猛之感，主旋律二胡有凄凉悲伤之意，可谓刚柔并济。歌词传达了对情感的真挚赞美。纸嫁衣的主题曲虽只有两分钟，但就像其游戏本身一样，虽然体量小，但内容丰富、精巧，皆为心血之作，有匠人之姿。祝这样优秀的团队能够得到应有的支持，蓬勃发展下去！
신비로운 걸,VROMANCE、,原声带、,幸福、快乐、思念、抒情、亲情、清新、洒脱、放松、动感、慵懒、治愈、浪漫、爱情、热血、激烈、轻快、甜蜜、,韩语,133,
风起之时,王子健、,流行、,抒情、悲伤、思念、遗憾、感人、,国语,78,
野火,戾格、,流行-华语流行、,抒情、动感、悲伤、快乐、思念、活力、放松、治愈、轻快、,国语,68,
千年之恋,芝麻Mochi、,流行-华语流行、,抒情、爱情、思念、KTV、,国语,70,这首歌一响起就想起了拉美西斯二世和奈菲尔塔利的故事，从小学的知音漫客开始，就去搜索这本小说，悠世给我带来了一段宏伟壮阔的古埃及烂漫爱情图景。反复看了很多遍，因为这样的故事，非常憧憬能去埃及一次。这首歌每个词句都让我想起拉美西斯二世和奈菲尔塔利经历过的每一个瞬间。
敢归云间宿,三无MarBlue、,二次元-同人原创、,热血、动感、,国语,112,
A.I.N.Y. 爱你,G.E.M.邓紫棋、,流行-华语流行、,抒情、,国语,140,新生代90后创作才女邓紫棋，13岁钢琴八级，会吉他、架子鼓，个人专辑《新的心跳》包揽十首词、十首曲，只专注音乐不拍戏，通晓国语、粤语、英语，25岁完成100场个人演唱会。美国《福布斯》杂志公布2016年度“全球30岁以下最具潜力30名杰出音乐人”排行榜，亚洲地区唯一入选人士
手掌心,丁当、,原声带-电视剧原声、国风-国风流行、,抒情、KTV、悲伤、,国语,73,
Because of You,Josh Vietti、,流行-器乐流行、,,纯音乐,54,大爱这支曲子。轻快悠扬，仿佛阳光轻轻洒在我的羽睫之上，随心所欲，毫无顾忌地肆意。下一秒，你我即将相遇。
ギターと孤独と蒼い惑星,結束バンド、,摇滚-日系摇滚、二次元-动漫歌曲、,热血、动感、悲伤、活力、放松、治愈、孤独、正能量、,日语,193,
打上花火,Daoko、米津玄師、,二次元-动漫主题曲、流行-日本流行、,甜蜜、抒情、清新、动感、幸福、紧张、悲伤、梦幻、快乐、爱情、思念、浪漫、活力、放松、憧憬、治愈、神秘、轻快、感人、,日语,98,歌曲给人很温馨孤单的感觉，在副歌部分又让人开朗了起来，就像面对着绮丽的夜空
Cry For You,AYUSE KOZUE、,流行-日本流行、,动感、幸福、快乐、,日语,96,
An Old Song,MoreanP、,轻音乐、,抒情、悲伤、抑郁、放松、治愈、遗憾、感人、,纯音乐,99,
桃花诀《御剑情缘》主题曲,萧忆情Alex、,国风-国风流行、,热血、抒情、动感、思念、,国语,155,
Endless Tears,CLIFF EDGE、,流行-日本流行、,抒情、清新、可爱、快乐、思念、放松、,日语,99,
离我而去的你,橙光音乐、音乐工坊、,原声带、,悲伤、,纯音乐,,
太陽と向日葵,Flower、,流行-日本流行、,抒情、清新、幸福、悲伤、快乐、思念、放松、,日语,90,
SAKURA,いきものがかり、,流行-日本流行、,抒情、悲伤、爱情、思念、放松、治愈、KTV、,日语,73,第一句一开唱，就好像能看见片片樱花纷纷扬扬，洒满四野，沉醉于樱花雨中不知归路，似乎这就是永不褪去的梦境。
爱殇,小时姑娘、,流行、,抒情、悲伤、爱情、思念、孤独、,国语,71,
Sakura,嵐、,流行-日本流行、,热血、动感、,日语,132,
ハルノユキ from polaris,リリィ、さよなら。、増田俊樹、,流行-日本流行、,热血、抒情、清新、动感、平静、思念、放松、,日语,119,
Picon_ピコン-君の脈で踊りたかった（ShakingHigh / RincolF / 长泽陵川 / 维希 / 无疆ChinKi / 王嘉源 remix）,ShakingHigh、RincolF、长泽陵川、维希、iEkn1hc陳跡、王嘉源、,流行-日本流行、,抒情、悲伤、思念、孤独、,日语,75,
晚夜微雨问海棠,镜予歌、陈亦洺、喧笑、,二次元-同人作品、国风、,抒情、爱情、KTV、正直、感人、,国语,80,
吹灭小山河,国风堂、司南、,国风-古风、,抒情、悲伤、快乐、爱情、思念、放松、KTV、轻快、洒脱、,国语,140,词写得是真的好，韵律平仄重音内涵皆无瑕，配上几乎完美的曲调、司南温柔的音线，真的惊艳到我了
长生诀,西瓜JUN、,国风-古风、,甜蜜、热血、抒情、动感、爱情、思念、KTV、洒脱、,国语,81,和平常低沉深情缠绵古风男声不一样，这位歌手的声音像敢爱敢恨横冲直撞的大男孩，音乐激昂活跃，很喜欢他的声音
天魔策,西瓜JUN、,国风-国风流行、,抒情、动感、思念、KTV、,国语,84,
放枪,Bo Peep、,流行-华语流行、,悲伤、抑郁、,国语,65,
"一期一会《未闻花名》（Cover 茅野愛衣,戸松遥,早見沙織）",周深、,流行-华语流行、,抒情、悲伤、放松、治愈、KTV、,国语,85,
爱在夏天,告五人、,另类/独立-独立流行、,抒情、悲伤、快乐、爱情、思念、浪漫、苦情、放松、酒吧、遗憾、,国语,75,爱在夏天 犬青主唱，用迷人慵懒的嗓音唱着短暂却美好的罗曼史。为潘云安的哥哥潘燕山于19岁时创作的歌曲。当时demo就是由17岁的犬青演唱，而终于在2018年推出正式版本，犬青也用比当年更迷人的声音驾驭这首歌曲，更担任单曲的视觉创作，以粉橘色为基调，将爱在夏天的氛围浓缩在一张水彩手绘的自画像里
半纸心事,国风堂、河图、,国风-国风流行、,抒情、,国语,85,
橙光《末生》朴灿烈角色歌【等不及】（Cover Ailee）,阿YueYue、,国风-古风、中国音乐、,抒情、悲伤、KTV、,国语,89,
나비소녀 (Don't Go),EXO、,流行-韩国流行、,抒情、动感、愤怒、,韩语,77,
蝴蝶少女 (Don't Go),EXO、,流行-流行舞曲、,抒情、活力、动感、KTV、,国语,90,
"Baby, Don't Cry (人鱼的眼泪)",EXO、,流行-华语流行、嘻哈说唱、,热血、抒情、清新、动感、悲伤、梦幻、抑郁、快乐、爱情、思念、浪漫、活力、放松、憧憬、治愈、孤独、正直、轻快、洒脱、大气、遗憾、感人、,国语,138,只听到前奏就被打动，整首旋律就像深蓝色的大海，流淌在心底的深情与悲伤，爱得那么绝决，翻滚在毁灭与重生间毫无保留的深情…最爱这首，却与歌者无关，路人粉
Baby Don't Cry,EXO、,流行-韩国流行、嘻哈说唱-韩语说唱、,抒情、动感、爱情、苦情、活力、,韩语,68,
如果声音不记得,Mochoc、,原声带-电影原声、流行-华语流行、,抒情、悲伤、思念、,国语,69,这首歌我最喜欢的就是它的前奏，像爱情还未相逢，却早已暗示注定遗憾的结局
问情,陈亦洺、尚辰、,国风-国风流行、,抒情、热血、动感、KTV、激烈、,国语,82,陈亦洺、尚辰共同演绎的这首《问情》，收录于2022年2月16日发行的专辑《问情》中，是一首满含江湖气息、侠骨柔情的古风歌曲，悠长旋律中暗藏着澎湃热血，通过古风遒劲昂扬的节奏仿佛能看到英姿飒爽的侠客快意江湖的画面。
万字情诗,JMJ、,流行-华语流行、,抒情、悲伤、爱情、孤独、,国语,128,
去追一只鹿,万象凡音、小时姑娘、,流行-华语流行、,抒情、悲伤、KTV、,国语,103,
沈园外,阿YueYue、戾格、小田音乐社、,国风-国风流行、,抒情、动感、悲伤、爱情、思念、孤独、KTV、家务、通勤、,国语,69,每次听到这首歌都觉得，这是跨越几个世纪的绝美凄恋，好像做了一个冗长的梦，忽然醒来，恍若隔世，想要忘记，却还是与那个人在另一个时空再次相遇，我或许这就是--命运。
飞雪落红尘,KBShinya、三无MarBlue、五音Jw、吾恩、小魂、,二次元-同人作品、,热血、抒情、动感、悲伤、思念、,国语,79,
千梦,Aki阿杰、HITA、,国风-古风、,抒情、悲伤、,国语,87,
回溯-橙光《前男友们求复合》主题曲,舔小喵、橙光音乐、,原声带、,抒情、悲伤、放松、治愈、KTV、,国语,65,
生活在别处的你 Another me,毛不易、中島美嘉、,流行-华语流行、,抒情、悲伤、爱情、思念、苦情、KTV、正能量、,日语,75,毛不易的声音温柔又善解人意，中岛美嘉的声音永远带着坚定和一丝倔强，这首歌就好像是一双温柔又有力的手，把跌倒的人扶起来，又指向光明的前方，鼓励人勇敢的走下去。
入海,毛不易、,流行-华语流行、,抒情、悲伤、,国语,112,巧妙的主歌小调，副歌转大调的设计，搭配歌词意境转换，顿时豁然开朗起来！情绪表达得非常到位！
城市傍晚,毛不易、,民谣-城市民谣、,悲伤、平静、爱情、浪漫、放松、孤独、,国语,115,
愿,毛不易、,流行-华语流行、,,国语,64,
感觉自己是巨星,毛不易、,原声带-电影原声、流行-华语流行、,抒情、快乐、憧憬、,国语,113,
遥远的她 (Live),毛不易、,原声带-综艺原声、流行-粤语流行、,抒情、悲伤、,粤语,72,
南一道街,毛不易、,民谣-流行民谣、,抒情、悲伤、放松、治愈、孤独、KTV、,国语,84,歌词如太阳般温暖，曲调如月光般婉转。毛不易用他独特的嗓音，唱出了岁月漫漫中的陪伴和成长，他用歌声筑起港湾，给予我们抵御风雨的力量！
深夜一角,毛不易、,流行-华语流行、,抒情、悲伤、思念、放松、孤独、,国语,98,一曲听完，仿佛在和自己对话，轻柔低沉磁性的声线，传达的是生活虽然艰难，但是总有柳暗花明又一村的时候，一如既往的毛式温暖。
于是没有洗头,毛不易、,流行-华语流行、,抒情、悲伤、可爱、快乐、孤独、愤怒、,国语,80,
水乡,毛不易、,流行-华语流行、,抒情、悲伤、思念、孤独、,国语,83,这个版本的水乡给人一种身临其境，宛如坐在船上看着眼前的景色。是山，是水，是鹭，是唱不完的远方。悠扬，平静，不急不躁。心中一方净土。
红颜旧 (Live版),毛不易、,原声带-综艺原声、国风、流行-华语流行、,抒情、悲伤、平静、爱情、思念、苦情、放松、感人、,国语,75,
盛夏 (Live),毛不易、龙丹妮、,流行-华语流行、,抒情、悲伤、思念、KTV、,国语,65,
哎哟,毛不易、,流行-华语流行、,动感、可爱、快乐、爱情、活力、放松、婚礼、酒吧、轻快、,国语,179,毛不易温柔的声线，与俄罗斯民歌的浪漫完美融合，仿佛回到歌里，感受少女对爱人的思念。
祝你平安,毛不易、,原声带-电影原声、流行、,,国语,60,
胡同,毛不易、,流行-华语流行、民谣-流行民谣、,抒情、悲伤、快乐、爱情、思念、放松、孤独、轻快、,国语,75,这个好好听，像是荣归故里倚在墙角感受风吹过头顶的柳枝，看深深的巷子里孩子爬树追逐，回忆起自己的童年，将时间定格在这一刻享受而怀念的表情里。
后海没爱情,逍特、,流行、,热血、动感、快乐、轻快、,国语,74,
逍遥游,任东、,民谣、,抒情、悲伤、孤独、KTV、,国语,72,
一如年少模样,陈鸿宇、,民谣-华语民谣、,热血、抒情、动感、悲伤、爱情、思念、放松、孤独、正能量、,国语,76,这首歌给我一种悲凉的秋天的感觉，阴沉的天，空旷的街道，冷风吹着焦黄干枯落叶……好像我自己也是垂暮的状态，在被风吹的轻微摇晃的摇椅里，闭眼睡着逐渐死去。
这场名叫人生的旅途,夏小虎、,民谣-华语民谣、,抒情、悲伤、思念、孤独、旅游、,国语,90,
斑马，斑马,宋冬野、,民谣-华语民谣、,抒情、悲伤、爱情、思念、苦情、放松、治愈、孤独、酒吧、旅游、洒脱、遗憾、,国语,65,"前奏以吉他旋律开启， 主歌旋律好听，感情比较伤感“你的城市没有一扇门为我打开啊，我终究还要回到路上""，间奏用大提琴的低重音铺开，歌曲的感情更深厚，歌曲的品格都得到了提升。副歌让人感动，旋律太好听了，歌词很朴实，比较直白。结尾用小提琴将情绪无限蔓延，在鼓的推动下，让人听到了释怀、淡然"
这一生关于你的风景,枯木逢春、,民谣-华语民谣、,抒情、悲伤、抑郁、快乐、爱情、思念、苦情、孤独、轻快、,国语,98,我以为这首歌出来会是很华丽，没想到颠覆了枯木作词的风格，它很平常，所有的词平常到随时都可以说出口，副歌的“能够把你照亮”完全不输于“陪在你身旁”，很简单的歌词，曲调也很温和，像十八岁时喜欢一个人一样，轻轻一眼就可以红了脸。
夕阳下的歌,夏小虎、,民谣-华语民谣、,抒情、悲伤、孤独、酒吧、旅游、正能量、,国语,84,
走歌人,暗杠、,摇滚-民谣摇滚、,热血、动感、悲伤、爱情、放松、孤独、旅游、正能量、,国语,109,曲调干净利落，仿佛一位青衣侠客，仗剑天涯，煮酒论剑，独自翻过山川，走过大漠，看过喷薄朝阳与孤烟晚霞，然后在林中休憩，点燃篝火，映着火光，来！敬这俗世一杯酒！待到晨光熹微时，再度走向前方。
我的姑娘 她在远方,隔壁老樊、,民谣-流行民谣、,抒情、悲伤、爱情、思念、苦情、放松、孤独、助眠、酒吧、,国语,115,老樊的歌总是那样的耐人寻味，生活中的沧桑在他的嗓音中体现的淋漓尽致，唱出心中的那份冷落
我不是你的宋冬野,林啟得、,民谣、,抒情、悲伤、爱情、思念、孤独、酒吧、正能量、,国语,68,
你的姑娘,隔壁老樊、,民谣-华语民谣、,抒情、悲伤、抑郁、爱情、思念、苦情、放松、孤独、助眠、酒吧、,国语,119,这曲子真的好听，开头用吉他就营造出这种叙事的意境，中间又用了笛子做和弦，有一种隐居山林的闲适。仿佛你坐在亭子里的木凳子上，桌子上摆着饭菜，眺望远方盼着你的姑娘回家……
酒空人醒,李冠霖、,民谣-华语民谣、,抒情、悲伤、爱情、思念、苦情、孤独、酒吧、,国语,115,
亲爱的你 去了何方,陈硕子、,流行-华语流行、民谣、,抒情、悲伤、爱情、思念、苦情、孤独、酒吧、,国语,120,
永垂不朽,任东、,民谣-华语民谣、,抒情、悲伤、爱情、孤独、,国语,88,
我也可以是流浪诗人,好妹妹、,民谣-华语民谣、,抒情、放松、治愈、,国语,69,
觅香,栗先达、,流行-华语流行、民谣、,抒情、悲伤、,国语,71,
董小姐,宋冬野、,民谣-华语民谣、,抒情、悲伤、爱情、思念、慵懒、苦情、放松、憧憬、治愈、孤独、酒吧、遗憾、,国语,57,像微风拂过草地，轻柔的叙说，温暖的嗓音，却能让人心里泛起涟漪。
南风北巷（demo）,邵帅、,民谣-华语民谣、,抒情、悲伤、爱情、思念、放松、孤独、酒吧、,国语,128,好喜欢这首歌里的吉他，很温柔，像流水一样，一点点的拨动着，我的心也随着拨动，声音有些沙哑但很温柔，又有些温暖和悲伤.
有名无份,李冠霖、,民谣-流行民谣、,抒情、悲伤、爱情、思念、苦情、放松、孤独、酒吧、,国语,133,
旧词,愚青、,民谣-华语民谣、,抒情、悲伤、爱情、放松、治愈、孤独、酒吧、,国语,62,淡淡的曲调，古风淡雅的词，独特的女声，清清浅浅的吉他声，适合睡前静静听，适合心烦意乱时平静内心听，适合坐火车看着窗外风景听，适合午后阳光下伴着茶香听，适合两个人一人一只耳塞操场上听。
呓语,蒋卓林、,流行、民谣、,抒情、悲伤、爱情、思念、孤独、,国语,62,
亦是此间少年,枯木逢春、,民谣-流行民谣、,抒情、悲伤、爱情、思念、浪漫、孤独、酒吧、正能量、感人、,国语,103,demo版是感触最深，从心底感受到的那种生长力与奋争力。笛子版仿佛此去经年再回顾，多了一些欢快和释然。这一版在平淡坦然中，有着一如既往的希望，愿沉静自爱，终得所愿！
可能否,木小雅、,民谣-华语民谣、,抒情、悲伤、快乐、思念、慵懒、苦情、放松、孤独、酒吧、,国语,59,木小雅介绍说，《可能否》这首歌最初的灵感源自张枣的一句诗：“只要想起一生中后悔的事 梅花便落满了南山”。这首歌描写的就是人生这种有遗憾的状态：“我们每个人都面临着不断的相遇和错过，一旦错过，就像进入了平行时空，再也不会和自己产生交集。
