歌名,歌手,曲风,推荐标签,语种,BPM,乐评
Time To Love,October、,轻音乐、,抒情、悲伤、平静、放松、治愈、,纯音乐,87,很美的Jazz hiphop，轻快而不焦躁 。行云流水般，澄净，清澈，舒心。浮生若梦的钢琴曲加入Jazz-Hiphop的节奏，思绪跟随旋律飘荡在云端。在这秋日的下午闭上眼睛，任由层层海浪轻轻拍打你疲惫的心灵。慵懒闲适的气氛，适合伴随听者入眠。
纸飞机,钱晨航、,,平静、放松、,纯音乐,86,
8月31日,吴宇深、,轻音乐、,悲伤、平静、放松、孤独、,纯音乐,90,
蝉证序,南极白熊、,国风、,平静、放松、,纯音乐,70,
Touch the starlight,Funton、,,,纯音乐,75,
春思 夏恋 秋梦 冬怀,TAVOS、,轻音乐、,,纯音乐,78,
Light,阿铭、,轻音乐、,平静、放松、助眠、正能量、,纯音乐,108,
为霜,羽肿、,轻音乐-流行轻音乐、,抒情、清新、悲伤、平静、快乐、思念、放松、憧憬、孤独、轻快、,纯音乐,74,淡淡的忧伤，随着的音乐继续，好像整个世界变得清澈，在这个世界里没有烟火气，让人变得都柔和起来。
黑夜,傅许、,轻音乐、,梦幻、放松、,纯音乐,74,
《蝶语》,MT1990、,轻音乐、,放松、治愈、助眠、正能量、,华语,84,
没有人是一座孤岛,傅许、,轻音乐、,放松、治愈、冥想、正能量、,纯音乐,80,
在雨天听别人的晴天,闫东炜、,流行-器乐流行、,活力、动感、梦幻、放松、,纯音乐,103,
여름이 남아있던 자리,7pm、,轻音乐、,正能量、,纯音乐,,
Remember,傅许、,流行、轻音乐、,正能量、,纯音乐,100,
いつまでも,邱有句、Otanmine、,轻音乐、,正能量、,纯音乐,65,
Memory,Otanmine、,慢摇DJ、,正能量、,纯音乐,113,
The blue sky,ImpossibleStudio、,轻音乐、,平静、梦幻、放松、治愈、助眠、,纯音乐,100,
夏,爱喝柠檬茶的喵、,轻音乐-流行轻音乐、,,纯音乐,108,
午后,灰澈、,流行、轻音乐、,清新、平静、可爱、快乐、放松、轻快、正能量、,纯音乐,113,
花空,邱有句、Otanmine、,轻音乐、,,纯音乐,52,
Stay with me,昼夜、,轻音乐-流行轻音乐、,悲伤、平静、放松、助眠、,纯音乐,64,
微风拂过你的脸,Hea2t、,轻音乐、,动感、放松、学习、助眠、,纯音乐,74,
蝴蝶停在指挥棒上,smile丶轩、,轻音乐、,平静、梦幻、放松、,纯音乐,120,
从前,九月橙、九玖橙儿、,轻音乐、,助眠、正能量、,纯音乐,72,
Waiting For You（2020ver.）,明于此音乐、,新世纪、,梦幻、放松、冥想、,纯音乐,88,
Moonlight Lake,饭碗的彼岸、,轻音乐、,平静、放松、学习、助眠、冥想、,纯音乐,75,
Feeling The Rain,MoreanP、,轻音乐-流行轻音乐、,抒情、快乐、放松、治愈、轻快、,纯音乐,90,动人心弦的旋律，如同黑暗里照射进来的一束阳光，温暖着我的心灵。随着音乐的高潮，热烈欢快的曲调使我渐渐振作起来，如同从泥潭中抬起脚来，纵使有着沉重的枷锁，纵使前方大雾弥漫，也义无反顾向前行走。我似乎从黑暗中找到了方向，也如同迷失已久的灵魂找到了温暖的归宿。一个个跳跃的音符带动着我的
Midnight,Xeuphoria、,原声带-电影原声、,平静、放松、学习、助眠、正能量、,纯音乐,136,
婚礼,灰澈、,流行、轻音乐、,平静、放松、学习、婚礼、正能量、,纯音乐,123,
消逝,傅许、,流行-华语流行、轻音乐、,平静、放松、正能量、,纯音乐,90,
夏琪,昼夜、,轻音乐、,平静、放松、助眠、,纯音乐,64,
寻,紫竹笛韵、,,平静、梦幻、放松、助眠、正能量、,纯音乐,105,
六月·梦绕,变奏的梦想、,,抒情、动感、活力、助眠、正能量、,国语,79,
Watch the Pacific,Nicholas Cheung、,电子、流行、,学习、正能量、,纯音乐,90,
Memory Forever,MöSS（阿脏）、,轻音乐、,放松、治愈、助眠、,纯音乐,105,
茧,十指流玉、,流行-器乐流行、,悲伤、平静、梦幻、放松、孤独、,纯音乐,72,
Why Do I Feel Sad,Jayx、,流行-器乐流行、,平静、放松、,纯音乐,65,
Cherish Your Life,Delos、,,放松、,纯音乐,80,
在每天重复的日子里遗失了梦,Chamber橙、,轻音乐、,,纯音乐,75,
The journey of time,月下散落出世、蓝云木、,轻音乐、,放松、治愈、助眠、正能量、,纯音乐,127,
樱,眼中有秋水。、,轻音乐、,放松、治愈、助眠、,纯音乐,92,
七月初一， 你去的地方将是秋日和黄昏,饭碗的彼岸、,轻音乐、,平静、梦幻、放松、助眠、冥想、,纯音乐,118,
归途,四季音色、,轻音乐、,放松、,纯音乐,69,
未发见的心之名(Re Ver.)(Off Vocal),ACK、灰澈、,电子-缓拍、,放松、冥想、,纯音乐,122,
Tomorrow,Czwen、,,可爱、快乐、放松、,纯音乐,120,
转瞬,K kure、,轻音乐-流行轻音乐、,平静、放松、,纯音乐,70,
a fool,Kawin、,轻音乐、,放松、冥想、,纯音乐,66,
Funeral Flowers（格里特 remix）,THT、格里特、,轻音乐、,平静、放松、助眠、冥想、正能量、,纯音乐,64,
昔年,吴宇深、,轻音乐、,抒情、平静、放松、,纯音乐,65,
冬之恋,zss、,世界音乐、,放松、学习、助眠、正能量、,纯音乐,94,
最幸福的事，就是在喜欢你的每一天里，被你喜欢,Hea2t、,流行-器乐流行、,平静、放松、,纯音乐,74,
微风轻起，我喜欢你,马路通、,轻音乐、,平静、放松、学习、,纯音乐,83,
立夏,VIIOX、格里特、,流行、轻音乐、,平静、可爱、快乐、放松、,纯音乐,59,
秋日酷甜粉嫩休闲少女,陶鲁斯Taurus.Y、,电子、,甜蜜、幸福、可爱、快乐、爱情、放松、治愈、轻快、,纯音乐,120,
Hide To Hide,十指流玉、,流行、轻音乐、,悲伤、梦幻、放松、治愈、学习、正能量、,纯音乐,85,
The Road Less Wandered (SYML Rework),Aquilo、SYML、,另类/独立、,,纯音乐,60,
Where am I?,蓝云木、,轻音乐、,可爱、快乐、放松、助眠、,纯音乐,85,
Circulation in summer (Original Mix),cy夜言、,电子、,梦幻、可爱、快乐、放松、正能量、,纯音乐,68,
立夏 伴奏,桑葚上的猴子、,,动感、活力、放松、助眠、,纯音乐,,
Where am I going,夜狼沃增、For丶雨在徘徊、,电子、,梦幻、可爱、快乐、放松、,纯音乐,85,
如烟,清风至、,轻音乐、,平静、放松、学习、助眠、正能量、,纯音乐,57,
The Response,Xeuphoria、,轻音乐、,平静、放松、助眠、正能量、,纯音乐,121,
春之行,灰澈、,轻音乐-流行轻音乐、,清新、梦幻、可爱、快乐、放松、治愈、助眠、轻快、,纯音乐,85,
凉,仁辰、,轻音乐-流行轻音乐、,平静、放松、,纯音乐,93,
忆,吴宇深、,轻音乐、,放松、学习、助眠、,纯音乐,54,
花间游,逆时针向、忘乡、,轻音乐、,快乐、放松、治愈、轻快、,纯音乐,80,
Keep Going - 继续前行,ChakYoun9、,电子-缓拍、,动感、活力、放松、,纯音乐,70,
Touch the Rain,Jannik、,流行、,清新、梦幻、爱情、浪漫、放松、大气、,纯音乐,68,
Light Above The Sky,Delos、,流行、,放松、治愈、,纯音乐,64,
瞬（0.8X）,LUSTN、,流行、,动感、悲伤、活力、,华语,105,
我们都在爱情里少一点天分,CashMoon、,流行-华语流行、,动感、幸福、快乐、,国语,72,
你怎么连话都说不清楚,蔡依林、,流行-华语流行、,抒情、放松、,国语,120,
太阳,CashMoon、,流行-华语流行、,抒情、清新、放松、感人、,国语,75,
我落泪情绪零碎 (0.8x),董小婉、,流行、,悲伤、KTV、抒情、孤独、,华语,53,
BINGBIAN病变（原版）,Cubi、Fi9江澈、Birck、,嘻哈说唱-流行说唱、,抒情、动感、悲伤、爱情、思念、,国语,113,前奏，旋律，声音，歌词，封面，略显奇怪的名字，脑海里想象的画面，我自己赋予的抽象意义。可是到如今，已经忘记了对我来说到底是什么意义。只是在听。偶尔的循环，感受给我带来的独特的意境，犹如失去什么一样，淡淡的忧伤里消沉。
空心,光泽、,流行-华语流行、,抒情、悲伤、放松、治愈、,国语,70,《空心》这首歌是一首分手情歌，整首歌将一“困”字贯穿始终，歌曲无论是从曲调还是歌词上，都传达出一种想追赶却死守尊严的内心抗争，爱而不得，唱出了太多人被爱情困住的一面。光泽用他独特的光式演唱风格，为歌曲注入了刻骨铭心的灵魂，深深揪动着听者。
Call of Silence,Eternal Raijin、,二次元-动漫原声带、电子-驰放低音、电子-陷阱舞曲、,抒情、动感、紧张、悲伤、爱情、思念、浪漫、放松、孤独、神秘、正能量、,英语,115,此歌给我的感受更像是真正的渺小，十年可知生死离别，百年可知王朝更佚，千年则有沧海桑田。人在地球上仰望星空，正如蚂蚁在地上仰望着我们。
无感(纯音乐),纯音乐、,,动感、悲伤、梦幻、抑郁、放松、,纯音乐,88,
中毒,光泽、,流行-华语流行、,抒情、悲伤、爱情、思念、苦情、KTV、,国语,60,光泽歌给人是灰色风格，不听还好，细听一下，突然掉进万丈深渊，不断堕落，多表现自己内心柔软，深情，强忍，可在灰色地带又能保持自己一份坚贞，执着与信念，在黑色心情中寄托一份阳刚，向上的正能量！！光泽，千万不要火啊，人红是非多，就这样，让我们粉丝独享那心底的深渊和柔软，如此甚好！！！
梦醒,handsome lau、HYPEEZY、冯泳、火滚音乐、,流行-粤语流行、,抒情、动感、悲伤、爱情、思念、活力、孤独、酒吧、,粤语,75,听这首歌，都感觉自己在海边吹海风。落日余晖，一个人走过来。从此我的世界不再安静了。可看不清他的脸，若隐若现。
最好的安排,曲婉婷、,流行-华语流行、,抒情、,国语,66,这是我听过最恐怖的音乐！人皮为骨，人骨做梆，筋皮为弦。膏脂燃尽堆出来的音乐，太恐怖了，我听这个音乐感到阵阵阴寒。
遗失的心跳,萧亚轩、,原声带-电影原声、流行-华语流行、,抒情、,国语,126,《遗失的⼼跳》有别于⼀般⼤众⼝⽔情歌，表达了萧亚轩对情感的⼀种态度，即便不爱了，也要有⾃⼰的⽣活，⾃⼰找回⾃⼰遗失的⼼跳。整首歌非常的伤感，诉说着自己失去了某个人就像失去了心跳，回忆却像上了发条一样定期而至，带来心痛和难过，因为这种充满悲伤的氛围非常适合表达每到夜里就会感受到的emo情绪！
如果可以,韦礼安、,流行-华语流行、,抒情、悲伤、爱情、思念、浪漫、苦情、憧憬、KTV、遗憾、感人、,国语,74,大清早上能听到韦礼安的歌曲，多幸运的一件事。他唱歌总给人一种细水流长的感觉。缓慢而悠长的力量，默默充满你的心
或许,LBI利比、,流行-华语流行、,抒情、悲伤、爱情、思念、浪漫、苦情、放松、KTV、,华语,65,乍一听好惊艳的一首歌，但仔细听来满满又是遗憾.好像ta明明就在身边，但怎么也碰不着，追逐了好久，却终究不过是一个人在独自演绎了一场自我感动的戏.
无感,江辰、,嘻哈说唱-中文嘻哈、,甜蜜、抒情、动感、悲伤、抑郁、快乐、爱情、思念、苦情、活力、放松、孤独、酒吧、轻快、遗憾、,国语,124,这首歌的伴奏好神奇，像是在说刚开始的恋爱开心，轻巧，而后消沉，平淡。又像是在说分手后那一瞬间的开心爽快，而后自己默默伤感。
痛快,Aioz、董唧唧、,嘻哈说唱-流行说唱、,抒情、悲伤、快乐、爱情、思念、慵懒、苦情、放松、轻快、,国语,111,这个歌应该在春末夏初的黄昏开着车下班的时候听。微风在脸颊，晚霞在天边。
下雨天,与少年他、芝麻Mochi、,流行-华语流行、,抒情、悲伤、抑郁、爱情、思念、苦情、放松、憧憬、治愈、孤独、KTV、酒吧、遗憾、,韩语,128,声音好好听，好有辨识度，稍稍低哑，含有岁月的沉淀，高音自然舒服，就像在和朋友诉说自己的心痛往事。
我知道,By2、,原声带-电视剧原声、流行-华语流行、,抒情、,国语,115,
独行侠,YKEY、Namunong、,嘻哈说唱-中文嘻哈、,抒情、动感、悲伤、抑郁、苦情、放松、憧憬、孤独、有氧、遗憾、家务、,国语,159,唯爱这首歌伴奏里的钢琴，像是流淌着清冷月光的细流，在午夜房间里不断循环，期望能够汇成清泉，浸润一个人的心田。
不如不见面,梁老师Tsong、彭非凡Gus、,嘻哈说唱-流行说唱、,抒情、动感、悲伤、抑郁、快乐、爱情、思念、苦情、活力、憧憬、孤独、酒吧、洒脱、遗憾、,国语,93,《不如不见面》的前奏一响起来就把我拉回19年的春天：山城的风、乐事的春日限定薯片、小瓶的可口可乐、赶上的樱花展、刚洗完头发发后一个人去公园看的晚霞……前几天有人说它是一首备胎之歌，可它带给我的只是那个春日午后夹杂着洗衣粉香味的风……
先说谎的人,h3R3、,嘻哈说唱-融合说唱、,抒情、悲伤、爱情、思念、憧憬、孤独、正直、洒脱、,国语,118,压抑低沉的旋律，恰到好处地熨贴着颓废思绪，受挫感弥漫开来，甚至变成一种力量。循环这首歌，总想起当下与心之所向之间的差距。“还差得远呢”这句话混合着旋律，不断叩击心灵。“对自己说着算了算了，但梦还在提醒着我”。在梦想与现实之间，先说谎的人，先软弱；先说谎的人，先出局；你我亦在局中。
NUNA 2.0,队长、叶琼琳、,流行-华语流行、,抒情、悲伤、抑郁、爱情、思念、浪漫、苦情、放松、治愈、孤独、洒脱、遗憾、,国语,68,很舒服的一首歌，两个人的声音也很搭，男声声音很温柔，烧酒啤酒兑成两杯这句超级好听，有种娓娓道来的感觉，女声声音很干净清亮，适合坐在湖边吹着晚风听。
狐狸的童话,Santa_SA、马也_Crabbit、,嘻哈说唱-中文嘻哈、,甜蜜、抒情、动感、悲伤、快乐、爱情、思念、浪漫、苦情、放松、酒吧、轻快、正能量、,国语,79,听到这首歌就想到了自己的成长经历，那五彩斑斓的童年和多姿多彩的青春，仿佛又来到了记忆中的那一个个微风吹拂的夏天，蝉声阵阵，夏风轻抚。孩童在嘻闹声中逐渐长大，少年在金色的夕阳下的影子也逐渐拉长，那一段又一段承载着我美好回忆的时光啊，值得我一生怀念！
你走以后,王恩信Est、二胖u（王訫）、,嘻哈说唱-中文嘻哈、,抒情、动感、悲伤、爱情、思念、苦情、活力、酒吧、,国语,85,这首歌的歌词好像在回忆我们所有的故事 感同身受 同样单曲循环 听着旋律好像回到了那年的春夏秋冬
执迷不悟,鱿籽酱、,流行-华语流行、,抒情、悲伤、爱情、思念、苦情、孤独、感人、,国语,131,
寂寞烟火,王贰浪、,流行-华语流行、,抒情、,国语,60,
他只是经过,h3R3、高旭、,嘻哈说唱-流行说唱、,抒情、动感、悲伤、快乐、爱情、思念、浪漫、苦情、活力、放松、孤独、轻快、洒脱、遗憾、,国语,93,适合雨天单曲循环听，嘎嘣脆的编曲和rapper的声线搭配得恰到好处。他只是经过你的世界，并没有停留，突如其来的爱情恰如一场暴风雨，可能留下一地鸡毛，但大多数时候都来去匆匆，不留痕迹。
再见莫妮卡,彭席彦、Franky弗兰奇、,流行-华语流行、嘻哈说唱、,甜蜜、抒情、动感、悲伤、快乐、爱情、思念、活力、憧憬、孤独、酒吧、轻快、有氧、家务、,国语,84,带点爵士风的歌曲，歌词婉转又入骨。女声魅惑优雅配上男声的快节奏说唱，二者的融合碰撞有了别样的感觉。但不得不说女声就撑起了整首歌，这种抓人的声线和旋律，让人忍不住靠近，忍不住多听，忍不住上头。而男声最后又锦上添花，带了些新潮随性的元素融入，让它更立体更完整
i can't,pink glass、,流行-欧美流行、,抒情、动感、悲伤、爱情、慵懒、浪漫、活力、放松、孤独、遗憾、,英语,99,
女儿国 (Live),摩登兄弟刘宇宁、单依纯、,原声带-综艺原声、流行-华语流行、,KTV、抒情、悲伤、,国语,80,
D.N.A Cypher I,D.N.A、张艺兴、GALI、单依纯、王子异、,流行、,动感、,国语,127,
雨天 (Live),张碧晨、张紫宁、,流行、,抒情、,国语,57,
三拜红尘凉 (Live版),张碧晨、孟佳、,原声带-综艺原声、流行-华语流行、,抒情、快乐、,国语,68,
下一秒,张碧晨、,原声带-电视剧原声、流行-华语流行、,抒情、酒吧、,国语,116,《下一秒》是一首与剧情匹配度极高的甜蜜小情歌，张碧晨不仅精彩的传递了原曲意的音乐表达，还融入了她个人风格，用音乐呈现出一种愉悦舒畅的感官享受，纯白棒球帽，墨绿色衣角，时间静止的美好 歌词带来流淌于青涩年华的美好记忆点，于繁杂玄幻世界中呼吁一种纯真情感的自然回归。
现代爱情故事 (Live),林晓峰、刘惜君、,原声带-综艺原声、流行-粤语流行、,抒情、悲伤、爱情、KTV、,粤语,103,这首歌真的挺舒服了，有种如沐春风的感觉，林晓峰和刘惜君的声音自然交织，个人心中对粤语歌就如这般诠释，不需要太多花哨，纯净和情感足以让人得到洗礼。
让一切随风 (Live),刘惜君、,原声带-综艺原声、流行-粤语流行、,抒情、,粤语,68,刘惜君的这首歌唱出绝对高度，她的声音里不仅有空灵天籁之音，更有生活沉淀下来的厚重，让人忧郁沉醉欲罢不能！
漫步人生路,刘惜君、,流行-华语流行、,悲伤、爱情、苦情、放松、KTV、正能量、,粤语,114,
怎么唱情歌,刘惜君、,流行-华语流行、,抒情、,国语,71,
大风吹 (Live),刘惜君、王赫野、,流行、,KTV、动感、放松、活力、,国语,115,
如愿 (Live),张韶涵、刘惜君、,流行、,抒情、,国语,85,
晚风心里吹 (Live),刘惜君、王赫野、,流行、,抒情、悲伤、思念、,粤语,63,
不该 (Live),刘惜君、赵磊、,流行、,抒情、,国语,75,
时间煮雨,郁可唯、,原声带-电影原声、流行-华语流行、,抒情、,国语,84,
他不懂,郁可唯、,原声带-综艺原声、流行-华语流行、,抒情、,国语,60,张杰唱的好像是作为旁观者，跟女孩子讲，“不要沉沦进那个男生，因为那个男生根本不懂你的心。”郁可唯就仿佛在受伤之后，悄悄把自己锁在昏暗的房间里，对着镜子跟自己说“不值得，他不爱你，放下吧。”然后说着说着又响起曾经美好，环抱着自己默默地大哭起来……
在希望的田野上 (live),孙楠、韩红、黄绮珊、古巨基、陈楚生、王心凌、谭维维、胡彦斌、郁可唯、汪苏泷、周深、宋亚轩、毛阿敏、张淇、,流行-华语流行、,热血、动感、抒情、,国语,61,
水中花,郁可唯、,原声带-综艺原声、流行-华语流行、,抒情、动感、爱情、思念、苦情、放松、KTV、,国语,63,郁可唯这首歌声音仿佛穿透晨雾的那一束强烈且不刺眼的光，音色在轻柔薄中温柔穿透且余韵袅袅还有回弹感！
路过人间,郁可唯、,原声带-综艺原声、流行-华语流行、,热血、抒情、动感、悲伤、爱情、思念、浪漫、苦情、正能量、,国语,65,在歌曲《路过人间》中，郁可唯用歌声描绘出人生际遇中的各种情绪，体悟生活中的每一场相聚与别离，为处在片刻纠结与挫折中的听众，提供一种豁达面对和思考人生的视角。伴随歌曲的故事发展，郁可唯富有感染力的嗓音触及听众心中柔软的角落，令人感受到人世间的温度。
恋恋风尘 (live),郁可唯、,流行-华语流行、,慵懒、放松、,国语,96,
在你家楼下,JC简成杰、,流行、嘻哈说唱、,动感、快乐、活力、轻快、,国语,95,
飞得更高(Live),汪峰、,摇滚-流行摇滚、,热血、动感、正能量、,国语,89,
New World,Zakiya晴子、夏哲轩、,嘻哈说唱、,动感、活力、,国语,83,
站起来,成龙、孙楠、莫文蔚、韩红、,原声带、流行、,正能量、,国语,86,
年轻的战场,张杰、,流行-华语流行、,热血、抒情、动感、悲伤、爱情、浪漫、憧憬、KTV、正能量、,国语,124,
我相信 (Live),罗琦、,原声带-综艺原声、流行、,正能量、,国语,120,
因为理想,逃跑计划、,流行、,正能量、,国语,133,
爱的翅膀,韩庚、,流行、,正能量、,国语,,
It's My Life,Bon Jovi、,摇滚-流行摇滚、,热血、动感、快乐、篮球、正能量、,英语,119,这是一首磅礴雄伟、荡气回肠的自由战歌当风笛第一次响起时，它是那样的优美而哀伤在提琴阵阵的协奏中，又是那么的飘渺与向往至鼓号缓缓的响起时，却是那般的坚毅和无奈这旋律冥冥中蕴涵着对现实的挣扎、对自由的向往——“告诉你我的孩子在你一生中有许多事值得争取但自由无疑是最重要的。”
人生,夏小虎、,民谣-华语民谣、,抒情、悲伤、爱情、孤独、酒吧、正能量、,国语,114,
I Believe I Can Fly,R. Kelly、,节奏布鲁斯-当代节奏布鲁斯、,热血、抒情、动感、悲伤、放松、KTV、冥想、足球、正能量、,英语,59,
We Are The Champions,Queen、,原声带-电影原声、,足球、正能量、,英语,95,
旗开得胜,张学友、张靓颖、K'NAAN、,流行-华语流行、,热血、动感、快乐、活力、足球、正能量、,国语,151,
好春光,吴彤、,原声带-电视剧原声、,快乐、正能量、,国语,150,
Lifeline,Zeraphym 六翼使徒、,电子-Melodic Dubstep、,抒情、悲伤、抑郁、可爱、快乐、放松、治愈、孤独、遗憾、,纯音乐,141,前奏像是从昏迷中渐渐的苏醒了过来，之后美好的旋律就像是获得新生的喜悦，最后旋律停止时，自己已经慢慢冷静下来，要继续努力去面对生活。
擦干眼泪爱你,刘伟晨、小啾啾起飞_、,流行、,抒情、思念、,国语,120,
世界尽头的天文台,林文森、,流行、,抒情、放松、,国语,60,
小黄花,陕西牛犇、,民谣-华语民谣、,悲伤、放松、孤独、酒吧、正能量、,国语,79,
孤勇者,陈奕迅、,原声带、流行-华语流行、,热血、抒情、动感、悲伤、快乐、放松、治愈、孤独、正直、正能量、,国语,64,《孤勇者》是游戏《英雄联盟》衍生动画《英雄联盟：双城之战》的中文主题曲。该曲由音作词人唐恬作词，歌手陈奕迅演唱。他们以平凡英雄、背后英雄的角度开展创作，主要扣住《英雄联盟：双城之战》的主题，还原那些不是正统意义中的英雄形象。“天生就是用音乐讲故事”的陈奕迅便成为了演唱的最佳人选。
回到梦开始的地方,陌涵、,流行-华语流行、,抒情、悲伤、KTV、,国语,137,
路,隔壁团乐队、,摇滚-流行摇滚、,热血、抒情、动感、活力、放松、治愈、正能量、,国语,119,
New Boy,房东的猫、陈婧霏、,摇滚-民谣摇滚、原声带-综艺原声、流行-华语流行、,热血、抒情、动感、酒吧、正能量、,国语,130,慵懒的声线加上治愈的旋律，听到这首歌开头时仿佛置身于小时候和小伙伴在温暖阳光下奔跑的场景。
通关,许嵩、,流行-华语流行、,热血、抒情、动感、悲伤、KTV、正能量、,国语,106,
生来倔强,南征北战NZBZ、,嘻哈说唱-硬核说唱、,热血、动感、活力、正能量、,国语,99,最喜欢前奏和开头的几句，让人能感受到充满志气的青年压着全副武装提着枪支起步走来，那步伐沉稳、厚重、坚定！给人一种可靠的安全感，让人感觉也心中热血沸腾！
离家最近的路,花粥、陈鸿宇、房东的猫、郝云、谢春花、王梵瑞、银临、好妹妹、王子异、梁晓雪、张楚、G.G张思源、赵钶、木小雅、徐秉龙、焦迈奇、,民谣-华语民谣、,热血、抒情、动感、悲伤、爱情、思念、浪漫、孤独、正能量、,国语,70,
亡命之徒,纵贯线、,摇滚、,热血、抒情、动感、放松、憧憬、正能量、,国语,101,听这首的意境 就像在落日余晖下，驾着吉普狂奔在无边无际的大西北公路上，一路扬尘，天地之间万物都将被黑暗吞噬。青年没有告别，头也不敢回的离开那座城，只把音响放到最大音，嘶吼的唱着这首亡命之徒……
蜂鸟,吴青峰、,原声带-电视剧原声、流行-华语流行、,抒情、悲伤、快乐、苦情、KTV、正能量、,国语,80,用停顿和电音表现蜂鸟飞行时悬停、退后的情态，轻巧的吉他扫弦、跳跃的钢琴、合成器和鼓点，就像是蜂鸟娇小灵活的身体、飞行时躲闪的动作，词曲、编曲和唱都太有画面感了。
