歌名,歌手,曲风,推荐标签,语种,BPM,乐评
City Sidewalk Walla with Group of Black Males Hanging out and Laughing,The Hollywood Edge Sound Effects Library、,,,英语,,
"Crowd, Outdoor - Ski Resort: General Ambience at the Bottom of a Ski Hill, Sports Farm, Rural & Countryside Ambiences, Skiing & Snowboarding",Sound Effects Library、,,,英语,,
"Bar, Ambience - Large Bar or Pub: Heavy Crowd Ambience, Bars & Pubs",Sound Effects Library、,,幸福、快乐、,英语,,
European Train Station Ambience,The Hollywood Edge Sound Effects Library、,,平静、放松、,英语,,
"Coffee Shop Sounds - Nature Sounds for Relaxation, Meditation, Studying & Deep Sleep- Part 2",Nature Sounds、,新世纪-冥想音乐、,快乐、轻快、,英语,,
"Coffee Shop Sounds - Nature Sounds for Relaxation, Meditation, Studying & Deep Sleep- Part 4",Nature Sounds、,新世纪-冥想音乐、,动感、放松、助眠、,英语,,
"Coffee Shop Sounds - Nature Sounds for Relaxation, Meditation, Studying & Deep Sleep- Part 1",Nature Sounds、,新世纪-冥想音乐、,动感、悲伤、助眠、,英语,,
Gatherings: Country Pub - General Sounds in the Bar,Spectacular Sound Effects、,,动感、悲伤、慵懒、放松、,英语,115,
城市．躲雨时的休息片刻,贵族音乐ASMR、,世界音乐、,助眠、冥想、放松、平静、,纯音乐,156,
城市．在东京散步的放松时刻,贵族音乐ASMR、,世界音乐、,助眠、冥想、动感、,纯音乐,130,
清晨上学之路-白噪音,Glory Xia、,,,,,
下午花园街边散步-白噪音,Glory Xia、,,,,,
伯克利课间闲聊,Glory Xia、,,,,,
"Sonidos de Cafe - estudiar, meditar, dormir, sonidos relajantes- Parte 2",Sonidos De La Naturaleza、,世界音乐、,助眠、动感、放松、,英语,,
NYC Breakfast Diner,Field Recording Collectors、,,,英语,,
New York City Diner,Field Recording Collectors、,,助眠、冥想、可爱、快乐、,英语,,
Subway Sounds on the Subway to Brooklyn,Field Recording Collectors、,,助眠、冥想、放松、动感、,英语,,
Restaurant am Meer,Sound Akademie、,,活力、动感、轻快、快乐、,纯音乐,,
"Coffee Shop Noise, Pt. 14",Ambient Sounds from I'm In Records、White Noise from TraxLab、,,动感、放松、,纯音乐,,
"Coffee Shop Noise, Pt. 12",White Noise from TraxLab、Ambient Sounds from I'm In Records、,,动感、助眠、,纯音乐,,
"Coffee Shop Noise, Pt. 11",White Noise from TraxLab、Ambient Sounds from I'm In Records、,,助眠、,纯音乐,,
"Coffee Shop Noise, Pt. 10",White Noise from TraxLab、Ambient Sounds from I'm In Records、,,动感、放松、助眠、,纯音乐,,
"Coffee Shop Noise, Pt. 09",Ambient Sounds from I'm In Records、White Noise from TraxLab、,,动感、放松、助眠、冥想、,纯音乐,,
"Coffee Shop Noise, Pt. 08",Ambient Sounds from I'm In Records、White Noise from TraxLab、,,动感、助眠、,纯音乐,,
"Coffee Shop Noise, Pt. 07",White Noise from TraxLab、Ambient Sounds from I'm In Records、,,动感、放松、助眠、冥想、,纯音乐,,
"Coffee Shop Noise, Pt. 06",Ambient Sounds from I'm In Records、White Noise from TraxLab、,,动感、放松、助眠、,纯音乐,,
"Coffee Shop Noise, Pt. 05",White Noise from TraxLab、Ambient Sounds from I'm In Records、,,动感、放松、助眠、,纯音乐,,
"Coffee Shop Noise, Pt. 04",White Noise from TraxLab、Ambient Sounds from I'm In Records、,,动感、放松、助眠、,纯音乐,,
"Coffee Shop Noise, Pt. 03",Ambient Sounds from I'm In Records、White Noise from TraxLab、,,动感、放松、助眠、冥想、,纯音乐,,
"Coffee Shop Noise, Pt. 02",White Noise from TraxLab、Ambient Sounds from I'm In Records、,,动感、放松、助眠、冥想、,纯音乐,,
"Coffee Shop Noise, Pt. 01",Ambient Sounds from I'm In Records、White Noise from TraxLab、,,动感、放松、助眠、,纯音乐,,
Crowds: Crowd Murmur in a Small Hall,Spectacular Sound Effects、,,动感、爱情、浪漫、,英语,125,
"Helsinki, Finland Subway Train Riding Through Two Stations",Sound Ideas、,,,英语,,
"Moscow, Russia Subway Station Entrance with Very Heavy Crowd Ambience & Trains in Background",Sound Ideas、,,放松、治愈、,英语,,
"Germany, Subway Ride with Hum of Passenger Voices & Pa Announcements",Sound Ideas、,,活力、动感、,英语,,
"Germany, Ubahn Subway Train Ride with Passenger Voices",Sound Ideas、,,助眠、,英语,,
Diner Crowd at Lunch Counter: Voices and Active Dish Noise,Sound Ideas、,,,英语,,
Chinese Take out Restaurant: Patrons and Kitchen Noises,Sound Ideas、,,,英语,,
"Cheap Diner: Voices, Waitress, Dish Noise and General Activity",Sound Ideas、,,,英语,,
Busy Crowd Voices and Dish Noise in Restaurant,Sound Ideas、,,,英语,,
"Old Western Town Ambience: Horses and Wagons, Voices and Footsteps on Wood",Sound Ideas、,,,英语,,
"1970's Office Ambience: Typewriters, Voices, Telephones and General Activity",Sound Ideas、,,,英语,,
1970's Street Traffic and Pedestrians,Sound Ideas、,,助眠、放松、,英语,,
"Bank Ambience: Computers, Printers and General Activity",Sound Ideas、,,,英语,,
The Louvre: Ambience by Main Gallery Entrance,Sound Ideas、,,,英语,,
"Large Fish Market Exterior: Crowd Voices, Vendors and Movement (Version 2)",Sound Ideas、,,,英语,,
"Large Fish Market Exterior: Crowd Voices, Vendors and Movement (Version 1)",Sound Ideas、,,,英语,,
Large Building Lobby: Medium Crowd Voices and Movement,Sound Ideas、,,,英语,,
"Outdoor Pedestrian Plaza: Church Bells, Crowd Voices and Movement",Sound Ideas、,,,英语,,
Study Area: Quiet Ambience with Distant Voices in Background,Sound Ideas、,,,英语,,
"University Library: Card Catalog Area, Light Activity",Sound Ideas、,,,英语,,
"Pedestrian Alley: Light Crowd, Birds, Cafe Noises and Distant Traffic",Sound Ideas、,,,英语,,
"Harbour Ambience: Boats at Dock, Water Lapping and Voices",Sound Ideas、,,,英语,,
Pedestrian Crowd in Old Courtyard with Birds,Sound Ideas、,,,英语,,
"Street Alley Ambience: Pedestrians, Traffic and Horns",Sound Ideas、,,,英语,,
Outdoor Skating Rink: General Ambience with Children Skating,Sound Ideas、,,,英语,,
"Yacht Club Marina with Dock Creak, Water Lapping and Wind",Sound Ideas、,,,英语,,
"Waves on Rocks, Wind, Seagull and Distant Ship Horn",Sound Ideas、,,,英语,,
"Marina Ambience: Dock Creaking, Seagulls, Water Lapping and Distant Boats",Sound Ideas、,,,英语,,
"Ferry Dock Ambience: People Talking, Boats, Birds and Cars",Sound Ideas、,,,英语,,
Outdoor Cafe: Crowd Voices and Dish Noise,Sound Ideas、,,动感、,英语,,
Church Bell Ringing with Traffic and City in Background,Sound Ideas、,,,英语,,
"Metro Station: Trains Arrives, Doors, Train Departs",Sound Ideas、,,,英语,,
Medium French Crowd Indoors,Sound Ideas、,,,英语,,
"Strolling Down Midway with Crowd, Barkers and Games",Sound Ideas、,,,英语,,
"Loud Mockingbird up Close, Rooster in Distance and Airplane Passes Overhead in Distance",Sound Ideas、,,,英语,,
"Farm Ambience: Dog Barking, Birds and Rooster",Sound Ideas、,,,英语,,
Active Birds and Crickets Near Stream,Sound Ideas、,,平静、放松、助眠、冥想、,英语,,
"Various Birds Chirping, Light Breeze and Cows",Sound Ideas、,,,英语,,
Jpl Mission Control Room with Quiet Voices and Controllers Working,Sound Ideas、,,,英语,,
"Downtown City Ambience with Traffic, Pedestrians and Buses",Sound Ideas、,,,英语,,
New York City: Times Square Busy Traffic Ambience,Sound Ideas、,,,英语,,
New York City: Downtown Manhattan Plaza,Sound Ideas、,,,英语,,
Large Foreign City: Traffic and Pedestrians,Sound Ideas、,,,英语,,
Light Traffic and City Rumble on Street,Sound Ideas、,,,英语,,
1980's Gambling Casino: General Ambience with Slot Machines and Gaming Tables,Sound Ideas、,,,英语,,
"Beach Ambience: Surf, People Playing",Sound Ideas、,,,英语,,
Teen Boys Playing Pickup Basketball on Outdoor Court,Sound Ideas、,,助眠、冥想、动感、,英语,,
Scottish Pub: Light Crowd with Voices,Sound Ideas、,,,英语,,
Pedestrian Street: Light Crowd Noise,Sound Ideas、,,助眠、冥想、放松、动感、,英语,,
Golden Retriever Drinking Water (Version 2),Sound Ideas、,原声带、,,英语,,
Large Restaurant Crowd Ambience,Sound Ideas、,,,英语,,
Busy American Restaurant Ambience,Sound Ideas、,,平静、放松、,英语,,
"Passenger Train Dining Car Ambience with Heavy Crowd, Dishes & Train in Motion",Sound Ideas、,新世纪、,,英语,,
Ikea Furniture Store Restaurant Ambience with Hum of Voices,Sound Ideas、,,,英语,,
General Pub Ambience with Busy Crowd,Sound Ideas、,,,英语,,
British Pub Ambience with Hum of Voices & Glass Sounds,Sound Ideas、,新世纪、,烦躁、,英语,,
Very Busy Nightclub or Bar Ambience,Sound Ideas、,新世纪、,,英语,,
Lively New York City Bar Ambience with Strong Hum of Voices,Sound Ideas、,,平静、放松、治愈、,英语,,
Heavy Crowd Ambience in Medium Bar or Pub,Sound Ideas、,,,英语,,
Large Bar or Pub Ambience with Heavy Crowd Noise,Sound Ideas、,,,英语,,
Heavy Lunch Hour Ambience in Small Sandwich Deli Shop,Sound Ideas、,新世纪、,,英语,,
"General Deli Restaurant Ambience with Crowd Walla, Dishes & Distant Television",Sound Ideas、,,,英语,,
New York City Chinatown Deli Restaurant Take out Counter Ambience,Sound Ideas、,新世纪、,,英语,,
General Ambience from New York City Deli Restaurant,Sound Ideas、,,,英语,,
Pizzeria Kitchen Ambience,Sound Ideas、,,,英语,,
General Restaurant Ambience with Crowd & Dishes,Sound Ideas、,,动感、冥想、,英语,,
Light Crowd Ambience in Small Coffee Shop,Sound Ideas、,新世纪、,,英语,,
Small Deli Restaurant Ambience with Voices & Compressor Hum,Sound Ideas、,,,英语,,
Light Lunchtime Restaurant Ambience with Dishes & Crowd Walla,Sound Ideas、,新世纪、,,英语,,
Hamburger Stand Ambience with Griddle Sizzling,Sound Ideas、,,,英语,,
Fast Food Order Counter Ambience with Voices & Cash Registers,Sound Ideas、,,,英语,,
High School Crowd in Fast Food Restaurant,Sound Ideas、,,,英语,,
Medium Fast Food Restaurant Ambience with Voices & Cash Register,Sound Ideas、,,动感、活力、,英语,,
Small Restaurant Crowd Ambience,Sound Ideas、,,,英语,,
Medium Restaurant Ambience with Open Kitchen,Sound Ideas、,新世纪、,,英语,,
Medium Crowd Ambience with Dishes & Freezer Compressor Noise,Sound Ideas、,,,英语,,
"Medium Restaurant with Light Crowd Ambience with Dishes, Voices & Cash Register",Sound Ideas、,新世纪、,,英语,,
Medium Restaurant Crowd Ambience,Sound Ideas、,,活力、动感、热血、,英语,,
Large Restaurant Crowd in New York City,Sound Ideas、,新世纪、,快乐、,英语,,
Large Crowd Ambience in Restaurant with Open Kitchen,Sound Ideas、,,,英语,,
Busy Cafeteria Ambience with Heavy Dish Noise,Sound Ideas、,,放松、,英语,,
Busy Student Crowd in High School Cafeteria,Sound Ideas、,新世纪、,抒情、,英语,,
Large Restaurant with Active Crowd Ambience,Sound Ideas、,,,英语,,
Heavy Crowd Ambience with Dish Noise in Large Restaurant,Sound Ideas、,,放松、,英语,,
Heavy Crowd Ambience in a Large Restaurant,Sound Ideas、,新世纪、,,英语,,
Large Crowded Restaurant Ambience,Sound Ideas、,,冥想、,英语,,
Kleines Hafenrestaurant,Sound Akademie、,,,纯音乐,,
Strassenkaffee mit Livemusik,Sound Akademie、,,,纯音乐,,
Restaurant am Strand,Sound Akademie、,,平静、放松、助眠、冥想、,德语,,
Strandbar mit Livemusik,Sound Akademie、,,冥想、放松、,德语,,
Kleines Stadtkaffee,Sound Akademie、,,动感、冥想、,德语,,
Bar mit Hintergrundmusik,Sound Akademie、,,动感、活力、,德语,,
Very Busy Sidewalk or Open Street with Pedestrian Walla and Footsteps with Light Traffic,The Hollywood Edge Sound Effects Library、,,动感、放松、,英语,,
Sparse Pedestrian Pass Bys with Walla and Footsteps and Distant Jack Hammer,The Hollywood Edge Sound Effects Library、,,放松、助眠、冥想、,英语,,
Low Angle Crowd Footsteps and Walla in Congested Exterior Walkway,The Hollywood Edge Sound Effects Library、,,动感、放松、助眠、,英语,,
"Chinese Street Ambience with Pedestrians, Bicycle Bells & Traffic",Sound Ideas、,,,英语,,
"Traffic Ambience with Pedestrians, Horns & Bicycle Bells",Sound Ideas、,,,英语,,
"Chinese Market Ambience with Voices, Traffic, Animals, Bicycles & Bells",Sound Ideas、,,,英语,,
Chinese City Traffic Ambience with Voices,Sound Ideas、,,,英语,,
"Beijing, China Airport Terminal Ambience with Voices, Luggage Carts & Pa Announcements",Sound Ideas、,,助眠、,英语,,
"Beijing, China Airport Terminal Drop off Area with Heavy Traffic, Horns & Pa",Sound Ideas、,,,英语,,
Medium Sized Crowd in Airport Terminal,Sound Ideas、,,,英语,,
Airport Terminal Heavy Crowd Ambience with Baggage & Voices,Sound Ideas、,,,英语,,
Airport Terminal Cafe Ambience - Venice,Prime Sound、,,,英语,,
Airport Terminal Concourse Ambience,The Hollywood Edge Sound Effects Library、,,,英语,,
Airport Terminal Crowd People Background Ambience Sound Effects Sound Effect Sounds EFX Sfx FX Natural Ambience Sounds Airports and Airplanes,Essential Sound Effects、,,,英语,,
Airport Terminal Crowd People Background Ambience Sound Effects Sound Effect Sounds EFX Sfx FX Natural Ambience Sounds Airports and Airplanes,Essential Sound Effects、,,,英语,,
Airport Terminal: General Ambience with Crowd Movement,Sound Ideas、,,,英语,,
"Racquetball - Rally: Two Players, Sports Squash, Racquet Ball & Hand Ball",Sound Effects Library、,,热血、动感、冥想、,英语,,
City Ambient (Original Mix),Rain Sounds、,电子、,助眠、冥想、,英语,,
Town Ambient (Original Mix),Rain Sounds、,电子、,,英语,,
《诺闵扎木》城市环境音,孛儿只斤·包迪、,流行、,动感、,,,
Rainy Journey To Minsk (Original Mix),Rain Sounds、,电子-缓拍、,动感、放松、助眠、冥想、,英语,,
[1] Airport + [2] Aircraft (inside),Ambient sounds、,流行-韩国流行、,,纯音乐,,
Working Environment / Restaurant Cuisine (Cucina ristorante),Sound Effects、,,助眠、冥想、放松、,英语,,
"Sala de Impresoras, Fax, Teleprinter",Estudios Talkback、,,,西班牙语,,
Coffe Machine,The Harmony Group、,,动感、紧张、梦幻、活力、放松、神秘、激烈、惊悚、,英语,,
"Interior Museos. Pasos, Voces…",Estudios Talkback、,,,西班牙语,,
"Bank - General Ambience: Footsteps, Voices, Clerical Sounds Banks, Sfx",Sound Effects Library、,,动感、放松、,英语,,
Suburban Café (Paris),Yves Relos、,,动感、,英语,,
Busy Airport Terminal Ambience,The Hollywood Edge Sound Effects Library、,,放松、助眠、冥想、,英语,,
"Crowd, Gallery - Medium Indoor Gallery Crowd: Large Reverberant Room, Voices, Footsteps, Ventilation, Libraries, Museums & Art Galleries",Sound Effects Library、,,动感、助眠、冥想、,英语,,
"Restaurante Autoservicio. Público, Cubiertos",Estudios Talkback、,,梦幻、放松、冥想、,英语,,
"Bar, Ambience - Medium Bar or Pub: Heavy Crowd Ambience, Dishes, Bars & Pubs",Sound Effects Library、,,动感、活力、热血、,英语,,
"Restaurant, Large, Ambience - Large Restaurant: Heavy Crowd Ambience, Close Voices and Dishes, Restaurants, Cafes & Cafeterias, Give You the Hollywood Edge",Sound Effects Library、,,动感、活力、助眠、,纯音乐,95,
"Redacción de un Periódico. Teléfono, Fax, Teclado",Estudios Talkback、,,动感、冥想、,纯音乐,,
Human Sound / Restaurant 2 (Ristorante),Sound Effects、,,悲伤、梦幻、放松、,,118,
Human Sound / Restaurant 1 (Ristorante),Sound Effects、,,动感、,,122,
"Restaurant - Busy Cafeteria Ambience: Crowd, Heavy Dishes Restaurants, Cafes & Cafeterias",Sound Effects Library、,,放松、助眠、,纯音乐,,
"Restaurant, Caf& - Caf&: General Ambience, Busy, Crowd Restaurants, Cafes & Cafeterias, Sfx",Sound Effects Library、,,动感、放松、冥想、,英语,93,
Restaurant,Ambient Sounds、,,可爱、快乐、冥想、,纯音乐,,
OHANAA (欧哈纳),Azeri、HJFM、Ghani、,电子、,,纯音乐,115,
Sarah (莎拉),Geltiman、Ghani、Qora、Radio、,电子、,,纯音乐,115,
Outlaws (法外狂徒),HMHK、,电子-浩室舞曲、,轻快、快乐、放松、夜店、,纯音乐,100,
Marvel（沉入谷底）,ROSE、HJFM、Azeri、Sara、,电子、,神秘、紧张、放松、,纯音乐,100,
Dreams (疯狂),Ghani、HJFM、Zara-Music、Azeri、,,,纯音乐,120,
Sahara (撒哈拉),Geltiman、Azeri、Sara、,电子、,,纯音乐,109,
Mad devil (狂魔鬼),Qora、Zara-Music、Geltiman、Azeri、,电子、,放松、,纯音乐,100,
Soldier（防暴士兵）,Geltiman、BOY、HJFM、,流行、,动感、紧张、活力、神秘、黑暗、惊悚、,英语,89,
Italia e voi (MP),Azeri、HSHK、HJFM、Pnan、,电子-浩室舞曲、,热血、动感、活力、夜店、,纯音乐,95,
Octopus (狂王),Ghani、Geltiman、Azeri、,,,纯音乐,55,
Knight (骑士),Geltiman、Ghani、Radio、Qora、HJFM、MAGA、,电子-街头浩室、,动感、活力、冥想、,纯音乐,109,
The Black (黑骑士),Outlaws、Knight、Down、,电子-街头浩室、,动感、,英语,105,
Azeri (兽心),Geltiman、HSHK、HJFM、,电子、,动感、活力、,纯音乐,89,
Girl (越南鼓),Qora、DEVIL、,电子-浩室舞曲、,热血、动感、活力、,纯音乐,95,
Times of (非凡时代 ),Geltiman、Ghani、Azeri、,电子、,,纯音乐,115,
Bamba! (MP),Sara、Ghani、Geltiman、,电子、,,纯音乐,120,
Armon (艾蒙),Geltiman、HSHK、HJFM、Qora、,电子-浩室舞曲、,,纯音乐,115,
Secrets (隐情),Azeri、Radio、,电子、,,纯音乐,90,
Encanto (恩坎托),Knight、Outlaws、Down、,电子、,动感、活力、,纯音乐,125,
Edge (边缘),Azeri、Geltiman、Sara、Radio、,电子-浩室舞曲、,抒情、动感、慵懒、活力、放松、憧憬、亲情、,纯音乐,103,
Viele (越南鼓),Ghani、Geltiman、Qora、,电子-浩室舞曲、,动感、,纯音乐,100,
Feria (Orginal mix ),Geltiman、HSHK、HJFM、FIZO FAOUEZ、,电子、,动感、活力、,纯音乐,78,
Mirage (玫瑰杀手),Qora、Azeri、Ghani、Geltiman、,电子、,,纯音乐,101,
Dreams (豪梦),Geltiman、HJFM、Ghani、,电子-街头浩室、,,纯音乐,95,
Gangster (歹徒),Geltiman、Azeri、Qora、,电子-浩室舞曲、,,纯音乐,55,
EMPEROR,Knight、HJFM、Ghani、Down、,电子、,动感、活力、,纯音乐,120,
Havana (哈瓦那),Geltiman、HJFM、Qora、ғɪᴢᴏ ғᴀᴏᴜᴇᴢ、,电子-深浩室舞曲、,动感、快乐、活力、,纯音乐,100,
PLAY,Ricii Lompeurs、Ticia、,电子-巴西贝斯、,快乐、轻快、,英语,89,
Sinego (西内戈),Geltiman、HJFM、HSHK、,电子、,动感、活力、放松、,纯音乐,100,
Outlaws (Orginal mix),Qora、Geltiman、Ghani、,电子、,动感、活力、,纯音乐,100,
7muz,HSHK、ROYYNN、VodKe、Pnan、,电子、,动感、活力、,纯音乐,115,
Gangsta (黑帮),Radio、Azeri、,电子、,动感、活力、放松、,纯音乐,101,
Lost（迷失）,Azeri、Sara、Qora、Ghani、,电子-浩室舞曲、,悲伤、抑郁、,纯音乐,103,
Italia e voi（Orginal Mix）,HSHK、贰皮、VodKa、Pnan、,电子-街头浩室、,,纯音乐,94,
Cosita (科西塔),Azeri、Ghani、Geltiman、Sara、,电子、,动感、活力、,纯音乐,109,
Magical (神奇的),Qora、Azeri、,电子-浩室舞曲、,动感、快乐、放松、,纯音乐,95,
Crimiwaw (克里米瓦),Radio、Geltiman、,电子、,,纯音乐,109,
Save Me (Orginal mix ),Qora、Azeri、Sara、,电子、,,纯音乐,107,
Italia e voi（Reset）,Pnan、HSHK、VodKe、Alpha、,电子、,,纯音乐,95,
Crazy Wild (疯狂),Azeri、HJFM、Ghani、Geltiman、,电子、,抒情、,纯音乐,109,
Bushido（武士道）,Outlaws、Down、Knight、,电子、,动感、活力、正能量、,纯音乐,115,
Criminal (犯罪的),Ghani、Geltiman、,电子-浩室舞曲、,动感、活力、,纯音乐,125,
Meduza (Orginal mix ),Geltiman、Qora、Sara、Alive、,电子、,,纯音乐,105,
Altai (阿尔泰),Azeri、Qora、Sara、,电子-浩室舞曲、,动感、活力、,纯音乐,105,
Insomnia (mp),Ghani、Qora、Sara、,电子、,动感、活力、放松、,纯音乐,55,
Dance (跳舞),Azeri、Sara、,电子-浩室舞曲、,,纯音乐,100,
Mir Bro (Orginal mix ),Qora、Azeri、Ghani、,慢摇DJ、,,纯音乐,109,
In Da Club (Orginal mix ),Qora、Sara、Azeri、,电子、,,纯音乐,100,
Cosmica (Orginal mix ),Ghani、,电子、,动感、活力、放松、,纯音乐,105,
STAY (狂欢王）,Outlaws、Knight、,电子、,甜蜜、动感、幸福、快乐、爱情、活力、正能量、,纯音乐,56,
光粒（Light Particle）,BOY、HSHK、,电子-巴西贝斯、,,纯音乐,100,
Kate Bush-Running Up That Hill,LINGZEA、阿然、张宇杰、,流行、,动感、活力、放松、,英语,125,
Back zapar (Orginal mix ),Ghani、Geltiman、,电子-巴西贝斯、,动感、活力、,纯音乐,109,
Daisuki,BeMax、,电子-Electronica、电子-漂移冯克、,,日语,80,
Fight (战斗),Geltiman、HJFM、Ghani、,电子、,动感、活力、放松、,纯音乐,100,
Bamba!,Armağan Oruç、,电子-电气浩室舞曲、,,英语,120,
Catch (Orginal mix ),Radio、Azeri、,电子-街头浩室、,动感、活力、,纯音乐,98,
Cheri Cheri Lady,Max Oazo、,电子-浩室舞曲、,,英语,122,
Sea Of Problems,Glichery、,电子-深浩室舞曲、电子-漂移冯克、,动感、,英语,127,
Morze (海边),Geltiman、HJFM、,电子-浩室舞曲、,动感、活力、,英语,100,
XI YOU JI (西游记),Sara、HJFM、Zara-Music、,电子、,动感、活力、放松、,纯音乐,107,
Work ( Remix),Elfar、Drake、,电子、嘻哈说唱、,热血、动感、活力、夜店、,英语,103,
Bushido（武士道）,Radio、Qora、Azeri、Sara、,电子-浩室舞曲、,动感、活力、正能量、,纯音乐,103,
Void (Radio Edit),Prog Monster、,电子-入梦驰放、,梦幻、放松、冥想、动感、活力、洒脱、轻快、快乐、神秘、紧张、,纯音乐,85,
Narco (毒枭),Qora、Azeri、Sara、,电子、,梦幻、放松、动感、活力、热血、,纯音乐,105,
Time Stop,BlackDD、CyTeam、PICK、知晏、,电子-驰放低音、,抒情、动感、紧张、悲伤、梦幻、活力、放松、憧憬、治愈、孤独、洒脱、感人、,纯音乐,130,
Scape,Azeri、Radio、Qora、,电子-浩室舞曲、,动感、活力、,纯音乐,105,
Notorious,Aini、,,,,,
Dreams (Orginal mix),Qora、Sara、Radio、,电子、,动感、活力、放松、正能量、,纯音乐,115,
SexyBack,Clara Stegall、İlkan Günüç、,电子、,热血、动感、紧张、活力、神秘、夜店、黑暗、,英语,100,
WHAT,Rnbstylerz、Arees、,电子-墨尔本弹跳、,夜店、,纯音乐,127,
Hey Mama,Monk、,电子-电气浩室舞曲、,热血、动感、悲伤、活力、夜店、激烈、,英语,90,
Love the Way You Lie,BROHM、Pane、,电子-浩室舞曲、,,英语,105,
Hear My Call (feat. Tyler Graves),Trivecta、Gem & Tauri、Tyler Graves、,电子-浩室舞曲、,动感、活力、夜店、,英语,126,
Spartanos (Original Mix),SOZZA、,电子-巴西贝斯、,热血、动感、活力、夜店、黑暗、激烈、大气、,英语,125,
Vida Loca,Cristian Marchi、Chris Tyrone、,电子、,夜店、,英语,125,
Tapage nocturne,Trackstorm、Black M、Shaggy、,电子-墨尔本弹跳、,,法语,127,
Vibe,Mike Candys、,电子-电气浩室舞曲、,热血、动感、活力、夜店、,纯音乐,126,
Bushido（武士道）,PUUSUN、,电子、,热血、动感、活力、,国语,100,
Five Hours,Deorro、,电子-EDM渐进浩室舞曲、流行、,热血、动感、,英语,127,
Intro (ILHAM Bootleg_The XX),IGT、ARMaN、Geltiman、ILHAM.、,电子-浩室舞曲、,动感、活力、放松、夜店、酒吧、,英语,61,
Extasy (Cristian Poow Remix),Phunk Investigation、Cristian Poow、,电子-浩室舞曲、民谣-流行民谣、,动感、夜店、,英语,120,
EA7-50-Cent Disco,еяхат музыка、,电子-深浩室舞曲、,热血、动感、,英语,123,
Tokyo Drift (Deep House Cover),AnimeVibe、,电子-深浩室舞曲、,热血、动感、悲伤、活力、孤独、夜店、激烈、,英语,119,
Edge,Rezz、,电子、,动感、活力、KTV、夜店、激烈、,英语,100,
Lordly (feat. Alex Aiono) [MDZN Remix],Alex Aiono、Feder、MDZN、,电子-电气浩室舞曲、,甜蜜、热血、动感、快乐、爱情、活力、夜店、酒吧、激烈、,英语,124,
Angetenar (Emre Kabak Remix),Emre Kabak、,电子、,放松、,纯音乐,109,
Ignis,Rompasso、,电子-浩室舞曲、,,英语,110,
2♠,Purak Media、,慢摇DJ-慢摇、,动感、可爱、快乐、活力、,葡萄牙语,130,
Weyrleader,Maga AQ、,电子-浩室舞曲、,夜店、,英语,107,
Morsmordre,Crazy Donkey、,电子-街头浩室、,,纯音乐,62,
Vem Dancar Kuduro,Lucenzo、,流行-西班牙流行、,热血、动感、,葡萄牙语,129,
Anatomy,DJRUSTAM、FIZO FAOUEZ、,电子、,,纯音乐,94,
Lifestyle,MAGES、,电子、,,英语,105,
Why Not,Ghostface Playa、,电子-漂移冯克、,热血、动感、紧张、快乐、活力、放松、神秘、夜店、轻快、黑暗、洒脱、激烈、大气、极限运动、举铁、惊悚、,纯音乐,120,
Chase,VodKa、HSHK、,慢摇DJ-慢摇、,,纯音乐,94,
Club House Packs Part 3,WeiMUSIQUE、,电子、,,英语,128,
Morsmordre (ZHANG JUN Remix),ZHANG JUN（张俊）、Crazy Donkey、Ghetto Artist、,慢摇DJ-慢摇、电子、,动感、,纯音乐,124,
BG,Falamensia、,电子-浩室舞曲、电子-漂移冯克、,热血、动感、紧张、活力、夜店、酒吧、激烈、,英语,124,
Devil Eyes,zodivk、,电子-漂移冯克、,甜蜜、热血、动感、爱情、活力、激烈、,英语,102,
