歌名,歌手,曲风,推荐标签,语种,BPM,乐评
sunflowers,xfruge、baechulgi、,嘻哈说唱-驰放嘻哈、,抒情、动感、紧张、悲伤、抑郁、慵懒、放松、憧憬、治愈、神秘、,纯音乐,82,
ocean wind,a l e x、,电子、,动感、放松、,纯音乐,75,
love.,Theysay.、,嘻哈说唱-低保真嘻哈、,动感、放松、,英语,80,
regret,Samashi、,电子-缓拍、嘻哈说唱-爵士嘻哈、,慵懒、放松、,纯音乐,91,
ㅤ ⌭,Jetson、,电子、,动感、悲伤、抑郁、,纯音乐,55,
get away,BLVK、,电子-缓拍、,可爱、快乐、慵懒、放松、,纯音乐,78,
_S W E E T .S O U |,S i M、,电子-蒸汽波、,动感、爱情、浪漫、,纯音乐,84,
October,Gera、,电子-缓拍、,动感、慵懒、放松、,纯音乐,66,
It's My Birthday,Chuckee.、,电子-蒸汽波、,放松、旅游、,纯音乐,81,
birthday beats,Chuckee.、,嘻哈说唱、,动感、悲伤、抑郁、,纯音乐,80,
-phone call-,lando!、,电子-缓拍、,慵懒、放松、,纯音乐,72,
eevee beat tape 05,E e v e e、,电子-缓拍、,放松、,英语,,
I'm not as lonely anymore,elijah who、,电子-缓拍、嘻哈说唱、,放松、咖啡厅、旅游、,纯音乐,77,
yes,simon eng、,轻音乐、,悲伤、抑郁、孤独、,英语,79,
Morning Mist,BROCKBEATS、,嘻哈说唱-低保真嘻哈、,快乐、慵懒、放松、旅游、,英语,70,
x jhfly,squid ethics、,,放松、,纯音乐,81,
you are everything,Rook1e、,嘻哈说唱、,可爱、快乐、放松、,英语,86,
Espresso,Jazzinuf、,电子、嘻哈说唱、,动感、爱情、慵懒、浪漫、活力、放松、,纯音乐,84,
Lullaby Sleep (Lofi Instrumental),ChilledCow、,电子-缓拍、,悲伤、梦幻、抑郁、放松、孤独、,纯音乐,152,
Sleep Song (Instrumental),ChilledCow、,电子、,动感、悲伤、梦幻、放松、,纯音乐,141,
ＦＯＲＧＥＴ,TRA$H、,电子、,可爱、快乐、放松、,纯音乐,97,
ㅤㅤㅤㅤ,fragile、,轻音乐、,悲伤、平静、放松、,纯音乐,58,
disability,boxboys、,电子、,悲伤、快乐、放松、咖啡厅、旅游、,英语,80,
coffee and cigarettes,Jazzinuf、,电子、嘻哈说唱、,动感、快乐、活力、咖啡厅、旅游、轻快、,英语,87,
been thinkin,BLVK、,电子-缓拍、,悲伤、抑郁、孤独、,纯音乐,74,
all on my own,Kamala、,嘻哈说唱、,动感、悲伤、抑郁、,英语,88,
When Your Waifus Suck my Lo-Fi D,Saito、,电子、,动感、可爱、快乐、,纯音乐,,
Ikigai,idealism、,嘻哈说唱-低保真嘻哈、,平静、梦幻、慵懒、放松、,纯音乐,77,
sʟᴇᴇᴘʏᴛɪᴍᴇ,✰ɢᴜᴛᴛᴇʀɢɪʀʟ✰、,电子、,动感、悲伤、抑郁、,纯音乐,87,
what if we just sat together and did nothing,elijah who、,电子-缓拍、,平静、放松、,纯音乐,74,
woo!,elijah who、,电子-缓拍、,动感、悲伤、,,84,
I wonder if we're dead,E e v e e、,电子-缓拍、流行、,悲伤、抑郁、孤独、,纯音乐,61,
and forget the world...,silky soap、,,悲伤、放松、孤独、,纯音乐,76,
keep,sulu、,电子、,动感、悲伤、抑郁、,纯音乐,75,
my new love,elijah who、,电子-缓拍、,爱情、浪漫、放松、,纯音乐,84,
crush,_mario、,嘻哈说唱-低保真嘻哈、,慵懒、放松、旅游、,纯音乐,84,
i want to tell you i love you but i can't,olli、Tomppabeats、,电子、,动感、,英语,,
Night Breeze,jinsang、,嘻哈说唱-驰放嘻哈、,动感、快乐、爱情、慵懒、浪漫、放松、旅游、,纯音乐,90,
mitä,tymú、,电子-缓拍、,动感、放松、旅游、,纯音乐,70,
Alone by Your Side,J'san、,电子-缓拍、,悲伤、孤独、,纯音乐,78,
time will tell,idealism、,电子-缓拍、嘻哈说唱-低保真嘻哈、,悲伤、抑郁、放松、,纯音乐,79,
summer nite【sold】,emoshinobi、,嘻哈说唱、,慵懒、放松、旅游、,英语,80,
come chill with me on some floating tropical island,the girl next door、,嘻哈说唱、,放松、孤独、悲伤、治愈、慵懒、清新、平静、,纯音乐,89,
Breakfast in Bed,Jazzinuf、,爵士、,动感、可爱、快乐、,,80,
i just want to be happy,elijah who、,电子-缓拍、,放松、冥想、,纯音乐,81,
Joan of Arc.,barnes blvd.、,电子-缓拍、,放松、,纯音乐,89,
WALLS,sapientdream、,电子-迷幻氛围、嘻哈说唱-低保真嘻哈、,抒情、动感、悲伤、平静、梦幻、抑郁、爱情、思念、慵懒、活力、放松、憧憬、孤独、夜店、,英语,78,
Fomalhaut,Shin-Ski、,嘻哈说唱-说唱伴奏、,抒情、动感、爱情、慵懒、浪漫、放松、酒吧、旅游、,纯音乐,94,
affection.,jinsang、,电子-蒸汽波、,悲伤、爱情、浪漫、,纯音乐,84,
life,Caleb Belkin、,电子-缓拍、嘻哈说唱、,动感、放松、旅游、,英语,90,
waiting,cewsox、,电子、,悲伤、抑郁、,华语,85,
Calm,Mounika.、,电子-缓拍、,动感、放松、,纯音乐,57,
you and i,barnes blvd.、,,爱情、浪漫、放松、旅游、,英语,67,
La Vie En Rose,Inteus、,原声带-电影原声、,动感、爱情、浪漫、,英语,120,
Warm Nights,LAKEY INSPIRED、,电子-缓拍、,动感、梦幻、快乐、爱情、慵懒、浪漫、活力、放松、旅游、,纯音乐,85,
im just trying to figure it out,sad boy with a laptop、,,,纯音乐,65,
Blame You,眠、Lopu$、,电子-浩室舞曲、,,英语,120,
White Christmas,⁢TV Blonde、,,悲伤、动感、抑郁、,英语,,
Breathe,⁢TV Blonde、pax、Melanie Rosé、Sokro、,另类/独立、,动感、放松、,纯音乐,,
Near  Empty,⁢TV Blonde、,,抒情、,,,
Ocarina,⁢TV Blonde、,轻音乐、,放松、冥想、,纯音乐,68,
anne,Haruka Nakamura、,另类/独立、电子、轻音乐、,清新、悲伤、平静、放松、,日语,88,
Hakone,just big hills、,电子-缓拍、,悲伤、抑郁、慵懒、放松、,纯音乐,114,
feeling empty inside because there's no more spaghetti,In Love With A Ghost、,电子、,悲伤、平静、放松、,纯音乐,68,
espresso,l o k a !、jinsang、lucy weld、,节奏布鲁斯-都市流行、,动感、悲伤、抑郁、爱情、慵懒、浪漫、放松、神秘、,英语,85,
"Sorry, I Like You",burbank、,嘻哈说唱-爵士嘻哈、,动感、可爱、快乐、爱情、慵懒、浪漫、活力、放松、愤怒、旅游、,纯音乐,86,
Ꮺ,nevva、,,悲伤、慵懒、放松、,纯音乐,59,
The Moon Song,cbarrgs、,流行、,爱情、慵懒、浪漫、放松、,英语,89,
JustYouKnowWhy,Mounika.、,另类/独立、,爱情、浪漫、,英语,86,
a moment of silence,idealism、,电子-缓拍、,悲伤、抑郁、慵懒、放松、,纯音乐,37,
I Need a Cup of Coffee and Some Bread for Wake up,In Love With A Ghost、,嘻哈说唱-驰放嘻哈、,慵懒、放松、旅游、,纯音乐,96,
2000 thought of you while making this,yeonsue、,电子、,旅游、可爱、快乐、浪漫、爱情、慵懒、放松、,纯音乐,105,
winter heartbeats,Olivia Herdt、through & through、,流行-欧美流行、,抒情、冥想、,英语,96,
pack my bags,Sarcastic Sounds、ivri、,电子、,慵懒、放松、神秘、,英语,79,
since i last saw her.,Rook1e、,嘻哈说唱、,悲伤、抑郁、慵懒、放松、旅游、,英语,130,
☁,FAT TIGER、Steve Tist、,电子-蒸汽波、,抒情、动感、快乐、爱情、思念、慵懒、浪漫、放松、夜店、旅游、,英语,125,
passion,barnes blvd.、,,放松、,纯音乐,107,
"alone,, again",elijah who、,电子-缓拍、,悲伤、抑郁、孤独、,纯音乐,71,
Youth,Kendall Miles、,爵士、,动感、,纯音乐,78,
SOMETHING ABOUT YOU,Santos Santana、,,动感、放松、,英语,89,
i spilled moonshine on my 404 and this came out,E66S、,电子-缓拍、,放松、冥想、,纯音乐,115,
beachside,E66S、,电子、,放松、冥想、,,,
sounds of summer,E66S、,嘻哈说唱-驰放嘻哈、,清新、悲伤、抑郁、慵懒、放松、旅游、,纯音乐,93,
leave it all behind,kms、,,慵懒、放松、,英语,84,
Sunflower Feelings,Kuzu Mellow、korou.、,嘻哈说唱-驰放嘻哈、,抒情、动感、悲伤、快乐、爱情、思念、慵懒、放松、治愈、孤独、,英语,130,
rookie,a l e x、,电子、,动感、爱情、浪漫、,纯音乐,74,
Ты просто люби меня.,MΣ$†ΛMN ΣKCПØNΛ†、,电子、嘻哈说唱-低保真嘻哈、,,乌克兰语,62,
chẳng có gì vui đâu,marlboro.、,电子-缓拍、,放松、,纯音乐,99,
Victoire,Mounika.、,电子、,抒情、清新、悲伤、平静、梦幻、快乐、思念、慵懒、放松、憧憬、治愈、孤独、旅游、轻快、感人、,纯音乐,89,
Sour Sweets,Joey Pecoraro、,流行、嘻哈说唱、,动感、可爱、快乐、慵懒、活力、放松、旅游、,纯音乐,86,
soliloquy in a planetarium,biosphere、,流行、,甜蜜、爱情、浪漫、放松、咖啡厅、旅游、,纯音乐,89,
seaside cafe,Cat naps、,另类/独立、,,纯音乐,79,
ｃｏｎｔｉｎｕｅ？,uglyyyy、,电子、,可爱、快乐、放松、,纯音乐,76,
beat tape 04,E e v e e、,电子-缓拍、,动感、悲伤、抑郁、,纯音乐,,
ＤＲＥＡＭ,TRA$H、,电子、,悲伤、平静、放松、,纯音乐,54,
Radiant,nohidea.、,电子、嘻哈说唱-低保真嘻哈、,快乐、慵懒、放松、,纯音乐,81,
imy,.Uzu、,电子-缓拍、,平静、慵懒、放松、,纯音乐,78,
Summer's Day,jinsang、,电子、,悲伤、梦幻、抑郁、放松、,纯音乐,78,
Ｌｏｎｅｌｙ Ｓｏｕｌ,✞Jyukai✞、emoshinobi、,电子-缓拍、,悲伤、抑郁、爱情、孤独、咖啡厅、,日语,130,
happy endings,through & through、Sky.High、,电子、,紧张、神秘、,英语,90,
empty space,elijah who、,电子-缓拍、,抒情、悲伤、快乐、咖啡厅、,英语,76,
Game Over!,Harris Cole、,嘻哈说唱-低保真嘻哈、,可爱、快乐、放松、,纯音乐,65,
endless,illswrth、,电子、,清新、紧张、悲伤、平静、梦幻、快乐、放松、孤独、神秘、轻快、,纯音乐,70,
桜流し,nevva、,嘻哈说唱-低保真嘻哈、,悲伤、平静、梦幻、抑郁、慵懒、放松、孤独、,纯音乐,95,
how,crwsox、,电子-缓拍、,抒情、清新、悲伤、平静、梦幻、快乐、爱情、思念、慵懒、浪漫、放松、憧憬、治愈、孤独、冥想、轻快、,纯音乐,75,
waiting,crwsox、,,抒情、清新、悲伤、平静、梦幻、快乐、爱情、思念、浪漫、放松、憧憬、治愈、孤独、轻快、感人、,华语,85,
В мире где ты и я,MΣ$†ΛMN ΣKCПØNΛ†、,电子、,抒情、动感、悲伤、抑郁、孤独、,俄语,77,
passionfruit,Raptures of Lovers、Drake、,摇滚、嘻哈说唱、,旅游、幸福、快乐、轻快、可爱、慵懒、放松、,英语,93,
midnight jam sesh,aqualina、,电子-缓拍、,平静、放松、,纯音乐,69,
Day Dreamin',Kondor、,嘻哈说唱-器乐说唱、,动感、爱情、慵懒、浪漫、放松、,纯音乐,96,
jealous.,ford、,另类/独立、,悲伤、孤独、正能量、,纯音乐,89,
天気,a l e x、,嘻哈说唱-低保真嘻哈、,平静、慵懒、放松、,纯音乐,62,
saturday,marina、,电子、,爱情、慵懒、浪漫、放松、酒吧、,英语,83,
What happened to us?,Olivia Herdt、elijah who、,电子-缓拍、,动感、慵懒、放松、酒吧、,英语,75,
i'm not going anywhere,elijah who、,电子-缓拍、,放松、,纯音乐,65,
a summer-y demo,elijah who、,电子-缓拍、,快乐、爱情、浪漫、放松、,纯音乐,93,
Douceur,Nymano、saib.、,,,纯音乐,79,
summer is gone,Nymano、esne、,流行、,梦幻、放松、,英语,,
:(,whtvs、,电子-Electronica、,动感、悲伤、抑郁、孤独、,纯音乐,60,
Moonlight,Sleep2.、,嘻哈说唱-爵士嘻哈、,抒情、爱情、浪漫、放松、咖啡厅、,英语,77,
never mind,feeniks、,另类/独立、,悲伤、抑郁、孤独、,英语,98,
"the world forgetting, by the world forgot",through & through、,电子-缓拍、,悲伤、慵懒、放松、孤独、咖啡厅、旅游、,纯音乐,97,
❀,nevva、,原声带、,抒情、紧张、悲伤、平静、梦幻、抑郁、爱情、思念、慵懒、苦情、放松、憧憬、治愈、孤独、神秘、助眠、遗憾、,纯音乐,99,
paper messages,this could be us、,,可爱、快乐、放松、冥想、轻快、,纯音乐,99,
she was a pretty one,lanie ❀、Pao Gumba、,流行-欧美流行、,甜蜜、抒情、动感、紧张、悲伤、快乐、爱情、浪漫、活力、放松、神秘、咖啡厅、正能量、,英语,171,
Why did you enter in my life ?,cxld blxxd、,电子、,动感、梦幻、慵懒、放松、,纯音乐,69,
Bubble Gum,Clairo、,另类/独立-独立流行、,甜蜜、抒情、悲伤、抑郁、快乐、爱情、思念、浪漫、孤独、KTV、咖啡厅、,英语,103,
far,vietra、,流行、,甜蜜、抒情、悲伤、爱情、思念、慵懒、浪漫、放松、孤独、,英语,80,
"farewell, my love",J'san、,,,纯音乐,74,
sorry i didn't kiss u,Kling、Clairo、,流行、,爱情、浪漫、,英语,70,
dolce & gabbana,loveboi、,嘻哈说唱、,动感、活力、夜店、极限运动、,英语,71,
temporary nothing,mxmtoon、,另类/独立-另类流行、,清新、慵懒、放松、,英语,78,
ＣＯＬＤ,TRA$H、,电子-迷幻驰放、,抒情、紧张、悲伤、梦幻、抑郁、放松、憧憬、孤独、神秘、,纯音乐,62,
lmao **** this. bye,ㅤㅤ、,电子、,悲伤、抑郁、孤独、,纯音乐,81,
…,Yung Castor、,电子-缓拍、,抒情、动感、思念、放松、夜店、,纯音乐,127,
♛,PRESERVE、,,抒情、悲伤、思念、孤独、,英语,133,
its been real,rainlord.、,电子-蒸汽波、,动感、爱情、浪漫、旅游、,纯音乐,85,
in love,vietra、,流行-欧美流行、,甜蜜、抒情、动感、悲伤、平静、爱情、思念、慵懒、浪漫、放松、咖啡厅、酒吧、,英语,79,
One For Me (Lucas Remix),Lucas、Ryan Hemsworth、Tinashe、,流行-欧美流行、,抒情、悲伤、放松、,英语,,
Everytime,Saptune、,嘻哈说唱、,爱情、慵懒、浪漫、放松、旅游、,英语,88,
After August,Mr.KiD、,电子-缓拍、,爱情、慵懒、浪漫、放松、,纯音乐,75,
Have Yourself a Merry Little Christmas (feat. j'san),Rook1e、J'san、,嘻哈说唱-说唱伴奏、,慵懒、放松、,纯音乐,82,
call me.,rainlord.、,另类/独立-独立流行、,悲伤、慵懒、放松、,英语,76,
Loveless Nights,cleararmor、,另类/独立、,动感、悲伤、放松、,,,
summer rain,£L、depression、uǝǝʇʇɐǝqpɐǝp、,嘻哈说唱、,悲伤、抑郁、,英语,92,
Where Were U,casual、,,放松、冥想、,纯音乐,,
tonight,Demxntia、,另类/独立-独立流行、,甜蜜、抒情、动感、爱情、思念、慵懒、浪漫、活力、放松、酒吧、正能量、,英语,84,
nothing ever lasts,kyori、,轻音乐、,悲伤、抑郁、放松、孤独、,英语,85,
Luna,Shinigami、,另类/独立、嘻哈说唱、,可爱、快乐、放松、酒吧、,英语,162,
own language.,barnes blvd.、,,紧张、神秘、,英语,69,
will you marry me ?,marlboro.、,电子-缓拍、,可爱、快乐、慵懒、放松、旅游、,纯音乐,99,
Sunflower Dance,Trog'low、,电子、,动感、爱情、浪漫、,纯音乐,95,
hey friend.,KITSU、,流行、,悲伤、抑郁、孤独、,英语,60,
Knock Knock,HYESUNG、,流行-韩国流行、,慵懒、放松、,纯音乐,120,
Wound Up,Jordyn Edmonds、,电子-缓拍、,放松、,纯音乐,75,
C O N F E S S I O N,眠、,电子、,爱情、浪漫、放松、,英语,155,
i still get butterflies,elijah who、,电子-缓拍、,抒情、悲伤、放松、孤独、,英语,89,
id like to walk around in your mind someday,Inteus、,流行-欧美流行、,爱情、慵懒、浪漫、放松、咖啡厅、旅游、,英语,79,
SPIRITS,kuudere、,电子-陷阱舞曲、,平静、可爱、快乐、放松、,纯音乐,105,
✧ ♥ เ ๓เร ย ร๏ ร๏ ร๏ ๓ยςђ ♥ ✧,เђคtє๓yรєlŦ、,嘻哈说唱-说唱伴奏、,悲伤、抑郁、孤独、,纯音乐,59,
『 』,fragile、,,慵懒、放松、旅游、,纯音乐,75,
where i'd rather be,fragile、,嘻哈说唱-低保真嘻哈、,悲伤、抑郁、孤独、,纯音乐,75,
daylight,Mattdeguia、,嘻哈说唱-驰放嘻哈、,抒情、悲伤、抑郁、爱情、慵懒、浪漫、放松、旅游、,纯音乐,83,
For Love,Jeff kaale、,电子、,动感、慵懒、放松、,英语,154,
exceptions,Alembic、,爵士、,悲伤、抑郁、放松、,纯音乐,65,
Stormy Weather (Flip),TKYO GRL、elizatwinkies、,节奏布鲁斯、,放松、,英语,,
by the water,¥EN、,电子-缓拍、,悲伤、平静、可爱、快乐、放松、,纯音乐,69,
... And Relax Beat Tape,I eat Plants for a living、,,抒情、悲伤、,英语,70,
Nice Boys,TEMPOREX、,另类/独立-另类流行、电子-缓拍、,动感、悲伤、可爱、快乐、爱情、浪漫、活力、放松、孤独、旅游、,英语,75,
I'm In Love With You!,YUNG ALOHA、YUNG BAE、,,,,,
i think about u everyday <3,txmmy two、,电子、,慵懒、放松、旅游、,纯音乐,73,
hold on (part 2),ok2222、,电子、,放松、冥想、,纯音乐,60,
"now, i see",barnes blvd.、,嘻哈说唱-驰放嘻哈、,悲伤、孤独、,纯音乐,51,
hello,elijah who、,电子-缓拍、,悲伤、慵懒、放松、,纯音乐,70,
you don't have to cry,Nohidea、,嘻哈说唱-低保真嘻哈、,悲伤、平静、抑郁、放松、孤独、,纯音乐,82,
Her,Kendall Miles、,电子-缓拍、,,纯音乐,85,
i feel empty,Kina、,电子、,抒情、悲伤、抑郁、思念、,英语,55,
Ache,MISO、,电子-缓拍、,动感、梦幻、放松、,纯音乐,83,
christmas in july,engelwood、Joakim Karud、,爵士、,可爱、快乐、放松、,纯音乐,81,
Shinjuku,just big hills、,嘻哈说唱-低保真嘻哈、,悲伤、抑郁、放松、,纯音乐,92,
magnolia,keshi、,电子-缓拍、嘻哈说唱、,抒情、清新、动感、幸福、悲伤、平静、梦幻、快乐、爱情、思念、慵懒、浪漫、放松、憧憬、治愈、孤独、轻快、有氧、暴走、感人、家务、通勤、,英语,69,
Disappear,KY DONG、,嘻哈说唱-驰放嘻哈、,悲伤、抑郁、孤独、,纯音乐,69,
lullaby,mt. marcy、,,悲伤、平静、放松、助眠、,纯音乐,79,
time flies,luv.ly、,,悲伤、孤独、,纯音乐,81,
Take A Look At The Moon,nadiak、,电子-缓拍、流行-欧美流行、,慵懒、放松、,英语,59,
would you miss me,Cat naps、,另类/独立、,悲伤、平静、抑郁、放松、孤独、,英语,85,
streetlights,jiwoo、,流行、,抒情、悲伤、爱情、思念、浪漫、酒吧、,英语,66,
afraid,eel.、,电子-缓拍、,抑郁、悲伤、慵懒、放松、,英语,159,
another year✨,fragile、,电子、,动感、慵懒、放松、,纯音乐,73,
Sinking,Feverkin、Nori、,节奏布鲁斯-灵魂乐、另类/独立、,动感、悲伤、抑郁、孤独、,英语,55,
human music,canti、,电子、,悲伤、抑郁、旅游、,英语,85,
i fell in love with you one night in september.,Rook1e、,嘻哈说唱、,慵懒、放松、,英语,88,
"i, promise",ford、,,悲伤、梦幻、放松、,英语,75,
Strange Sensation,xfruge、,,,纯音乐,68,
Быть рядом.,MΣ$†ΛMN ΣKCПØNΛ†、,电子-氛围音乐、,抒情、动感、悲伤、抑郁、爱情、思念、活力、孤独、,俄语,74,
EFFEX (prod. nyck ;-;),nyck ;-;、,电子、,动感、,纯音乐,84,
August,AVALON、,另类/独立-独立流行、,抒情、悲伤、抑郁、思念、孤独、,英语,70,
I Wrote This Song 4 U (Prod. Killedmyself),LiL BO WEEP、,,抒情、悲伤、抑郁、爱情、思念、浪漫、孤独、,英语,60,
JEWFY SAMPLE CHALLENGE,lil heartbreak、,流行、,抒情、动感、悲伤、抑郁、思念、活力、孤独、遗憾、,英语,129,
OFFSHORE,S U B W A Y S、SACHI TOYOTA '95、,电子、,动感、快乐、,日语,130,
"i'm sick and in love, enjoy",high eyes、,节奏布鲁斯、,爱情、浪漫、,英语,,
Ikanaide / 行かないで,Jewfy 雲の村、,,悲伤、孤独、,日语,120,
Another Dream,Wool Strings、,新世纪-民族新世纪、,平静、放松、学习、助眠、,纯音乐,57,
yah YEET,elijah who、luv.ly、,电子-缓拍、流行、,悲伤、抑郁、孤独、,纯音乐,,
whole heart,m6ke、Shiloh、,嘻哈说唱-低保真嘻哈、,抒情、悲伤、抑郁、爱情、思念、浪漫、孤独、,英语,112,
All Of This,Late June、,轻音乐、,悲伤、抑郁、孤独、,英语,53,
Strange Days,ODD PALMER、,电子-缓拍、,动感、悲伤、抑郁、爱情、浪漫、放松、酒吧、,英语,65,
Strawberries,Freddie Joachim、,电子-缓拍、,爱情、慵懒、浪漫、放松、,纯音乐,95,
Lucky One,mich、,民谣-独立民谣、,清新、幸福、快乐、爱情、浪漫、放松、治愈、轻快、,英语,98,
Flaming Hot Cheetos,Clairo、,另类/独立-独立流行、流行、,抒情、动感、悲伤、爱情、慵懒、浪漫、放松、憧憬、咖啡厅、,英语,110,
Dim Lights,vietra、,另类/独立-独立流行、,抒情、慵懒、放松、,英语,62,
Just Ask,Weird Inside、,轻音乐、,动感、梦幻、放松、,纯音乐,77,
i wish you'd realize i'm crying when i tell you i'm fine,olli、,电子、轻音乐、,动感、可爱、快乐、,英语,80,
candy,_mario、,嘻哈说唱-驰放嘻哈、,可爱、快乐、放松、,英语,89,
ｏｈ✧˖°,Good Grief、,电子、,悲伤、爱情、浪漫、孤独、,英语,101,
Worst Mistake,Park Bird、,嘻哈说唱、,清新、悲伤、可爱、快乐、放松、孤独、旅游、,英语,98,
Adventurous [Exclusive],Sky.High、,,动感、悲伤、抑郁、,纯音乐,74,
ㅤㅤㅤㅤ,ninety-three、KO.JAY、,嘻哈说唱、,悲伤、抑郁、孤独、,英语,74,
You,CeeGee、,流行、,可爱、快乐、爱情、浪漫、放松、,英语,101,
carry on.,tkdwn.、,电子、,悲伤、抑郁、孤独、,英语,91,
air chair,ldst、fragile、,电子、,悲伤、孤独、,日语,126,
Untitled,Bye Mugen、,嘻哈说唱-低保真嘻哈、,慵懒、放松、,纯音乐,58,
❤️,Lynn、,爵士-融合爵士、,悲伤、抑郁、爱情、慵懒、浪漫、放松、旅游、,英语,80,
Summer,l o k a !、,电子、,动感、放松、,纯音乐,86,
us,4oot、,另类/独立-另类流行、轻音乐、,抒情、悲伤、抑郁、思念、孤独、,日语,105,
Ikaw,LJones、,嘻哈说唱、,放松、,菲律宾语,112,
next to you (prod. by alicks.),lil hawk boy、,电子-缓拍、,悲伤、抑郁、孤独、,英语,124,
hold up,E e v e e、,电子-缓拍、,慵懒、放松、,纯音乐,78,
I Don't Sleep,Sarcastic Sounds、,嘻哈说唱-低保真嘻哈、,抒情、悲伤、抑郁、思念、慵懒、放松、孤独、酒吧、,英语,80,
why do i love you,eel.、,电子-缓拍、,抒情、悲伤、平静、梦幻、抑郁、爱情、思念、浪漫、放松、治愈、孤独、遗憾、,英语,72,
cho em theo anh nhé .,phaolobeats、,电子-蒸汽波、,抒情、思念、慵懒、放松、,越南语,114,
Misty,ninjoi.、,嘻哈说唱-融合说唱、,动感、梦幻、放松、,纯音乐,84,
we don't talk anymore,mimikyu、,,放松、冥想、,纯音乐,66,
Waking Up At Night To Get Some Food,Sky.High、,嘻哈说唱-爵士嘻哈、,动感、慵懒、放松、旅游、,纯音乐,80,
[ rogue ] - [leaves],lofi.hiphop、,嘻哈说唱、,动感、爱情、慵懒、浪漫、放松、旅游、,纯音乐,74,
"someday, somewhere",Cat naps、,另类/独立、,抒情、悲伤、快乐、思念、慵懒、放松、治愈、旅游、轻快、,纯音乐,60,
rainy day in a city in the universe,mimikyu、,轻音乐、,悲伤、平静、梦幻、放松、,纯音乐,74,
Conflate,l o k a !、,电子-缓拍、,放松、,英语,80,
Fast Glass,Blue Wednesday、,嘻哈说唱、,动感、,英语,79,
☂ *sᴀᴅᴘᴜsʜᴇᴇɴ* ☁,O i i g i ≈、,轻音乐、,动感、悲伤、,纯音乐,85,
had time...,silky soap、,流行、,平静、放松、,印尼语,117,
For U,RZON、,电子、,动感、放松、,纯音乐,86,
february,luvbird、,电子-缓拍、,动感、梦幻、快乐、放松、,纯音乐,85,
That Girl,卿Mittens、,电子-蒸汽波、,悲伤、抑郁、放松、,纯音乐,136,
tired of love.,卿Mittens、,电子、,放松、,纯音乐,76,
Winter Is Here,卿Mittens、,爵士、,动感、悲伤、放松、,纯音乐,83,
Chihiro,卿Mittens、,电子、,动感、悲伤、抑郁、,纯音乐,,
Too Easily,卿Mittens、,爵士、,慵懒、放松、,英语,84,
Rain,Kev、,电子-蒸汽波、,悲伤、梦幻、抑郁、放松、孤独、,纯音乐,67,
School Rooftop,the girl next door、,嘻哈说唱-低保真嘻哈、,悲伤、抑郁、,纯音乐,82,
June Gloom.,prima、,嘻哈说唱-低保真嘻哈、,抒情、爱情、慵懒、浪漫、放松、酒吧、,英语,77,
I Can't Help,Sarcastic Sounds、,流行、嘻哈说唱-驰放嘻哈、,抒情、悲伤、快乐、爱情、思念、慵懒、浪漫、放松、夜店、旅游、,英语,81,
@_@,IOAH、,电子-蒸汽波、,可爱、快乐、慵懒、放松、旅游、,纯音乐,95,
III,olli、,电子、,动感、慵懒、放松、,纯音乐,80,
where are you,linanthem.、,流行-韩国流行、,悲伤、可爱、快乐、,日语,91,
saturdaycartoons,geerad、,嘻哈说唱-器乐说唱、,抒情、悲伤、爱情、浪漫、孤独、,英语,79,
Aoba,shogonodo、,流行-日本流行、,动感、悲伤、放松、酒吧、旅游、,日语,139,
Water,Caleb Belkin、,,动感、爱情、浪漫、,纯音乐,83,
I,olli、,电子、,动感、慵懒、放松、,纯音乐,,
Pazz Jiano,I eat Plants for a living、,爵士-融合爵士、,爱情、浪漫、放松、旅游、,纯音乐,70,
