歌名,歌手,曲风,推荐标签,语种,BPM,乐评
"The Seasons, Op.37b:10. October: Autumn's Song",Vladimir Ashkenazy、,古典-浪漫主义音乐、,平静、放松、学习、,纯音乐,142,
"The Well-Tempered Clavier, Book 1:Prelude and Fugue No. 4 in C sharp minor, BWV 849",Sviatoslav Richter、,古典-巴洛克音乐、,平静、放松、,纯音乐,76,
Adagio Fra Concerto Di Aranjuez. Gitarkonsert Sats 2,Aage Kvalbein、,古典、,平静、爱情、浪漫、放松、学习、助眠、冥想、,纯音乐,64,
"Lieder ohne Worte Op.30:No. 6. Allegretto in F sharp minor ""Venetian Gondola Song""",András Schiff、,古典、,放松、,纯音乐,145,
"Kinderszenen, Op. 15:No. 1, Von fremden Ländern und Menschen",Jean-Bernard Pommier、,古典-浪漫主义音乐、,平静、放松、冥想、,纯音乐,147,
Stille Natt,Iver Kleive、Aage Kvalbein、,古典、,抒情、爱情、浪漫、冥想、,纯音乐,95,
"Fantasy In F Minor, D. 940 (Op.103) For Piano Duet",Maria Joao Pires、,古典-浪漫主义音乐、,放松、学习、,纯音乐,116,
"Berceuse in D flat major, Op. 57: Andante",Tamás Vásáry、,古典、,平静、放松、冥想、,纯音乐,,
Abendlied,Shuku Iwasaki、Janos Starker、,古典、,平静、放松、,纯音乐,132,
"Piano Trio No.4 in B flat major, Op.11“Gassenhauer”:II. Adagio",Beaux Arts Trio、,古典-古典主义音乐、,放松、平静、,纯音乐,78,
"Piano Trio No. 1 in E-Flat Major, Op. 1 No. 1:II. Adagio cantabile",Itzhak Perlman、Lynn Harrell、Michael Sheady、Suvi Raj Grubb、Vladimir Ashkenazy、,古典、,抒情、,,,
"Piano Concerto in A Minor, Op. 16:II. Adagio",Arthur Rubinstein、Alfred Wallenstein、,古典、,抒情、感人、,纯音乐,126,
Piano Concerto in G Major M. 83:2. Adagio assai,Martha Argerich、Berliner Philharmoniker、Claudio Abbado、,古典-浪漫主义音乐、,平静、放松、学习、冥想、,纯音乐,153,
"25 Preludes dans tous les tons majeurs et mineurs, Op. 31: No. 13 J'etais endormie, mais mon coeur veillait... (Cantique des cantiques, 5:2), Lentement",Laurent Martin、,古典-浪漫主义音乐、,平静、放松、学习、冥想、,欧美,,
"Stücke im Volkston (5) for cello (or violin) & piano, Op. 102- 2. Langsam",Maria Joao Pires、Douglas Boyd、,,抒情、,,,
"4 Impromptus, Op.90, D.899:No.3 in G Flat Major: Andante",Radu Lupu、Franz Schubert、,古典、,平静、放松、冥想、,纯音乐,123,
Franz Liszt: Mélodie polonaise S.249a,Franz Liszt、Leslie Howard、,古典、,抒情、,,,
Arabasque No. 1 (feat. Claude Debussy),Ton、Claude Debussy、,古典、,热血、动感、爱情、浪漫、,英语,,
"Romance from Violin Concerto No.2 in D minor, Op.22:2. Romance",Joshua Bell、The Cleveland Orchestra、Vladimir Ashkenazy、,古典-古典跨界、,梦幻、放松、冥想、,,127,
"Romance, Op. 28: No. 2 in F-Sharp Major",Arthur Rubinstein、,古典-浪漫主义音乐、,平静、放松、冥想、,,126,
"Dawn (From ""Pride and Prejudice"")",Olivia Belli、,,,英语,,
"Sonata for Cello and Piano in G minor, Op. 19:3. Andante",Lynn Harrell、Vladimir Ashkenazy、Sergei Rachmaninoff、,古典、,学习、放松、平静、,纯音乐,128,
"The Swan (From ""Carnival of the Animals"")",马友友、Kathryn Stott、,,平静、放松、学习、冥想、,纯音乐,64,
"Nocturne No.10 in A flat, Op.32 No.2",Daniel Barenboim、,古典-浪漫主义音乐、,平静、放松、,纯音乐,,
Le Carnaval des Animaux:Le Cygne,Varda Nishry、,古典-浪漫主义音乐、,平静、放松、,纯音乐,114,
Arioso,Shuku Iwasaki、Janos Starker、,古典-巴洛克音乐、,悲伤、抑郁、放松、学习、,纯音乐,51,
June Barcarolle Op.37 No.6,Vladimir Ashkenazy、,古典、,平静、放松、学习、助眠、冥想、,纯音乐,70,
Clair de Lune (from Suite Bergamasque),Kun Woo Paik、,古典-印象主义音乐、,抒情、平静、放松、冥想、,纯音乐,80,
"Concerto grosso in F Major, Op. 6 No. 12:I. Preludio. Adagio",Jean-François Paillard、Orchestre de Chambre Jean-François Paillard、,古典、,学习、悲伤、抒情、,,124,
"Concerto grosso in B flat, Op.6, No.5:2. Adagio",The English Concert、Trevor Pinnock、,古典-巴洛克音乐、,放松、,欧美,,
"Schwanengesang, D. 957:No. 4, Ständchen (Arr. for Cello and Piano)",John Lenehan、Julian Lloyd Webber、,古典-浪漫主义音乐、,平静、放松、冥想、,纯音乐,69,
"Piano Concerto No. 4 in G Minor, Op. 40 (1941 3rd Version):II. Largo",王羽佳、Los Angeles Philharmonic、Gustavo Dudamel、Sergei Rachmaninoff、,古典、,梦幻、放松、学习、冥想、,纯音乐,119,
"Études d'exécution transcendante, S. 139: No 3, Paysage (Poco adagio)",Francesco Piemontesi、,古典、,平静、放松、冥想、,纯音乐,404,
"Cello Sonata in G Minor, Op. 65:III. Largo",Gautier Capuçon、王羽佳、,古典-浪漫主义音乐、,平静、梦幻、放松、,纯音乐,132,
"Piano Sonata No.14 in C minor, K.457:2. Adagio",András Schiff、,古典-古典主义音乐、,平静、梦幻、放松、冥想、,纯音乐,135,
"Nocturne No. 18 in E, Op. 62, No. 2",Arthur Rubinstein、,古典-浪漫主义音乐、,平静、放松、,纯音乐,133,
"Préludes Books I & II, BOOK 1: VII. La terrasse des audiences du clair de lune",Cécile Ousset、,古典-印象主义音乐、,放松、冥想、,纯音乐,132,
"Nocturne No.8 in D flat, Op.27 No.2",Peter Schmalfuss、,古典-浪漫主义音乐、,平静、放松、冥想、,纯音乐,63,
Mazurka No.41 in C Sharp Minor Op.63 No.3,Vladimir Ashkenazy、,古典-浪漫主义音乐、,平静、放松、,纯音乐,122,
Arabesque No.1,Leff Pouishnov、,古典、,平静、放松、助眠、冥想、,纯音乐,75,
Trois Gymnopédies (1888):I: Lent et douloureux,Aldo Ciccolini、,古典-印象主义音乐、,悲伤、抑郁、孤独、助眠、,纯音乐,82,
Fantasiestücke Op.73:I. Zart und mit Ausdruck,Jacqueline du Pré、,古典-浪漫主义音乐、,平静、放松、学习、,纯音乐,113,
"Variations On ""Ah Vous Dirai:Je Maman"" K265",Lars Roos、,古典-古典主义音乐、,学习、,,,
Oh! Weep for Those (Arr. Isserlis),Steven Isserlis、Connie Shih、,古典、,学习、平静、放松、,,111,
"Nocturne No. 1 in B-Flat Minor, Op. 9 No. 1",Bruno Rigutto、,古典、,平静、放松、,,152,
Swan and Maiden,Diego Campagna、,古典、,抒情、,纯音乐,,
Scaramouche Suite (Version for 2 Pianos):II. Modéré,Evgeny Kissin、Martha Argerich、,古典、,幸福、快乐、热血、动感、,纯音乐,136,
"Studies on Chopin's Etudes: No. 5 in D-Flat Major for Left Hand on Etude, Op. 10 No. 3",Marc-André Hamelin、,古典、,梦幻、放松、,,131,
"Violin Concerto in D Major, RV 230: II. Larghetto (Arr. for Organ)",Antonio Vivaldi、Keith John、,古典、,抒情、放松、,英语,,
"Le rossignol éperdu: No. 16, Les rêveries du Prince Églantine",Pavel Kolesnikov、,古典、,梦幻、放松、平静、冥想、,,140,
"Lyric Pieces, Book 9, Op. 68:Badnlat (Cradle Song)",Einar Steen-Nøkleberg、,古典-浪漫主义音乐、,平静、放松、冥想、,英语,,
Sonata a mandolino e basso in C Major:II. Adagio,Alla Tolkacheva、Vincent Bernhardt、Oleguer Aymamí Busqué、,古典、,放松、抒情、,纯音乐,119,
"Lyric Pieces Book V, Op.54:4. Notturno",Emil Gilels、,古典-浪漫主义音乐、,抒情、平静、放松、冥想、,纯音乐,142,
Love at Night of Tulips,Diego Campagna、,古典、,抒情、,纯音乐,,
Meditation,Sonat Sozer、Ece Sozer、,古典、,放松、,土耳其语,137,
"6 Romances, Op. 38: No. 5, The Dream (Arr. Wild)",Martin Jones、Sergei Rachmaninoff、Earl Wild、,古典、,抒情、,英语,,
Violin Sonata:II. Andantino,Philippe Quint、William Wolfram、,古典-二十世纪音乐、古典-当代古典音乐、,抒情、,英语,,
Sonate Pour Flute Traversière En Ré Mineur RV 49:Prelude,Jean-Christophe Frisch、Claude Wassmer、Pascale Boquet、Alessandro de Marchi、Jean Christophe Frisch、Christine Plubeau、,古典-巴洛克音乐、,平静、放松、,,117,
"Prelude and Fugue in C (WTK, Book I, No.1), BWV 846",András Schiff、,古典-巴洛克音乐、,冥想、放松、平静、,纯音乐,125,
"Kinderszenen, Op.15:13. Der Dichter spricht",Daniel Barenboim、,古典、,平静、放松、助眠、,纯音乐,54,
Largo - Sonata No. 6 BWV 1019,Tenenbaum & Kapp、,古典、,感人、抒情、,英语,,
"Piano Sonata No. 11 in A Major, K331: I. Andante grazioso",Wolfgang Amadeus Mozart、Christian Blackshaw、,古典-古典主义音乐、,平静、放松、学习、,英语,111,
"Violin Concerto No. 1 in C Major, Hob. VIIa:1: II. Adagio",Isabelle Faust、,古典-古典主义音乐、,可爱、快乐、放松、学习、,英语,,
Cello Concerto No. 2 In D Major: Adagio,Miklos Perenyi、,古典、,大气、,英语,,
Rêverie on a theme of V. A. Loginov,Vladimir Petroschoff、Philharmonisches Festspielorchester、,古典、,平静、放松、,,,
"Rêve d'enfant, Op. 14",Frank Peter Zimmermann、フランク・ペーター・ツィンマーマン、Edoardo Maria Strabbioli、,古典、,放松、,,,
Sonate Pour Violoncelle Et Piano - II. Cavatine (Francis Poulenc),Iseut Chuat / Emile Naoumoff、,古典、,轻快、快乐、,英语,,
Julia Florida,Augustin Barrios Mangoré、,新世纪、,热血、动感、正能量、,英语,179,
"13 Preludes, Op. 32 no. 10: Prelude in B Minor - Lento",Claire Huangci、,古典、,平静、梦幻、放松、冥想、,,,
"Six Pieces for Piano, Volume 2:4. La Valse d'Amélie",郎朗、,古典、,平静、放松、学习、冥想、,纯音乐,64,
"Piano Concerto No. 20 in D Minor, K. 466:II. Romance",Columbia Symphony Orchestra、Rudolf Serkin、George Szell、,古典、,平静、梦幻、放松、学习、,纯音乐,89,
"Piano Concerto No. 2 in C Minor, Op. 18:II. Adagio sostenuto",Sergei Rachmaninoff、Philadelphia Orchestra、Leopold Stokowski、,古典-浪漫主义音乐、,放松、助眠、冥想、,纯音乐,,
"Piano Concerto in G Major, M. 83:2. Adagio assai",Martha Argerich、Berliner Philharmoniker、Claudio Abbado、,古典-浪漫主义音乐、,平静、放松、学习、冥想、,纯音乐,151,
"Piano Sonata No. 13 in E-Flat Major, Op. 27 No. 1 ""Quasi una fantasia"":I. Andante - Allegro - Tempo I",Rudolf Buchbinder、,古典、,平静、放松、,纯音乐,130,
Symphony No.1 In C Minor Op.68:2. Andante sostenuto,Berliner Philharmoniker、Herbert von Karajan、,古典-浪漫主义音乐、,梦幻、放松、冥想、,纯音乐,132,
"Adagio and Allegro, Op. 70:Adagio",Maria Kliegel、Kristin Merscher、,古典-浪漫主义音乐、,平静、放松、学习、冥想、,英语,,
Andante cantabile and Presto agitato in B Major: Andante cantabile e Presto agitato in B Major,Benjamin Frith、,古典-浪漫主义音乐、,洒脱、,欧美,,
Avril 14th (Aphex Twin) (Vanessa Wagner Version),Murcof、Vanessa Wagner、,摇滚-流行摇滚、另类/独立、,平静、放松、冥想、,纯音乐,,
Widmung S.566 after Schumann,Joseph Cooper、,古典-浪漫主义音乐、,平静、放松、冥想、,纯音乐,121,
"Bénédiction de Dieu dans la solitude, for piano:Più sostenuto quasi preludio - Tempo I - Andante semplice",Claudio Arrau、,古典-浪漫主义音乐、,平静、梦幻、放松、冥想、,纯音乐,,
"Sonata No. 8 in C Minor, Op. 13, ""Pathétique"": II. Adagio cantabile",Arthur Rubinstein、,古典-古典主义音乐、,平静、放松、助眠、冥想、,纯音乐,70,
Melody in F Op.3 No.1,Shura Cherkassky、,古典、,平静、放松、学习、冥想、,纯音乐,146,
"Twelve Songs for the Keyboard, Book I: I. Das strickende Mädchen (The Knitting Girl), Hob.XXVIa/1",Jane Edwards、Franz Joseph Haydn、Geoffrey Lancaster、,,放松、,英语,,
"Piano Sonata No. 2 in B-Flat Minor, Op. 35:III. Marche funèbre. Lento",Rafał Blechacz、Frédéric François Chopin、,古典、,平静、放松、冥想、,,124,
"Symphony No. 5 in B-Flat Major, D. 485: II. Andante con moto",Freiburger Barockorchester、Pablo Heras-Casado、,古典、,放松、平静、热血、动感、,纯音乐,123,
"Piano Concerto No. 2 in F Minor, Op. 21:II. Larghetto",Seong-Jin Cho、London Symphony Orchestra、Gianandrea Noseda、,古典、,梦幻、放松、冥想、平静、,纯音乐,128,
"24 Préludes, Op. 28: No.15 in D flat major - Sostenuto",Alexandre Tharaud、,古典、,放松、学习、冥想、,英语,,
"Impromptu No. 4 in C sharp minor, Op. 66 'Fantaisie-Impromptu': Allegro agitato",Anatol Ugorski、,古典-浪漫主义音乐、,平静、放松、助眠、冥想、,纯音乐,90,
"Serenade in B-Flat Major, K. 361/370a, ""Gran Partita"":III. Adagio",Various Artists、,古典-古典主义音乐、,学习、冥想、放松、,纯音乐,125,
"Wachet auf, ruft uns die Stimme, BWV 645 (Remastered)",Johann Sebastian Bach、,古典、,学习、放松、冥想、,英语,,
"Piano Concerto No. 1 in E Minor, Op. 11: II. Romanze (Larghetto)",Ingrid Fliter、Scottish Chamber Orchestra、Jun Markl、,古典、,抒情、,纯音乐,,
"Andante Cantabile (From String Quartet No. 1, Op. 11): Andante cantabile in B-Flat Major",吕思清、,古典-浪漫主义音乐、,放松、学习、,纯音乐,150,
Romance For Violin And Orchestra No.2 In F Major Op.50,David Oistrakh、Moscow Philharmonic Orchestra、Gennady Rozhdestvensky、,古典-古典主义音乐、,学习、平静、放松、冥想、,纯音乐,96,
"String Quartet No. 15 in D Minor, K. 421: II. Andante",Musopen String Quartet、,古典、,动感、活力、,,138,
Violin Concerto No.1 in E minor:2. Andante,Henryk Szeryng、London Symphony Orchestra、Antal Doráti、,古典-浪漫主义音乐、,放松、冥想、,,,
"Air For The ""G"" String",Johann Sebastian Bach、,古典-巴洛克音乐、,放松、学习、助眠、,纯音乐,95,
"Violin Sonata No. 32 in B-Flat Major, K. 454:II. Andante",Noa Wildschut、Yoram Ish-Hurwitz、,古典-古典主义音乐、,悲伤、平静、放松、学习、,英语,142,
"Violin Concerto No. 1 in D Major, Op. 19: I. Andantino: Andante assai",Ruggiero Ricci、,古典-二十世纪音乐、,正能量、,英语,,
"Souvenir d'un lieu cher, Op. 42:No. 3. Melodie",Julia Fischer、Yakov Kreizberg、,古典-浪漫主义音乐、,平静、梦幻、放松、学习、,纯音乐,72,
"Violin Sonata No. 3 in D Minor, Op. 108:Violin Sonata No. 3 in D Minor, Op. 108: III. Un poco presto e con sentimento",Elmar Oliveira、Walter Ponce、,古典-浪漫主义音乐、古典-二十世纪音乐、,放松、平静、,英语,,
"String Quartet in A Minor, JS 183:II. Adagio ma non tanto",Jean Sibelius Quartet、,古典-二十世纪音乐、,梦幻、放松、平静、,纯音乐,,
"Sonata No. 2 in A Major, BWV 1015: I. -",Glenn Gould、Jaime Laredo、,古典-巴洛克音乐、,悲伤、平静、放松、学习、,,135,
"Violin Concerto in C-Sharp Minor, Op. 2:III. Rondo. Allegretto",Tobias Ringborg、Swedish Chamber Orchestra、Niklas Willén、,古典-浪漫主义音乐、古典-二十世纪音乐、,放松、,英语,,
"Violin Sonata in E Minor, Op. 82:II. Romance",Simone Lamsma、Yurie Miura、,古典-二十世纪音乐、,平静、放松、学习、,英语,,
"Double Concerto for Violin and Cello in A Minor, Op. 102:II. Andante",Renaud Capuçon、Gautier Capuçon、郑明勋、Gustav Mahler Jugendorchester、,古典-浪漫主义音乐、,放松、学习、冥想、,,,
"Violin Concerto in D Minor, MWV O3: III. Allegro",Württemberg Chamber Orchestra、Jörg Faerber、Susanne Lautenbacher、,古典、,抒情、,纯音乐,,
"Violin Concerto No. 2 in G Minor, Op. 131:II. Adagio quasi andante",Chloë Hanslip、Košice Slovak State Philharmonic Orchestra、Kirk Trevor、,古典-浪漫主义音乐、,平静、梦幻、放松、学习、冥想、,英语,,
"Violin Concerto No. 5 in A Major, K. 219 ""Turkish"":II. Adagio",Vadim Repin、Wiener KammerOrchester、Yehudi Menuhin、,古典-古典主义音乐、,平静、放松、学习、,纯音乐,128,
"Violin Concerto in A Minor, BWV 1041: III. Allegro assai",西崎崇子、Capella Istropolitana、Oliver Dohnányi、,古典-巴洛克音乐、,热血、动感、放松、治愈、学习、,纯音乐,118,
Song without Words in D Op.109,Jacqueline du Pré、,古典-浪漫主义音乐、,平静、放松、,纯音乐,95,
"Violin Concerto No. 3 in E Major, MS 50:II. Adagio, cantabile spianato",Erno Rozsa、Michael Dittrich、Slovak Radio Symphony Orchestra、,古典-浪漫主义音乐、,平静、放松、,英语,,
"24 Caprices, Op. 1:No. 11 in C Major",Itzhak Perlman、,古典、,,,131,
"Cavatina, Op.85 No 3 (1995 Remastered Version)",Itzhak Perlman、Samuel Sanders、Suvi Raj Grubb、,古典、,平静、放松、,英语,132,
"String Quartet in E-Flat Major, Op. 58, No. 2, G. 243:IV. Finale: Allegro vivo assai",Revolutionary Drawing Room、,古典、,大气、,纯音乐,,
"The Four Seasons: Autumn - Concerto No. 3 in F Major, RV 293: III. Allegro","Felix Ayo, I Musici, Felix Ayo、",古典、,,,,
"Beethoven: Violin Romance No.2 in F, Op.50",Bernard Haitink、Concertgebouworkest、Arthur Grumiaux、,轻音乐、古典、,梦幻、放松、,纯音乐,,
"Violin Sonata (Sonatina) in G Minor, Op. 137, No. 3, D. 408:IV. Allegro moderato",Hyejin Chung、Warren Lee、,古典-浪漫主义音乐、,平静、放松、,英语,,
"Romance, Op. 23:Violin Romance, Op. 23",Rachel Barton Pine、Matthew Hagle、,古典-浪漫主义音乐、古典-二十世纪音乐、,轻快、快乐、,英语,,
"Violin Concerto No. 3 in G Major, K. 216:II. Adagio (cadenza by H. Kraggerud)",Henning Kraggerud、Norwegian Chamber Orchestra、,古典、,平静、放松、学习、冥想、,英语,,
"Violin Concerto, Op. 33, FS 61: IIa. Poco adagio",Liya Petrova、,古典-二十世纪音乐、,甜蜜、热血、动感、爱情、正能量、,英语,,
"Partita For Violin Solo No.1 In B Minor, BWV 1002:2a. Corrente",Nathan Milstein、,古典、,放松、学习、,,151,
String Quartet in F major:I. Moderato très doux,Quatuor Parrenin、,古典、,平静、放松、,纯音乐,,
"Piano Sonata No.1 In C, K.279:2. Andante",Maria Joao Pires、,古典-古典主义音乐、,平静、放松、学习、冥想、,,,
"Pavane pour une infante défunte, M. 19a",John Wilson、Sinfonia Of London、,古典、,平静、梦幻、放松、冥想、,,,
"Suite Española No. 1, Op. 47:Granada",Alicia de Larrocha、,古典、,平静、放松、,,,
"Piano Trio in C Major, K. 548: II. Andante cantabile",The Mozartean Players、,古典、,悲伤、平静、苦情、放松、,,,
"Piano Sonata No. 16 in C Major, K. 545 ""Sonata facile"":2. Andante",内田光子、Wolfgang Amadeus Mozart、,古典、,学习、平静、放松、冥想、,纯音乐,198,
"6 Consolations, S. 172: V. Andantino",Mariam Batsashvili、,古典-浪漫主义音乐、,,纯音乐,133,
"Adagio in F, H.XVII:No.9",Alfred Brendel、,古典-古典主义音乐、,平静、放松、,,147,
"Sonata in G Major, Wq.62/19: 2. Andante",Mikhail Pletnev、,古典、,梦幻、放松、,,,
"Piano Sonata in E-Flat Major, WoO 47, No. 1, ""Kurfurstensonaten"":I. Allegro cantabile",Jeno Jando、,古典、,放松、冥想、平静、,英语,,
Le Carnaval des Animaux:Tortues,Nelson Freire、Martha Argerich、Eduard Brunner、Gidon Kremer、Irena Grafenauer、Mischa Maisky、Isabelle van Keulen、Tabea Zimmermann、Markus Steckeler、Georg Maximilian Hörtnagel、Edith Salmen-Weber、,古典-浪漫主义音乐、,梦幻、放松、,纯音乐,119,
"Symphony in C Minor, Bryan Cm2: II. Andante",London Mozart Players、Matthias Bamert、,古典、,放松、,,,
"Songs without Words, Op. 38, No. 2 in C Minor: Andante",Philippe Cassard、,古典、,,,,
"Piano Sonata No. 2 In A Major, Op. 2, No. 2:4. Rondo (Grazioso) (Live)",András Schiff、,古典、,放松、,英语,129,
"Sarabande et Rigaudon, Op. 93:Sarabande",Lille National Orchestra、Jun Märkl、,古典-浪漫主义音乐、,快乐、轻快、,英语,,
"Études, Op. 10: Etude No. 6 in E-Flat Minor, Op. 10, No. 6",Vardo Rumessen、,古典-浪漫主义音乐、,,纯音乐,,
"Water Music:Suite No. 1 in F Major, HWV 348, VII. Air",Pierre Boulez、,古典、,平静、慵懒、放松、,,124,
"Davidsbündlertänze, Op. 6: No. 14, Zart und singend",Paul Berkowitz、Robert Schumann、,古典、,抒情、,英语,,
"Piano Sonata No. 12 In F Major, K. 332: II. Adagio",John Browning、Wolfgang Amadeus Mozart、,古典、,,,,
"Symphony in G Major, Bryan G6:II. Andante molto grazioso",Toronto Chamber Orchestra、Kevin Mallon、,古典、,,英语,,
"8 Pieces, Op. 83: No. 2, Allegro con moto",Max Christian Friedrich Bruch、Trio Eléonore、,古典、,快乐、轻快、,法语,,
"Messiah, HWV 56, Part I: Pifa, ""Pastoral Symphony""","Gilbert Johnson, Martha Lipton, Eileen Farrell, Davis Cunningham, William Warfield, Richard P. Condi、Georg Friedrich Händel、Philadelphia Orchestra、Eugene Ormandy、",古典、,正能量、大气、浪漫、爱情、动感、,英语,,
"Suite d'Abdelazer: or, the moor's revenge: Ouverture",Ensemble Orchestral Harmonia Nova & Didier Bouture、Henry Purcell、Ensemble orchestral Harmonia Nova、Didier Bouture、,,正直、,英语,,
"Nocturnes, Op. 27:No. 2 in D-Flat Major",Arthur Rubinstein、,古典-浪漫主义音乐、,平静、放松、冥想、,,,
"8 Variations on an Original Theme for Piano Four-Hands, Op. 35, D. 813:Variation V",Anne Queffélec、Imogen Cooper、,古典、,,,125,
Schwanenlied,Eva Oertle、Consuelo Giulianelli、,古典、,平静、放松、学习、冥想、,,149,
Ave María (Arr. Víkingur Ólafsson),Víkingur Ólafsson、Sigvaldi Kaldalóns、,古典、,,纯音乐,131,
Three Postludes (1981/82): Postlude No. 3,Valentin Silvestrov、,爵士、古典、,学习、平静、放松、冥想、,纯音乐,139,
Générique de fin,Gabriel Yared、,原声带-电影原声、,动感、活力、,,,
Concertino bianco:1. Con intenerimento,Tamara-Anna Cislowska、Tasmanian Symphony Orchestra、Johannes Fritzsch、,古典、,平静、放松、冥想、,纯音乐,190,
"Fantaisie-Impromptu,Op.Posth",李云迪、,古典-浪漫主义音乐、,平静、放松、学习、,纯音乐,85,
Mozart: Concerto For Clarinet And Orchestra In A (K. 622),John Barry、,古典-古典主义音乐、,,,,
"Klaviersonate in A-Dur, KV 331",Immo Zircher、,原声带-电影原声、古典-古典主义音乐、,放松、,纯音乐,127,
"Piano Sonata No.44 in G min, Op.54, No.1 : Moderato",Sviatoslav Richter、,古典、,平静、可爱、快乐、放松、,纯音乐,,
"Salut d'Amour, Op. 12",马友友、Kathryn Stott、,轻音乐、古典-古典跨界、,平静、放松、助眠、,纯音乐,82,
"Suite No.3 in D, BWV 1068:2. Air",Johann Sebastian Bach、,古典-巴洛克音乐、,梦幻、放松、学习、冥想、,纯音乐,50,
Sonata for Piano and Violin in F K.376:2. Andante,Hilary Hahn、Natalie Zhu、,古典-古典主义音乐、,悲伤、平静、放松、学习、,纯音乐,140,
Minuet in G,Ludwig van Beethoven、,古典、,平静、放松、学习、,纯音乐,76,
Sonata For Piano And Violin In E Minor K.304:2. Tempo di minuetto,Hilary Hahn、Natalie Zhu、,古典-古典主义音乐、,平静、放松、学习、,纯音乐,116,
"Piano Sonata No.20 in A, D.959: II. Andantino",Philippe Cassard、,,平静、放松、,纯音乐,,
Clarinet Concerto in B-Flat Major (reconstructed R. Meylan):I. Andante sostenuto,Béla Kovács、Camerata Budapest、László Kovács、,古典-浪漫主义音乐、,梦幻、放松、冥想、,英语,,
"Berceuse in D-Flat Major, Op. 57",Dong Hyek Lim、,古典-浪漫主义音乐、,平静、放松、冥想、,,,
Symphony No. 5:IV. Adagietto (Sehr langsam),Sir John Barbirolli、New Philharmonia Orchestra、,古典、,爱情、浪漫、,纯音乐,96,
"Keyboard Sonata in C Major, Hob. XVI:1: II. Andante",Rudolf Buchbinder、,古典、,悲伤、平静、抑郁、放松、学习、,纯音乐,125,
"Consolations, S.172: III. Lento placido in D-Flat Major",Franz Liszt、Vladimir Mishchuk、,古典、,平静、放松、冥想、,英语,141,
Bizet - L'Arlesienne Suite No. 1:L' Arlesienne: Minuetto,Idil Biret、,古典-巴洛克音乐、古典-浪漫主义音乐、,,英语,,
"24 Preludes, Op. 28: No. 15 in D-Flat Major ""Raindrop""",Frederic Chopin、Evgeny Kissin、,古典、,洒脱、大气、,,,
"Antiche danze ed arie per liuto, Suite No. 3, P. 172: I. Italiana. Andantino",Orchestra giovanile Filarmonici Friulani、Marco Fiorini、Giuseppe Barutti、,古典、,思念、抒情、梦幻、放松、学习、悲伤、,纯音乐,,
Piano Concerto In A Minor Op.16:2. Adagio,Krystian Zimerman、Berliner Philharmoniker、Herbert von Karajan、,古典-浪漫主义音乐、,放松、冥想、,纯音乐,141,
Le tombeau de Couperin (version for orchestra): No. 3. Menuet,The Chamber Orchestra of Philadelphia、,,学习、放松、思念、抒情、,,,
"Herz und Mund und Tat und Leben, Cantata BWV 147:Jesus bleibet meine Freunde",Gheorghe Zamfir、Diane Bish、,古典-当代古典音乐、,,,114,
Carnival of the Animals: XIII. Le Cygne (The Swan) (arr. P. Vidal for cello and orchestra),Gabriel Schwabe、,古典-浪漫主义音乐、,梦幻、放松、冥想、,纯音乐,59,
"360 Preludes in All Major and Minor Keys, Op. 47: 15 Preludes in A Major",Vitlaus von Horn、,古典、,,欧美,,
In Autumn:II. Through the Eaves: Allegro moderato e rubato,Ashley Wass、,古典-二十世纪音乐、,,英语,,
"Sonata No. 1 In E-Flat, BWV 525:2. Adagio",Ton Koopman、,古典、,平静、梦幻、放松、学习、冥想、,纯音乐,66,
Hungarian Dance No. 5 in G Minor - Orchestrated by Iván Fischer,Budapest Festival Orchestra、Iván Fischer、,古典、,,,131,
