歌名,歌手,曲风,推荐标签,语种,BPM,乐评
Sonata for Violin and Piano:II. Largo sostenuto,Alessio Bidoli、Bruno Canino、,古典、,学习、悲伤、放松、平静、,,127,
"Albumblatt, WWV 94",Guillaume Bellom、Renaud Capuçon、,古典、,悲伤、平静、放松、学习、,纯音乐,,
"Violin Concerto No. 1 in A Minor, Op. 28: II. Andante",Nathan Milstein、The Philharmonia、Harry Blech、,古典、,平静、放松、学习、冥想、,,,
"Violin Concerto No.5 In A, K.219:2. Adagio",Hilary Hahn、,古典-古典主义音乐、,平静、放松、学习、,纯音乐,133,
"Serenade for String Orchestra, Op. 20:II. Larghetto",Daniel Hope、Zürcher Kammerorchester、,古典、,神秘、紧张、,,122,
"Vocalise, Op. 34, No. 14",Vladimir Ashkenazy、Zsolt-Tihamér Visontay、,古典-浪漫主义音乐、,悲伤、平静、放松、,纯音乐,129,
"Ave Maria, D. 839 (Arr. Garrett / van der Heijden for Violin and Orchestra)",David Garrett、Franck van der Heijden、Orchestra the Prezent、Franz Schubert、,古典、,放松、学习、冥想、,纯音乐,133,
"Violin Sonata No. 1 in G Minor, BWV 1001:I. Adagio",Itzhak Perlman、,古典、,,纯音乐,125,
"Sonata For Violin And Piano No.1 In F Minor, Op.80 : 3. Andante",Gidon Kremer、Martha Argerich、,古典、,,,,
Sonata for Violin and Piano in A D.574:1. Allegro moderato,Gidon Kremer、Valery Afanassiev、,,抒情、平静、快乐、放松、学习、,,,
"Sonata For Piano And Violin Sonata No.5 In F Major Op.24 ""Spring"" : II.Adagio molto espressivo",Zino Francescatti、,古典、,平静、放松、,纯音乐,,
"Sonata For Piano And Violin In F, K.376:2. Andante",Anne-Sophie Mutter、Lambert Orkis、,古典-古典主义音乐、,放松、,纯音乐,142,
"Kinderszenen (Scenes of childhood), Op. 15: VII. Traumerei (Dreaming) (arr. for violin and piano)",吕思清、,古典-浪漫主义音乐、,悲伤、,纯音乐,127,
"Violin Sonata No. 4 in C Minor, BWV 1017:III. Adagio (Live)",Martha Argerich、Tedi Papavrami、,古典-巴洛克音乐、,,,,
"Violin Concerto No.4 In D Minor, MS. 60:2. Adagio flebile con sentimento",Charles Dutoit、London Philharmonic Orchestra、Salvatore Accardo、,古典-浪漫主义音乐、,爱情、浪漫、,纯音乐,133,
Romance From The Gadfly,Dmitri Shostakovich、,古典、,悲伤、放松、学习、,纯音乐,109,
"Violin Concerto No. 2 in E Major, BWV 1042:II. Adagio",Anne-Sophie Mutter、English Chamber Orchestra、John Mordler、Leslie Pearson、Salvatore Accardo、,古典、,放松、学习、冥想、,,130,
"String Trio in B-Flat Major, D. 581:III. Menuetto: Allegretto",Sergey Ostrovsky、,古典-浪漫主义音乐、,动感、快乐、轻快、,纯音乐,,
"Violin Concerto No. 1, Op. 26 in G Minor:II.Adagio",Jascha Heifetz、Sir Malcolm Sargent、The New Symphony Orchestra Of London、,古典、,梦幻、放松、冥想、,纯音乐,127,
"Sonate pour Arpeggione [violoncelle] et Piano en la Mineur, D. 821: II. Adagio",Jean-Guihen Queyras、Alexandre Tharaud、,,学习、平静、放松、冥想、,纯音乐,,
"Violin Concerto in G Minor, RV 329:II. Grave",Roberto Baraldi、Accademia I Filarmonici、Alberto Martini、,古典-巴洛克音乐、,,英语,,
"Carmen Fantasy, Op. 25:III. Lento assai (Arr. For violin and piano)",L. Edvin Csury、,古典-古典跨界、,,纯音乐,,
Ave Maria:Ave Maria,Various Artists、,古典、,,纯音乐,,
Chaconne in G minor (1993 Digital Remaster):Chaconne in G minor (1993 Digital Remaster),Various Artists、,古典-巴洛克音乐、,平静、放松、学习、冥想、,纯音乐,,
"Adagio in E Major, K. 261",Nathan Milstein、Arthur Balsam、Wolfgang Amadeus Mozart、,古典、,放松、平静、,英语,,
"Suite bergamasque, L. 75:III. Claire de lune",Salvatore Accardo、Laura Manzini、,古典、,放松、,纯音乐,,
"Sonata for Violin and Piano No. 1 in G Major, Op. 78:II. Adagio",Arthur Rubinstein、Henryk Szeryng、,古典-浪漫主义音乐、,平静、梦幻、放松、,纯音乐,120,
"Violin Concerto in D, Op. 35:2. Canzonetta (Andante)",Jascha Heifetz、Chicago Symphony Orchestra、Fritz Reiner、,古典-浪漫主义音乐、,平静、梦幻、放松、冥想、,纯音乐,,
Sonata for Violin and Piano no 3 in c minor op 45: allegretto,Percy Grainger、,轻音乐、古典、,平静、放松、学习、,,,
Nocturne,Janine Jansen、Itamar Golan、,古典-浪漫主义音乐、古典-二十世纪音乐、,热血、动感、,纯音乐,117,
Suite in the Old Style: III. Minuet,Alfred Schnittke、Yuri Korchinsky、Nina Kogan、,古典、,放松、,英语,,
"Concerto For Violin And Strings In E, Op.8, No.1, R.269 ""La Primavera"":2. Largo",Isaac Stern、Israel Philharmonic Orchestra、Zubin Mehta、,古典、,梦幻、放松、冥想、,纯音乐,127,
"Concerto for Violin and Strings in F minor, Op.8, No.4, R.297 ""L'inverno"":2. Largo",Neville Marriner、Academy of St. Martin in the Fields、Alan Loveday、,古典-巴洛克音乐、,梦幻、放松、冥想、,,,
L'Estro Armonico No. 6 in A Minor:II. Largo,Academy of St. Martin in the Fields、Neville Marriner、,古典-巴洛克音乐、,梦幻、放松、学习、冥想、,纯音乐,130,
Arioso (Adagio in G) from Cantata BWV 156 (Arr. Lloyd Webber),Julian Lloyd Webber、John Lenehan、,古典-巴洛克音乐、,平静、放松、学习、助眠、,纯音乐,61,
"6 Songs, Op. 34:No. 2, Auf Flügeln des Gesanges, MWV K86 (Transcr. Capuçon for Violin and Piano)",Renaud Capuçon、Etienne Collard、Jerome Ducros、Ulrich Ruscher、,古典-浪漫主义音乐、,平静、放松、学习、冥想、,纯音乐,61,
String Quartet No. 5 in A Major Op. 18/5: Menuetto,Hagen Quartett、,古典-古典主义音乐、,快乐、爱情、浪漫、放松、轻快、,,,
"2 Sentimental Romances, Op. 28: No. 1 in A Major",Henning Kraggerud、,古典、,快乐、轻快、,,,
"Après un Rêve Op. 7, No. 1 (Arr. for Violin and Piano)",Janine Jansen、Itamar Golan、,古典、,抒情、平静、放松、,纯音乐,135,
Barber: Adagio for Strings,Various Artists、,古典、,大气、,,,
"14 Songs, Op. 34: No. 14. Vocalise in E Minor:Vocalise, Op. 34, No. 14",Maria Kliegel、,古典-浪漫主义音乐、,悲伤、平静、放松、,纯音乐,88,
"Andante cantabile (from String Quartet No. 1, Op.11: arr. Kreisler)",Itzhak Perlman、Samuel Sanders、Suvi Raj Grubb、,古典、,放松、平静、,纯音乐,138,
"Thaïs, Act II: Méditation (version for violin and piano)",吕思清、,古典-浪漫主义音乐、,悲伤、平静、放松、学习、,纯音乐,142,
Sonata for violin and piano Op.134:Andante,Ronald Brautigam、Isabelle van Keulen、,古典、,,纯音乐,,
"Sonata for Violin and Piano No.5 in F major, op.24 'Spring':2. Adagio Molto Espress",Vladimir Ashkenazy、Itzhak Perlman、,古典、,平静、放松、学习、,纯音乐,146,
"Sonata for Violin and Piano No. 3 in D Minor, Op. 108:II. Adagio",Arthur Rubinstein、Henryk Szeryng、,古典、,放松、大气、,,125,
"Violin Concerto In E Minor, Op.64, MWV O14:2. Andante",Daniel Hope、,古典-浪漫主义音乐、,放松、学习、冥想、,纯音乐,135,
"Gabriel Fauré: Sonata for Violin and Piano No.1 in A, Op.13 - 2. Andante",Pierre Amoyal、Pascal Rogé、,轻音乐、,平静、放松、学习、,,,
"Concerto No. 4 in F minor, Op. 8, RV 297, ""L'inverno"" (Winter):II. Largo",Anne Akiko Meyers、David Lockington、English Chamber Orchestra、,古典-巴洛克音乐、,抒情、放松、学习、冥想、,纯音乐,64,
"Concerto for Two Violins in D Minor, BWV 1043:II. Largo ma non tanto",Bath Festival Orchestra、Christian Ferras、Neville Boyling、Peter Andry、Yehudi Menuhin、,古典-巴洛克音乐、,平静、放松、学习、,纯音乐,123,
"Violin Sonata No. 3 in D Minor, Op. 108:II. Adagio",Nathan Milstein、Vladimir Horowitz、,古典-浪漫主义音乐、,平静、放松、,英语,,
"Schwanengesang, D.957:Ständchen",Arthur Grumiaux、,古典-浪漫主义音乐、,平静、放松、学习、咖啡厅、舞会、,纯音乐,125,
"Souvenir d'un lieu cher, Op. 42:no 3, Mélodie",诹访内晶子、,古典-浪漫主义音乐、,悲伤、平静、放松、学习、,纯音乐,142,
"“Air"" from Orchestral Suite No. 3 in D major, BWV 1068",Anne Akiko Meyers、English Chamber Orchestra & Steven Mercurio、,古典、,平静、放松、学习、冥想、婚礼、,纯音乐,59,
"The Four Seasons, Concerto No. 4 in F Minor, RV 297 'L'inverno/Winter' (Op.8 No. 4):II. Largo",Yehudi Menuhin、Camerata Lysy Gstaad、Alberto Lysy、,古典、,平静、放松、冥想、,纯音乐,,
"4 Romantic Pieces, Op. 75, B. 150:No. 1, Allegro moderato",Itzhak Perlman、Michael Sheady、Samuel Sanders、Suvi Raj Grubb、,古典-浪漫主义音乐、,悲伤、平静、抑郁、放松、学习、助眠、,纯音乐,117,
Sonata No.3 in D major: Sarabande (Largo),Henryk Szeryng、Charles Reiner、,,紧张、神秘、,,,
"Violin Concerto in D Major, Op. 61: II. Larghetto",Pinchas Zukerman、Zubin Mehta、,古典-古典主义音乐、,放松、冥想、,,,
Salut D'amour,David Garrett、,古典、,平静、放松、学习、,纯音乐,75,
"Romance for Violin and Orchestra No. 2 in F Major, Op. 50",Chamber Orchestra of Europe、Gidon Kremer、Nikolaus Harnoncourt、,古典-古典主义音乐、,平静、放松、学习、,纯音乐,123,
"Cello Sonata in G Minor, Op. 19:III. Andante",Gautier Capuçon、王羽佳、Sergei Rachmaninoff、,古典、,平静、放松、学习、,纯音乐,211,
"Cello Concerto in B flat, G.482:2. Adagio non Troppo",Julian Lloyd Webber、,古典-古典主义音乐、,冥想、放松、,纯音乐,50,
"Bist du bei mir (Formerly Attrib. J.S. Bach as BWV 508, Transcr. for Oboe, Solo Violin, Strings and Basso continuo)",Albrecht Mayer、Gottfried von der Goltz、Berliner Barock Solisten、Gottfried Heinrich Stölzel、,古典、,学习、放松、悲伤、,纯音乐,60,
"Piano Sonata No.16 in C, K.545 ""Sonata facile"":2. Andante",内田光子、,古典-古典主义音乐、,,纯音乐,,
"Après un rêve, Op. 7, No. 1 (Arr. for Cello and Piano)",Sheku Kanneh-Mason、Isata Kanneh-Mason、,古典、,学习、平静、放松、,纯音乐,134,
"Abendlied, Op. 85 No. 12 (Arr. Grosvenor)",Benjamin Grosvenor、Robert Schumann、,古典、,平静、放松、冥想、,,93,
Ave María (Arr. Víkingur Ólafsson),Víkingur Ólafsson、Sigvaldi Kaldalóns、,古典、,平静、放松、冥想、,纯音乐,65,
"Préludes / Book 1, L. 117:II. Voiles",Arturo Benedetti Michelangeli、Claude Debussy、,古典、,甜蜜、热血、动感、快乐、爱情、,纯音乐,209,
"Eine kleine Nachtmusik, K.525: II. Romance: Andante (arr. piano)",Music Lab Collective、Wolfgang Amadeus Mozart、,古典、,抒情、憧憬、,纯音乐,105,
"Préludes / Book 2, L. 123:5. Bruyères",Víkingur Ólafsson、Claude Debussy、,古典、,平静、放松、冥想、,纯音乐,81,
"Pavane pour une infante défunte, M. 19 (Arr. for Violin and Piano by Louis Fleury)",Manon Galy、Jorge Gonzalez Buajasan、,古典、,学习、平静、放松、,,122,
6 Encores for Piano: III. Wasserklavier,Andrea Lucchesini、,轻音乐、,平静、放松、,,,
"Herz und Mund und Tat und Leben, Cantata BWV 147:Jesu, Joy of Man's Desiring (Arr. for Piano by Myra Hess)",Rafał Blechacz、Johann Sebastian Bach、,古典、,平静、放松、学习、冥想、,纯音乐,120,
"Dances for Harp and Strings, L. 103: No. 2, Danse profane",Prazak Quartet、Jana Boušková、Vaclav Hoskovec、,古典、,放松、,欧美,,
"Concerto in D Minor, BWV 974: 2. Adagio",Víkingur Ólafsson、,古典-巴洛克音乐、,,,,
Children's Corner: V. The Little Shepherd,Jean-Bernard Pommier、,古典-印象主义音乐、,平静、放松、,纯音乐,71,
Ave Maria,马友友、Kathryn Stott、,轻音乐、古典-古典跨界、,平静、放松、学习、冥想、,纯音乐,63,
"Ye Tuneful Muses, Z. T681: Ground in C Minor",Jeremy Denk、,古典、,抒情、悲伤、平静、梦幻、快乐、思念、放松、轻快、,,,
"Andante spianato and Grande polonaise brillante in E-Flat Major, Op. 22:Andante spianato",Eldar Nebolsin、,古典-浪漫主义音乐、,平静、放松、冥想、,英语,,
Adagio Cantabile from Sonata Op.13 (Pathetique),Ludwig van Beethoven、,古典-古典主义音乐、,平静、放松、冥想、,纯音乐,84,
"24 Etudes, Op. 35:No. 22 In B Minor",Narciso Yepes、Fernando Sor、,古典、,放松、冥想、平静、,纯音乐,91,
"10 Preludes, Op. 23:No. 10 in G-Flat Major (Largo)",Vladimir Ashkenazy、,古典、,抒情、放松、治愈、,纯音乐,156,
"4 Gesange, Op. 43: No. 2. Die Mainacht (arr. G. Schwabe and N. Rimmer for cello and piano)",Gabriel Schwabe、Nicholas Rimmer、,古典、,平静、放松、冥想、,纯音乐,,
"3 Piano Pieces, Op. 128: No. 2, Young Birches",Chris Hopkins、,古典、,抒情、平静、思念、放松、,纯音乐,185,
"3 Fantaisies, Op. 16: III. Andante",Doomin Kim、,古典-浪漫主义音乐、,平静、放松、冥想、,纯音乐,149,
"2 Arabesques, L. 66: No. 1, Andantino con moto (Transcr. for Guitar Duo)",Davide Giovanni Tomasi、Marco Musso、,古典、,平静、放松、冥想、,纯音乐,142,
"Glinka: Nocturne f-minor: ""La séparation""",Alexei Lubimov、,古典-浪漫主义音乐、,悲伤、孤独、助眠、,纯音乐,,
"25 Preludes dans tous les tons majeurs et mineurs, Op. 31: No. 1 Lentement",Laurent Martin、,古典-浪漫主义音乐、,平静、放松、,纯音乐,67,
"Sonatine, M. 40:I. Modéré",Martha Argerich、Maurice Ravel、,古典、,平静、放松、学习、,,165,
"Ertodt' uns durch dein' Gute, BWV 22",Jonathan Plowright、,古典-巴洛克音乐、,平静、放松、治愈、,纯音乐,83,
Canon (Over a Basso Ostinato),Peerless 2x2、,古典-古典跨界、,平静、放松、治愈、,纯音乐,91,
"Piano Sonata in G major, Hob.XVI:11:2. Andante",John McCabe、,古典、,放松、治愈、,,,
"Trio In E-Flat, Op. 100 (Excerpt)",Franz Schubert、,古典、,平静、爱情、浪漫、放松、治愈、,纯音乐,61,
Nocturne No.2 in E Flat Op.9 No.2,Vladimir Ashkenazy、,古典-浪漫主义音乐、,平静、放松、冥想、,纯音乐,142,
Hungarian Rhapsodies S.244 - No.11 in A minor / F sharp major:Rapsodie hongroise XI,Franz Liszt、Leslie Howard、,古典-浪漫主义音乐、,平静、爱情、浪漫、放松、学习、,纯音乐,71,
Lieder ohne Worte Op.30:No. 1. Andante espressivo In E Flat,Daniel Barenboim、,古典-浪漫主义音乐、,平静、放松、冥想、,纯音乐,75,
"Meditation from ""Thaïs""",Royal Philharmonic Orchestra London、Frank Shipway、,古典、,悲伤、平静、放松、,纯音乐,138,
"Four Seasons Variation (Arr. for Piano from Violin Concerto, RV 297, ""Winter"":II. Largo by Svetoslav Karparov)",Olga Scheps、,古典、,抒情、思念、放松、治愈、,,,
"Liebesträume - 3 Notturnos für das Pianoforte S.541:O lieb, so lang du lieben kannst!",Leslie Howard、,古典-浪漫主义音乐、,平静、放松、学习、冥想、,纯音乐,65,
"Nocturne No. 9 in B major, Op. 32 No. 1",Tamás Vásáry、,古典、,平静、放松、,纯音乐,129,
"Waltz No. 7 in C Sharp Minor, Op. 64 No. 2",Frédéric François Chopin、Frederick Johansen、,古典、,放松、平静、,西班牙语,139,
"Consolations, S. 172:No. 3 in D-Flat Major",Franz Liszt、,古典、,平静、放松、冥想、,纯音乐,59,
"Images - Book 2, L. 111 - 1. Cloches à travers les feuilles",Pascal Rogé、,轻音乐、古典-二十世纪音乐、,平静、放松、冥想、,纯音乐,,
Nocturne in C-Sharp Minor,Vladimir Feltsman、Frédéric François Chopin、,古典-浪漫主义音乐、,学习、平静、放松、,英语,,
"Piano Sonata No. 14 in C-Sharp Minor, Op. 27, No. 2, ""Moonlight"": II. Allegretto",Igor Levit、,古典-古典主义音乐、古典-浪漫主义音乐、,放松、,纯音乐,,
"Nocturne No. 1 in B Flat Minor, Op. 9, No. 1",Arthur Rubinstein、,古典-浪漫主义音乐、,平静、放松、冥想、,纯音乐,200,
"Les saisons (The Seasons), Op. 37b:No. 6. June: Barcarolle",Ilona Prunyi、,古典、,,纯音乐,157,
"Piano Sonata No. 3 in E Major, D. 459:III. Adagio",William Youn、,古典、,平静、放松、,纯音乐,72,
Sheep May Safely Graze,Johann Sebastian Bach、Egon Petri、Alessio Bax、,古典、,平静、放松、学习、冥想、,英语,,
"Lyric Pieces, op.38:1. Berceuse",Mikhail Pletnev、,古典、,动感、快乐、活力、轻快、,,138,
"Songs Without Words, Book 1, Op. 19b: No. 1, Andante con moto in E Major",Felix Mendelssohn、Guiomar Novaes、,,平静、放松、,英语,,
"Piano Trio No. 1 in D Minor, Op. 49: Andante con moto tranquillo",Schweizer Klaviertrio - Swiss Piano Trio、,古典、,学习、放松、平静、,,,
"Piano Sonata No. 2 in B-Flat Minor, Op. 35:III. Marche funebre. Lento",Arthur Rubinstein、,古典、,放松、,纯音乐,127,
"24 Preludes & Fugues, Op. 87: No. 1, Fugue in C Major",Muza Rubackyte、,古典、,平静、放松、,,,
Sonata Pathétique (Adagio Cantabile),Rudolf Serkin、Ludwig van Beethoven、,原声带、,平静、放松、,英语,,
Piano Concerto No.2 In F Minor Op.21:2. Larghetto,Polish Festival Orchestra、Krystian Zimerman、,古典-浪漫主义音乐、,平静、梦幻、放松、冥想、,纯音乐,139,
6 Consolations S. 172:No. 3 In D Flat Major (Lento placido),Daniel Barenboim、,古典、,平静、放松、冥想、,纯音乐,80,
"Piano Sonata No. 2 In A Major, Op. 2, No. 2:2. Largo appassionato (Live)",András Schiff、,古典、,热血、动感、快乐、活力、轻快、,,151,
"Annen-Polka, Op.117",Wiener Philharmoniker、Herbert von Karajan、,古典、,动感、放松、,纯音乐,82,
"Waltz in F Minor, Op.1",Valentina Lisitsa、,轻音乐、古典-浪漫主义音乐、,平静、放松、学习、,纯音乐,123,
"Piano Sonata No.17 in D minor, Op.31 No.2 -""Tempest"":3. Allegretto",Alfred Brendel、,古典-古典主义音乐、,爱情、浪漫、,纯音乐,75,
Sonata In F Minor (Andante moderato) Kk.466,王羽佳、,古典-巴洛克音乐、,平静、放松、学习、冥想、,,130,
"Waltz No.13 in D flat, Op.70 No.3",Vladimir Ashkenazy、,古典、,动感、活力、,,172,
Images for Orchestra:3. Ibéria-2. Les parfums de la nuit,Bernard Haitink、Concertgebouworkest、,古典、,梦幻、放松、冥想、,,129,
Canon and Gigue in D major - arr. Max Seiffert:1. Canon,Herbert von Karajan、,古典-巴洛克音乐、,放松、学习、助眠、,纯音乐,90,
"12 Etudes, Op.25:No.5 In E Minor",Jan Lisiecki、,古典、,放松、,纯音乐,138,
"12 Etudes, Op.10:No.3 In E",Jan Lisiecki、,古典-浪漫主义音乐、,平静、放松、,纯音乐,142,
"Serenade No. 2 in A Major, Op. 16: II. Scherzo. Vivace - Trio",Johannes Brahms、London Symphony Orchestra、Bernard Haitink、,古典、,放松、清新、,英语,104,
"3 Valses, Op. 64 : No. 2 In C Sharp Minor. Tempo giusto",Maurizio Pollini、,古典-浪漫主义音乐、,平静、放松、冥想、,纯音乐,166,
Les Beautés du Diable,Angèle Dubeau、La Pietà、,古典、,放松、冥想、可爱、快乐、,英语,,
"Danse Macabre, Op. 40, R.171",Orchestre Symphonique de Montréal、Andrew Wan、Kent Nagano、,古典、,热血、动感、放松、,欧美,117,
Appalachian Spring:VII. Doppio movimento (Variations on a Shaker Hymn - Simple Gifts),Aurora Orchestra、Nicholas Collon、,古典、,平静、放松、学习、冥想、,,131,
Brandenburg Concerto No.5 in D BWV 1050:1. Allegro,English Chamber Orchestra、Benjamin Britten、,古典-巴洛克音乐、,放松、治愈、学习、,,,
"Ballet Intermezzo, K.299c (Sketches compl. & orch. E. Smith):2. Contredance",Academy of St. Martin in the Fields、Sir Neville Marriner、Wolfgang Amadeus Mozart、,古典、,放松、可爱、快乐、,纯音乐,132,
"24 Caprices For Violin, Op.1:No. 9 In E",David Garrett、,古典-浪漫主义音乐、,放松、助眠、,纯音乐,163,
"4 Impromptus Op.142, D.935:No.3 in B flat: Theme (Andante) with Variations",Alfred Brendel、,古典、,平静、放松、学习、冥想、,纯音乐,200,
"3 Duets, WoO 27: No. 1 in C Major (arr. F. Hermann for violin and cello):I. Allegro comodo",John Mills、,古典、,快乐、轻快、,英语,,
"2 Arabesques, CD 74, L. 66:No. 2, Allegretto scherzando",Simon Trpceski、,古典、,放松、,,,
"Clavierbüchlein for Anna Magdalena Bach, Book 2, BWV Anh. 113-132: Minuet in G Major, BWV Anh 114",Janos Sebestyen、,古典-巴洛克音乐、,,纯音乐,132,
"6 Moments Musicaux, Op.94 D.780:Moment Musical (D 780/3)",Gil Shaham、Göran Söllscher、,古典-浪漫主义音乐、,梦幻、可爱、快乐、放松、学习、,纯音乐,85,
"Keyboard Sonata in G Major, Hob. XVI:8: I. Allegro",Rudolf Buchbinder、,古典、,悲伤、平静、抑郁、可爱、快乐、爱情、浪漫、放松、,纯音乐,153,
"Concerto No.4 In E Flat, K495: III.Rondo, Allegro Vivace",Wolfgang Amadeus Mozart、Banda Sinfonica “La Artística” Bunol、Henrie Adams、Vicente Zarco Pitarch、Vicente Zarzo Pitarch、,古典、,热血、动感、放松、学习、,意大利语,,
Libertango,马友友、,轻音乐、古典-古典跨界、拉丁音乐-探戈、,清新、爱情、浪漫、放松、,纯音乐,139,
"Grand Galop chromatique in E-Flat Major, S. 219",郎朗、,轻音乐、古典-浪漫主义音乐、,放松、可爱、快乐、,纯音乐,161,
Coppélia - Tableau 1:No. 1 Valse,David Zinman、Rotterdam Philharmonic Orchestra、,古典-浪漫主义音乐、,咖啡厅、放松、热血、动感、,,,
"Divertimento in B-Flat Major, K. Anh. 227:I. Allegro",Oslo Philharmonic Wind Soloists、,古典、,可爱、快乐、放松、,英语,,
"Piano Sonata No.16 in C, K.545Sonata facile:1. Allegro",内田光子、,古典-古典主义音乐、,平静、放松、,纯音乐,133,
"Hungarian Rhapsody No.6 In D-Flat Major, S.244",Martha Argerich、,古典-浪漫主义音乐、,平静、放松、,欧美,,
"Sonata in E Flat Major, K.282: Adagio",George Walker、Wolfgang Amadeus Mozart、,古典、,学习、平静、放松、治愈、,英语,,
Menuett aus Divertimento D-dur KV334,Arthur Grumiaux、,古典-古典主义音乐、,爱情、浪漫、放松、学习、,纯音乐,111,
"Dolly, Op. 56:Berceuse (1894)",Kathryn Stott、Gabriel Fauré、,古典、,平静、放松、学习、助眠、冥想、,纯音乐,133,
"Violin Sonata No.2 in A Major, Op.12 No.2:2. Andante più tosto allegretto",Jacques Prat、Gilles Nicolas、,古典、,抒情、思念、,纯音乐,137,
"Piano Sonata No. 32 in G Minor, Hob. XVI:44:II. Allegretto",Emanuel Ax、,,平静、放松、学习、,,,
Hungarian Dance,Johannes Brahms、,古典、,动感、爱情、浪漫、活力、舞蹈、,纯音乐,133,
"Sinfonia No. 5 in E-Flat Major, BWV 791",Simone Dinnerstein、,古典、,平静、放松、,纯音乐,,
Pieces de clavecin (1724):Rigaudon [arr. Heifetz],Itzhak Perlman、Samuel Sanders、,古典、,可爱、快乐、放松、,,183,
Voices of Spring - Waltz Op. 410,Hallé Orchestra、Bryden Thomson、Bramwell Tovey、,古典、,热血、动感、放松、助眠、,纯音乐,199,
"Grande valse brillante in E-Flat Major, Op. 18",Arthur Rubinstein、,古典、,平静、放松、可爱、快乐、,纯音乐,119,
"Violin Concerto in B-Flat Major, Op. 10 No. 1: I. Allegro",Leila Schayegh、,古典-巴洛克音乐、,热血、动感、放松、,纯音乐,,
"Wiener Blut (Vienna Blood), Op. 354",Budapest Philharmonic Orchestra、,古典、,大气、,,,
"Gold und Silber (Gold and Silver), Op. 79",Cologne Radio Symphony Orchestra、Helmut Froschauer、,古典-二十世纪音乐、,放松、,英语,,
"3 Waltzes, Op. 34:No. 2 in A Minor",Aldo Ciccolini、,古典-浪漫主义音乐、,浪漫、爱情、,,,
"Serenade for Strings, Op.48:II. Walzer",Pyotr Ilyich Tchaikovsky、,古典、,平静、放松、学习、,纯音乐,184,
"Fidelio, Op. 72:Act I: Overture",Wolfgang Glashof、Alan Titus、Gösta Winbergh、Inga Nielsen、Kurt Moll、Edith Lienbacher、Herwig Pecoraro、Péter Pálinkás、József Moldvay、Kalman Strausz、Hungarian Radio Chorus、Nicolaus Esterházy Sinfonia、Michael Halasz、,古典、,助眠、冥想、放松、热血、动感、,英语,,
"6 Variations on an Original Theme in D Major, Op. 76",Ian Yungwook Yoo、,古典、,放松、,英语,,
Symphony No.7 in A major S.464/7 : 3. Presto - Assai meno presto - Da capo [tutto] - Presto - Assai meno presto - Presto,Franz Liszt、Leslie Howard、,古典、,抒情、,纯音乐,,
"Mephisto Waltz No. 1, S. 514",Khatia Buniatishvili、,古典-浪漫主义音乐、,放松、,,,
"Dorfschwalben aus Österreich, Op. 164",Carlos Kleiber、Wiener Philharmoniker、,古典-浪漫主义音乐、,梦幻、放松、,纯音乐,138,
"Antiche danze ed arie per liuto (Ancient Airs and Dances), P. 114:III. Gagliarda",Konstantin Scherbakov、,古典-二十世纪音乐、,平静、放松、学习、,英语,,
The Waltzing Cat,Simon Tedeschi、Leroy Anderson、Paul Mann、Melbourne Symphony Orchestra、,古典、,放松、平静、冥想、,英语,,
Die Nacht (Arr. for Cello and Guitar by Anja Lechner and Pablo Márquez),Anja Lechner、Pablo Marquez、,古典、,学习、平静、放松、,纯音乐,129,
"Streichquartett No. 2 in E-Flat Major, Op. 26: II. Intermezzo. Allegretto con moto",Jerusalem Quartet、,古典、,学习、放松、可爱、快乐、,英语,,
"The Planets, Op. 32:2. Venus, the Bringer of Peace",Herbert von Karajan、Berliner Philharmoniker、,古典-二十世纪音乐、,梦幻、放松、冥想、,纯音乐,127,
"Syrinx for Solo Flute, L 129",Jadwiga Kotnowska、,古典、,抒情、思念、,纯音乐,,
"Valse sentimentale, Op. 51, No. 6",Metamorphosen Berlin、Wolfgang Emanuel Schmidt、,古典、,抒情、,,130,
"Liebestraum No.3 in A flat, S.541 No.3",Claudio Arrau、,古典、,放松、学习、冥想、,纯音乐,128,
